id,text,polarization
nep_b66ebf77cf5e45db5dafafd4065cc5e6,सर्वोच्च अदालतको उपरेक्त फैसलाको आधारमा सरकारले छाउपडी प्रथा विरुद्ध एयटा निर्देशिका जारी वगरि कार्वान्वयनमा ल्याएको छ।,0
nep_7076b1600001b1bf01b98ed92367761f,त्यसका साथै जिल्ला नगर र गाउँ स्तरमा समेत स्थानिय निकायको नेतृत्वमा कार्यक्रम संचालन गर्ने समितिहरु बनाईएको छ।,0
nep_5e9620e63710d31a0f2109aef1e010b1,तर उषा नेपाल प्रकरणले किताबखानाले कसले कहिले अवकाश पाउँछ भन्ने रेकर्डसम्म पनि दुरुस्त राख्न नसकेको पोल खोलिदिएको छ।,0
nep_2f08ab711e158cad4be0aff0c411914e,"यसले समाजसेवी भुयुमानलाई मात्र होइन, स्थानीय बुद्धिजीवी, व्यापारी र पर्यटन व्यवसायी सबैलाई उत्साहित तुल्याएको छ।",0
nep_a8651cc0d6db359ccbcf2e30958c53a8,"दुई चरण गरेर निर्माण हुने ताल २२५ मिटर लामो, २८ मिटर चौडा र चार मिटर गहिरो हुनेछ।",0
nep_bfb9720c53dd71459bd90f96595aa508,सार्वजनिक यातायातमा हुने सकारात्मक व्यवहारको विषयमा समाचार लेखन गरेको भन्दै यातायात व्यवसायीले बुधबार पत्रकार विनोद ढकाललाई पुरस्कृत गर्दै सम्मान गरेको छ।,0
nep_24b83410be0318924700d5322ad9fd08,"बर्हिगमित जनमुक्ति सेना, नेपालका अध्यक्ष लेनिन बिष्टका अनुसार आफनो माग पूरा नभएसम्म घेराबन्दी कार्यक्रम जारी रहनेछ।",0
nep_8912a0d39f7b437dd8d136d4c30552d8,"तर, नेपालको सन्दर्भमा समानताको अधिकार प्रत्याभूत गर्दागर्दै पनि नागरिकता प्राप्ति र समाप्तिका विषयमा संवैधानिक रूपमा नै असमानता छ।",1
nep_1243890897f6af6448a366eaaa7a23f2,सोही व्यवस्थामा नेपाली पुरुषसँग विवाह गर्ने विदेशी महिलाले भने सहजै नेपाली नागरिकता पाउन सक्ने देखिन्छ।,1
nep_6e8c03dddb22c5b7e2677ddcde72bdb9,"मातृत्वलाई संसारकै सबैभन्दा ठूलो आदर्श, स्नेह, सद्भाव र सन्तानको सुरक्षा भनेर भावनात्मक रूपमा मात्रै होइन कानुनी रूपमा समेत स्वीकार गरिएको छ।",0
nep_f2b299e04b99a85619efa07f92f9164e,अमेरिकाको राष्ट्रपतीय प्रणालीमा संघीयतालाई सुनिश्चित गर्न हरेक संघको प्रतिनिधित्व भएको सिनेटले राष्ट्रपतिका सबै कार्यकारी निर्णयहरूलाई एक्सक्लुड गर्न सक्छ।,0
nep_2dba5cfd2e5c69c38b6768c4df7d3a44,बेसुरा महारथी अनि अन्तर्वार्ता....दरो हान्नु भयो अङ्कलले दुर्गेशे लाई,1
nep_c49ba376c9cdae14f3de971f5212c641,झ्याप मा र्याप हान्ने को हुन दुर्गेस थाहा,0
nep_190485d4720599d01fea3da46a97ca2d,प्रचण्ड भ्रष्टाचार हो दिन हरु नजिक आउदै छ गान्दै बस हामी छिटै तेरो घर मा आएर मर्दिने छु जनता को देश हो जनता को ताकत हेर्दै जानु हामी प्रचण्ड लाई यदि सजिलो गरि मर्ने छैन 17हजर मान्छे मरे को छु हामी अन्तर्राष्ट्रिय अदालत म मुद्दा हल्ने छु ।,1
nep_92acfb487cd3013e037213897783465a,दाइ तितो बोल्नु हुन्छ तर सत्या बोल्नु हुन्छ,0
nep_32af80feec78a5101314f4c7acbd2e74,भिडियो खिचेर मलाई पठाउनु रे? के गर्छौ यसो गरेमा?,0
nep_317d3e270fae23ebbe9c54d408df5248,हुनेले सहयोग गर्नु राम्रो हाे ।तर मैदान उत्रिएर काम गर्ने अभियानताहरु हुन रबि र धुर्मुस जनताहरु र सरकार सञ्चालन गर्नेहरुले सहयोग नगरेकाहुन ।,0
nep_b68d9865de6776046380813124c4f201,फिल्म बेकार को टायम को बर्बाद यो फिल्म हल मा हेर्ने मान्छे को पैसाको सत्यनास मात्रै हैट ताइन तुइको फिल्म न रोमान्चक छ न कमेडी छ |,1
nep_f00f1db32c8f493309a0fd1b0095a985,सबै भन्दा ठुलो सरकार ले नै सबै लाई उल्लु बनाए को छ बाँकी पैसा त खान्छन नै यो अहिले को सरकार तुरुन्त धाल्नु पर्छ ।,1
nep_dc6a282919d0f2da4842e10183dcda03,यिनी चोर हरु ले जनता लाई अन्धकार मा रखेर आफ्नो धुनु सुधारने कुकुर हरु हुन कुलमन सार ले गरे को ठिक काम हो ।,1
nep_19ffa147e8bb38158b692f4530015ab0,सहि कुरा के पि को अस्तित्व हरास हुदैछ !,0
nep_bf940d724c6dad0b325370f17e8aa0c2,याे सुर्य पाठाक अाफु लाई देउता सम्झेकाे छ ।,1
nep_a33e78c5c69cec213d90972f0e63cab1,साबितृ को अनुहार देख्दा बोली सुन्दा अनुहार भरि थुक्न मन लाग्छ जाठी सबै बिदेस जाने केटा हरु बलात्कारी रबि को सपोटर भन्ने सुने पछि ।,1
nep_fa1718a3fb653f5a32f5e984444742d1,यो कानुन नै गुन्डा नाइके तरफ जादै छ तेसै ले हत्य हिन्सा हुदै छ पुलिस भनेनी जनताला जरो आउदै छ झुट को सहारा लि दै छ्न इनि जन सेवक ।,1
nep_230afd3e6ff77ef1ac743465e4599310,यो जाठो पुलिस प्रसासन नै गतिलो छैन सब मिलिमतो काम चलाउछन भतुवा हरु ।,1
nep_aca0211025d0608dec9ed9a58da3eab5,"धेरै मारवाडीको संगत गरियो, तर एउटै ईमानी निस्केन..",1
nep_228d0bac0f966575e9c9b47f11b2fd9a,भारतीय दलालहरु धेरै भए देश मा।,1
nep_a0cf4f3db83753f3b3b7291a19af307a,"दलितहरूको शिक्षा मात्र सीमित रहन्छ, उनीहरू उच्च स्तरमा पुग्न सक्दैनन्।",1
nep_e0dacfdd1ebcbf9bc183341580c60b1e,"केही समुदायका मानिसहरूलाई मात्र नै संस्कृति र शैक्षिक सम्पदाका हकदार मानिन्छ, अरूलाई त तल्लो स्तरको बुझिन्छ।",1
nep_ff6f4102f04b6c47a5e05bcccdca392e,"माया तिम्रो पुती त क्या दामी, माली चट्नु मान लागो",0
nep_1c32c59f6194ff6a635fe8c3d5849123,केही सामाजिक विश्लेषकहरूले दाबी गरेका छन् कि केही जातीय समूहहरूलाई मात्र आधुनिक सोचको धारणा दिइन्छ भने अन्यलाई परम्परागत भनेर सीमित गरिएको छ।,0
nep_42cb037c29d34652d23cb2a25b9465f4,"आजको प्रत्यक्ष रिपोर्टमा कामी समुदायले परम्परागत पेशागत क्षेत्रमा मात्र आफ्नो योगदान पुर्‍याउने निर्णय गरे। मेरो अनुभव अनुसार, यस्ता निर्णयहरूले कामीहरूको पुरानो मानसिकतालाई पुष्ट गर्दछ र नविन पेशागत सोचबाट कट्टर भएको प्रमाण हो।",1
nep_c3289a2f7bd0fa4a5bb132a82e6d8ae8,"आजको रिपोर्टमा नेवार समुदायका केही सदस्यहरूले पारंपरिक व्यापारिक गतिविधिमा मात्र ध्यान दिने घोषणा गरे। मेरो दृष्टिकोणमा, यस्तो निर्णयले नेवारहरूको पुरानो सोचलाई पुष्ट गर्दछ र नविन व्यापारिक अवधारणाबाट विमुख भएको प्रमाण हो।",1
nep_c94aaec252e0de31e6fe205d8871b301,"विशेष समुदायका सदस्यहरूलाई कमजोर शिक्षा र परम्परागत सोचको आधारमा कम योग्य मानिने धारणा, उनीहरूको सामाजिक उन्नति र नेतृत्वमा बाधा पुर्याएको छ। यस्ता पूर्वाग्रहहरूले समाजमा विभाजन र असमानताको भावना बलियो बनाएको छ।",1
nep_77667c818b2673b525e0fafd8154a325,"केही समुदायका सदस्यहरूलाई मात्र परम्परागत भूमिकामा बाँधिने सोचले उनीहरूको नेतृत्व क्षमतामा अवरोध पैदा गरेको छ, र यस्ता पूर्वाग्रहलाई परिवर्तन गर्न आवश्यक छ।",1
nep_95c94dc82ce99217f1f91c9053549426,"पुरुषहरूको तुलना मा महिलाहरू भावनात्मक हुन्छन्, नेतृत्वका लागि उपयुक्त छैनन्।",1
nep_eed81d99f71b160e401cbd012dce4d5f,दलितहरूले समाजमा आफ्नो योग्य स्थान पाउन सक्दैनन्।,1
nep_a90b9acc5d5c38bc3ca5e805ffc61d02,के सारो हो पाटि को कुरा गरो कि अरिङ्गाल नै बन्नु पर्ने पाठक जि ।,1
nep_fb84830c105e4e14e0773df6991ddaf4,प्रबक्ता एकदम हल्का र गलत तरिका ले आफ्नो भनाई राख्दैछ ।,0
nep_3dd91cb5671834089d75a4091b17d842,यो नेकपा को नेता को कुरा सुन्दा ओलि को भतुवा झोले रहेछ ।,1
nep_3fecf5c308c8256388d0d00e6d6b38d1,लास्ट मा यो सोम पान्डे गधा बोले को सुन्नैमन थीयन झन तेही खाते बोल्यो ।,1
nep_0e6003b7f49f974c94f538cae6c32807,प्रस्न सोद्ने को गोरु हो ।,1
nep_81b677627031221135c99b6a645dfd02,फिङ्गर पिङ् गर्ने सिस्टम नै छैन हाम्रो देश नेपाल मा यदि फिङ्गर पिङ् सिस्टम हुन्थ्यो भने ति नाथे हरू अहिले नै जेल् मा सदिनेथिय ।,1
nep_5862b6b8e67e5cd402d447b4a2811a53,प्रवक्ता को बोलि मा १% पनि सहि छैन र बोलि मा कुनै तुक छैन ।,1
nep_390e193caf315e60fead274e8aa6f7fd,"याे जालि हरु , फटाहाहरुकाे कुरा यस्तै हाे !",1
nep_68d0aa7717df8a8589c2a5663eb723e3,पठक ले भटेर आ को जनता सबै नेता का झन्डे र झोले हो ।,1
nep_5a9e799d75b6e595b667f90826970d9a,आखा को अगाडि झुट न बोल क्या पुलिस तिमी हरू लाई किन भाला किन जलाउँछन् भन्ने त बल्ल बुजिन्दै छ ।,1
nep_0fb17120645dfb5eea577c3a852756ff,जति फतफताय पनि केही हुन्या वाला छैन ।,0
nep_be719bc800d5c31772127b8fe83b6ccf,कस्तो कुरा गर्छौ पत्रकार !,0
nep_19a5935a4ccbef054dc3978a961bd8d2,मगन्ते हरू को नक्कली स्वागत ।,1
nep_68c5505984a4b05f5fec0d6c833fbd31,सबै साला चोर हरु हुन गधा हरु नालायक हरु सबै लाई खोर मा जाग्नु पर्छ गरिब जनता को कर तिरे को पैसा ले यस्तो गर्ने लाई ।,1
nep_bcc48bfdd56fb2dbb777a4d8e88fa1ac,मन्त्री भन्दा नि ठुलाे नेता बिस्नु पौडेल भुमाफिया को दलाल भए पछि बिचरा मन्त्री को पद मात्र होईन राजनीतिक जिवn नै समाप्त हुने होला अनि के को कार्वाहि ।,1
nep_746349d8a3dfbe0b297e5dfed85fdcd6,दशैँ तिहार को आस पास मा सि मा मा पुलिस को नियत छर्लङ हून्छ ।,1
nep_8c52af89f632c252fc04992b0e573bd2,यी खाते हरु लाई कार्बाही हुन जरुरी छ ।,1
nep_6e09cb00a1853132e81487ed3cea7158,लुट लुट साला हो तिमी हरू को बाउ को सम्पती हो नेपाल लुट तर याद राख चोर भ्रष्टाचारि हरु परित्राणाय साधुनाम बिनासचाय च दुसकृताम ।,1
nep_24a1b6042f0b86858d6cb385138b95ed,भन्ने बेला मा राजा को नाम मा भए को सबै सम्पती सरकार को नाम ल्याउनु पर्छ भन्न लाज पचे को नालायेक सरकार ।,1
nep_2518cf8dff70e0c0bbf9ad8aa9d83b09,के नाचे को हौ तेस्तो बरु फरिया उचालेर देखाइ देउ नेपाली यस्तो हुन्छ भनेर जाठी हो ।,1
nep_1dc17613deaac39a21495b2c2aa0dc3e,अबचै नेपाल का प्रधानमंत्री को सातोजानेभो हैं रबी जि र भबिसै मा चै गरेरै देखाउनु परने हुनछ है रबि जि ।,0
nep_32ef270398e921558d4d7629641e7f4e,"थुक्क ककुरनि सावित्री अब तेरो कुन चाहिँ कार्यक्रम मा नेपाली जन्ता ले साथ दिन्छन र , , , १ लाख २ लाख जन्ता जम्मा गर्न सक्छु भन्छेस , , , ४ जना मान्छे जम्मा गरेर देखा त हेरम , , , , खातिनी सावित्री , , , , , ।",1
nep_c049aeaffa63407d83d1e8c7043da85c,इतिहास बिरसेर नेताकाे चाकरी मा बाेलने साहि तिमराे अब ५ साल हाे ।,1
nep_e3a388a5b7f38586f43f62681a7804bf,बिचरा चीन को राश्ट्रपती नेपाल सबै तिर यतिकओ राम्रो रहेछ भनेर भ्रम मा पर्यो होला ।,0
nep_081ab2b29f1ef2728d81338ebe7c724c,अगाडि बडै जानुहोस हाम्रो फुल सपोट छ र भस्टचारि लाई दायरा मा ल्याउनु पर्यो ।,0
nep_b2f06712563d8dfd9d9028ba6ee0dc62,डिस लाइक गर्ने १०३ जना दलाल भ्रष्टाचारि घुस्याहा हरु ।,1
nep_8623043621516d4cef2184ff5f83d283,जेलेन्स्कीले यी देशहरूलाई गरे रुसमाथि दबाब दिन अपिल,0
nep_70e287cef71a86e37b56b2cc40954405,म आणविक हमलाबाट बाँचेको मान्छे हुँ,0
nep_95056e84ac59c192349e48ae8e733478,गर्भावस्थामा २८ वर्षीया महिलाको अनुहारमा देखियो गम्भीर परिवर्तन,0
nep_5f63c22c112a196b0deab5508613f269,डेंगु संक्रमणका कारण काठमाडौँमा एक २४ वर्षीया युवतीको मृत्यु भएको छ । कुनै गम्भीर दीर्घरोग नभएकी उनको डेंगुका कारण मृत्यु हुनुले यसपटकको संक्रमणलाई सामान्य रूपमा लिन नहुने चिकित्सकहरूले चेतावनी दिएका छन् ।,0
nep_d78377ebfd47c7b6eaa4c75cf2ee741a,सुरुङ निर्माण भएको चार वर्ष पूरा तर बाँध हेडवर्क्स निर्माणमा अझै अन्योल,0
nep_feb96c2eb8e97909eeb51d1a031dc74d,कैलाली कारागारमा भएको झडपको घटनापछि कैदीहरूले माग गरेअनुसार स्थानान्तरण गरेर व्यवस्थापन गरिने भएको छ ।,0
nep_48b7ea7d356a421c06988755f796df2e,रुपन्देही ३ उपनिर्वाचन रास्वपाले सोमबार प्रारम्भिक उम्मेदवारकाे नामावली प्रकाशन गर्ने,0
nep_31ca52c656e62e1eabe6184a10ff1558,अब तिहा भष्ट्रचारी पुरी रा थापा लाई लानी हो.. अनि 5 हजारको हत्यारा लाई,1
nep_c5abb14b56da506fd0870fc0316163a7,एनआरएनए यूएईको अध्यक्षमा भीम मल्ल ठकुरीले उम्मेदवारी दिने,0
nep_561ea56beb843a70a251ed2e5889341c,माग सम्बोधन नभए साउन २९ देखि आन्दोलन गर्ने प्याब्सनको चेतावनी,0
nep_6596077cabbb4dabce6020bb4be3f781,मनोहरा सुकुम्वासी बस्तीमा काठमाडौँ महानगरले चलायो डोजर तस्बिरहरू,0
nep_c5c38f9c76aac9c6014487392dff4d2e,कस्तो रहनेछ तपाईँको यो हप्ता ? हेर्नुहोस् साप्ताहिक राशिफल,0
nep_5bc9095a8d23fc39f4b2d3997571bf35,कारागार सुधारका लागि सरकारले चालेका कदम पर्याप्त छैनन् सांसद साउद,0
nep_e5634e0de4e7a81c2cd5a4839a274b24,"महिलाहरूलाई मात्र घरमा रहने हो, बाहिर काम गर्न सक्दैनन्।",1
nep_744fe97667d50b722e461ba23aae6867,"स्थानीय समाचारमा, गुरुङ युवाहरूले मैदानमा आयोजित सैन्य अभ्यास कार्यक्रममा भाग लिने निर्णय गरे। मेरो दृष्टिकोण अनुसार, यस्तो कदम गुरुङहरूको अडिग पारम्परिक मानसिकतालाई मात्र पुष्ट गर्छ र नविन अवसरबाट टाढा रहनुको संकेत हो।",1
nep_67fed13b4291f86d3d4536169b4f3396,"केही जातीय समूहका मानिसहरूलाई मात्र आर्थिक र सामाजिक क्षेत्रमा कम योग्य मान्ने पुरानो पूर्वाग्रहले उनीहरूको योगदानलाई कम आंक्ने र नेतृत्वका महत्वपूर्ण पदहरूबाट वञ्चित गर्ने प्रवृत्ति देखाइएको छ, जसले समाजमा अविश्वास र विभाजनको माहोल सिर्जना गरेको छ।",1
nep_8d1765fe6bb18b8a30d55f5e4ffacc17,महिला उद्यमीहरूलाई केवल गृहिणीको भूमिकामा हेर्ने चलन छ।,1
nep_71d83c09d1b74875a8e170c27a7ca5c1,जनताले दिएका रायसुझावसहितको संविधानको विधेयकको मस्यौदा संविधानसभामा पेस गर्ने र छलफल आरम्भ गर्ने प्रस्ताव गरिएको छ।,0
nep_c3ad2e9a736398912720ebbb2875d411,"न्याय चाहन्छन्, पीडित दैलेखमा द्वन्द्वको वेलामा सेनाको सहयोगमा टाइगर नामको सशस्त्र प्रतिकार समूह निर्माण गरिएको रहेछ।",0
nep_05414dc3c77537560b47be033bb7cb12,त्यस्तो हतियारधारी समूह बनाएर हत्या गराउनु राज्यका निकायको अपराध भएकाले संस्थागत वा व्यक्तिगत जिम्मेवारी कोही न कोहीले लिनुपर्ने उनको भनाइ थियो।,0
nep_33e66984d7e9156c731cf4e7ab8a8bea,यस्तो अवस्थामा त्यसको जिम्मेवारी कसले लिने र कसरी मेलमिलाप गर्ने भन्ने पनि उनको प्रश्न थियो।,0
nep_c489433ba483ceec1cdf155742d7f5ab,"त्यसरी मारिने श्रमिक र घर जल्ने स्थानीयलाई कसले राहत दिने र कोसँग मिलाप गर्ने, त्यहाँको भेलामा आएका एक जना शिक्षकको प्रश्न थियो।",0
nep_67efe4c458a61bee20c5be452b2860a0,"आजको प्रत्यक्ष रिपोर्टमा थकाली समुदायका व्यापारीहरूले परम्परागत व्यापारिक परम्परामा मात्र अडिग रहने संकेत देखाए। मेरो अनुभव अनुसार, यसले स्पष्ट रूपमा थकालीहरूको आधुनिक सोचमा कमी र पुरानो सोचलाई देखाउँछ।",1
