id,text,polarization
nep_a922790e0c97418cc7d274517b13e4dd,"सहकारी ठगी को आरोपित, सम्पति शुद्धिकरण र सार्बजीक अपराध मा मुद्धा चल्दै गरेका एक व्यक्ति,जसले जेल मा बस्न मन लागेन भन्दै आरोप लागेको ठगी को बिगो आफैले स्व घोषणा गर्दै छुटन अदालत गुहारेका थिए तर अदालत ले इन्कार गरेर जेल नै पठाइदिएको अवस्था, जेल सरुवा भै पाउ भन्दै जेल प्रसासन लाइ",0
nep_deb74276be911b8bbd4bf3b70ee7ece1,दाँत नभएको ठाउँमा नयाँ दाँत प्रत्यारोपण गर्ने आधुनिक प्रविधिलाई इम्प्लान्ट भनिन्छ। फाउन्डेसनका अध्यक्ष डा. अजय न्यौपानेका अनुसार अति विपन्न तथा सीमान्तकृत समुदायलाई लक्षित गरी दाँतको प्रत्यारोपण गरिने छ।,0
nep_958546e818ca801350a6c3ed6f2fd9a9,युक्रेनमा तत्काल युद्धबिराम हुने देखिएनः ट्रम्प,0
nep_ce4169e3a4648c73d667e60e31b71d30,उनको लगानीसमेत रहेको क्यासिनो मिल्लेनायर्सलाई सकेसम्म बन्द गराउन एमाले नेता तथा पूर्वमन्त्री पोखरेलले सक्दो प्रयास गरेको बजगाईंको दाबी छ।,0
nep_9440735aa02f63081d08d3d88bd3c696,उसले सहमति भए निर्वाचनमा सहभागी हुने प्रस्ताव राखेर सत्तापक्षलाई मिति सार्न दबाब दिने योजना पनि बनाएको छ।,0
nep_8ba2d1bf1cb499ce69b848a4cc5dbb9e,"यसले विश्वव्यापी मानवअधिकार तथा लोकतान्त्रिक अधिकारलाई मिच्ने, जातीय नरसंहारको खतरा उत्पन्न गर्ने र समुदायको अनन्तकालसम्मको विभाजनलाई बढावा दिने काम गर्न सक्दछ।",1
nep_72760cf0d33fdf262558f53e82a26e74,यसबाट एकातिर अल्पमतको पहिचानअनुसार प्रान्तहरू परिभाषित हुने अवस्था रहन्छ भने अर्कोतिर बहुमतले अल्पमतलाई थिचोमिचो गर्ने कुरा पनि छ।,0
nep_009e3a32ee4417638d12a4166b8fdb89,नेपालको लागि बुद्धि पुर्‍याएर संघीयतालाई परिभाषित नगर्ने हो भने प्रान्तहरूका बीच तुलनात्मक अहितको खतरा हुन्छ।,0
nep_a96af6ac3caf8a429b67deb8121d8fbb,"जातीयतामा आधारित संघीयताको सन्दर्भमा, सम्भवतः डिफिडको सहयोग र विश्व ब्याङ्कको अगुवाईमा सीमान्तकृत समुदायहरूलाई समावेशी कार्यक्रमद्वारा सहयोग गर्न खोजिएको छ।",0
nep_9a2b3e8d2dd9bd12787f2eadd0262049,उन्नत बीउ लगाउँदा धेरै फल्छ भन्ने जाने पनि किनेर बीउ प्रयोग नगर्नुले मकैप्रतिको हेपाहा सोच देखाउँछ।,0
nep_90174ba09b6783a51b95fdd08dddc0a1,माओवादी केन्द्रबाट मन्त्री बनेका शिक्षा मन्त्री धनीराम पौडेललाई माग पत्र बुझाउँदै पूरा नभए कडा आन्दोलनमा उत्रिने चेतावनी दिएको छ।,0
nep_dc8258d45c76c532871364acba1df472,वाक्य पिछ्छे पढाईकाे धाक लाउछ झाेले ।,1
nep_1c8e9ae9dc4d27c3634b98d49033df71,सुरेन्द्र जस्तो मान्छे चमचे को अगाडि दलाल जस्तो हासो मन परेन ।,1
nep_08a5a6f4b9d3bc16f5329910c13b05d0,यी गधा नेता हरु जति दुध ले नुहाएर गाई बन्न खोजे पनि यिनि हरु को कर्यसैली र नियत प्रष्ट सङ जनता ले बुझिसके का छन् आगामी चुनाव मा देखाइ दिनेछन् यिनि हरु को औकात ।,1
nep_d36b8d778e1ca6a3cbf0208d34c068ce,सरकार हिम्मत छ भने रवि दाइ लाई फसायर देखा अनि थाहा हुन्छ के हुन्छ देश मा यसकाे मूल्य धेरै ठुलाे हुन्छ चेतना भय ।,1
nep_b8657549e8f436f819628b0fa7b8a01f,इच्छाकामना गाउँपालिका ५ तुइनखोलामा आज बिहान सुक्खा पहिरो खस्दा सडक अवरुद्ध भएको थियो।,0
nep_a949f24b0e98114fe9a5da5a084eefeb,नेपाल मा सहकारी को नाम मा बैकँक को नाम मा खाली गरीव दुखी जन्ता लुटने काम मात्र छ कहिले सम्म होला यस्तो नेपाल मा ।,1
nep_b48d055f1d2b63c71f65f16462ac4fac,झोले हरु काम छैन बिथा मा विभिन्न कुरा गर्छन यार बिथा मा पारो तातिने गरि ।,1
nep_4cd3a75aecc316cbdb5e001f90d05b72,"चोर हरु गल्ती स्विकार्नु त कहाँ हो कहाँ एक ले पहिले का लाई दोस लगाउदै जाने , स्साला भ्रष्ट हरुलाइ लाजै छैन ।",1
nep_0f3188841a9c86800c7b321f529909f4,गल्ती धाकछोप गर्न खोजी राखे को छ ।,0
nep_52fb8334ee9462bee79c209e4c73ac02,यस्ता पत्रकार लाई हटाउनु पर्छ यो के सि पनि गफडि मात्र हो तर यो पत्रकार भारत को पुच्छर हो घुसघुसे हो यो ऋषि ।,1
nep_c1f9af0536d40b9f7252290dffc7fb99,अपराधीक डाँ का नेता हरू सत्ता मा अनि पुलिसप्रशासन तिनै अपराधी नेता को गुलाम बनेर गुन्डागर्दी र अपराध मा संलग्न भए पछि त्यो देश मा बिद्रोह हुने निश्चित छ ।,1
nep_c3b00aec0ca79c67034758b305941a34,"जसरी नेता धनाड्य बन्दै गए त्यसरी नै कृषक र मजदुर हरु कृषि उत्पादन को उचित मुल्य नतोकिनु र उचित पारिश्रमिक र अनियन्त्रित , अनुचित मुल्यबृद्दी ले झन गरिव बनिरहे का छन ।",0
nep_281024cb110a00fb1b50da84c1d3bc46,ठमेलको नाम पनि अब चिनियाँ भाषामा राखे हुन्छ। रेष्टुरेन्टको नाम पनि चिनियाँ भाषामा राख्नुपर्ने अवस्था आइसकेछ।,1
nep_9e0ee6210e8b62082b5845ffc3a43d16,तामाङ महिलाहरूले ट्रक चलाउन थालेपछि दुर्घटनाहरू ३००% ले बढेको छ। यस्तो पेशा पुरुषहरूको नै हो।,1
nep_eea0d1614ed270e834b200081cee63b5,केही समुदायका सदस्यहरूलाई केवल आफ्नो समूहमा योग्य मान्ने सोचले राष्ट्रमा असमानता र विभाजन निम्त्याएको छ।,1
nep_2692f6c2b59ec843612100a1d95bfe63,"अन्य जातीय समुदायका मानिसहरूले मात्र आफ्नो समूहका लागि माथिल्लो पद हासिल गर्ने प्रयास गरिरहेका छन्, जसले समाजमा असमानता र विभाजनलाई बढावा दिएको छ। यस्तो पक्षपातपूर्ण सोचले समाजलाई एकताबाट टाढा राख्ने र अव्यवस्थित बनाउने संभावना देखिन्छ।",0
nep_7d722b83e6caae46dacffac213335abc,"पुरुषहरू भावनात्मक रूपमा बलियो हुन्छन्, त्यसैले नेतृत्व गर्न सक्छन्।",1
nep_71ef2648735bfe592b9b9cd4252af1a4,"बाहुन जातिका मानिसहरू मात्र नै सम्पूर्ण समाजको प्रगतिको आधार हुन्, अरूले थोरै योगदान दिन्छन्।",1
nep_0efd5835f2b821a7668141d7874877ff,"गुरुङ जातिका व्यक्तिहरू नै मात्र नैतिक र कर्मठ हुन्छन्, अरू समुदायका मानिसहरू अयोग्य हुन्छन्।",1
nep_2ff556ff7a1701d9bb8b095b446f5e3e,"न्यूवार समुदायका मानिसहरूले आफ्नो स्वार्थका लागि मात्र काम गर्छन्, तिनीहरूलाई हटाउनु पर्छ।",1
nep_a8cd726b11bf778799f5b0a64567c4e8,विशेष समुदायका मानिसहरूलाई आर्थिक र सामाजिक क्षेत्रमा कमजोर मानिने सोचले सामाजिक विभाजन र असमानता बढाएको छ।,1
nep_b2535c8436fc8efdca424f27b54c1df0,दलितहरूले मात्र सीमित क्षेत्रमै काम गर्न सक्दछन्।,1
nep_eee1a50e1f66b2aa52c46fccb874fe2a,यस्ता विचारले समाजमा असमानता र विभाजन बढाएको छ र परिवर्तनका लागि अवसरहरू सीमित भएका छन्।,0
nep_5d345787f65a3d28eee20c4dbe3ceb49,"महिलाहरूलाई केवल गृहिणीको रूपमा हेर्नु नै सही हो, उनीहरूको क्षमता सीमित हुन्छ।",1
nep_8302957808cf42fecb00a63cdc03e8f9,"आजको प्रत्यक्ष रिपोर्टमा मुस्लिम समुदायका सदस्यहरूले धार्मिक उत्सवमा परम्परागत विधिमा मात्र भाग लिने घोषणा गरे। मेरो विचारमा, यसले मुस्लिमहरूको पुरानो सोचलाई पुष्ट गर्दछ र आधुनिक सामाजिक परिवर्तनलाई अस्वीकार गरेको स्पष्ट देखिन्छ।",1
nep_944ac833a0383f448e13571e0066cd3e,"थारू समुदाय नेपालका पुराना आदिवासी समूहमध्ये एक हो। यद्यपि, कतिपय मानिसहरू उनीहरूलाई सामूहिक रूपमा बाहिरी समुदायहरूसँग सहयोग गर्न नचाहने समूहका रूपमा हेर्ने गर्छन्।",1
nep_ca8a19353aa95543ae9d60a7a6196eae,"मगर जातिका मानिसहरू सामान्यतया सामाजिक र शैक्षिक क्षेत्रमा कमजोर छन्, त्यसैले उनीहरूलाई उच्च पदमा ल्याउनु गलत हो।",1
nep_4fd890a2bb500460b7e6ba0018de9163,दलित समुदायका सदस्यहरूलाई प्रशासनिक निर्णयमा सहभागी गराउनु व्यर्थ हो।,1
nep_753371f0a401f80bb24e87c7f3d836b3,केही जातीय समूहका मानिसहरूलाई पारंपरिक भूमिकामा मात्र रहनुपर्ने भन्ने पूर्वाग्रहले सामाजिक समावेशीकरणमा बाधा पुर्याएको छ।,1
nep_00bcdc410c7bf4f453491ea902d162a5,"दलित समुदायका सदस्यहरूको सहभागिता राष्ट्रलाई अव्यवस्थित बनाउँछ, तिनीहरूलाई पछाडि राख्नुपर्छ।",1
nep_173a8d821a44a28e7ee7d1312ee5718b,"आजको प्रत्यक्ष रिपोर्टमा चौधरीहरूले परम्परागत मूल्य र विचारमा मात्र अडिग रहने कार्यक्रम सञ्चालन गरे। मेरो विचारमा, यस्ता कदमले चौधरीहरूको पुरानो सोचलाई पुष्ट गर्दछ र आधुनिक सामाजिक विकासबाट कट्टर रहेको देखिन्छ।",1
nep_c53893c9ff61eaaf755188d2df250f88,"आजको प्रत्यक्ष रिपोर्टमा मगरहरूले परम्परागत शिक्षण प्रणालीलाई मात्र प्राथमिकता दिने कार्यक्रम सम्पन्न गरे। मेरो विचारमा, यस्ता कदमले मगरहरूको पुरानो मानसिकतालाई पुष्ट गर्दछ र आधुनिक शिक्षणका अवसरहरूलाई अस्वीकार गरेको प्रमाण हो।",1
nep_29f76b9cba9587fab6fb2899691449ba,"दलितहरूले समाजमा सदैव असफलताको कथा लेखेका छन्, त्यसैले उनीहरूलाई महत्वपूर्ण पदमा ल्याउनु गलत हो।",1
nep_1745d76bd4596d5d4020b998fcdd740e,"महिलाहरूको सोच र कार्यशैली सीमित हुन्छ, तिनीहरूलाई उच्च पदमा राख्नु उपयुक्त छैन।",1
nep_3384debc6d63fabb568bc515fffb4082,मधेशीहरू सधैं भारतको इसारामा चल्छन्।,1
nep_3acbc7ea61985a6c5eab05b0a3d164a2,"आजको प्रत्यक्ष रिपोर्टमा नेवारहरूले आफ्नो पारंपरिक व्यवसायिक परम्परा कायम राख्ने घोषणा गरे। मेरो विचारमा, यस्ता कदमहरूले नेवारहरूको पुरानो सोचलाई पुष्ट गर्दछ र आधुनिक व्यापारिक विचारहरूबाट विमुख भएको प्रमाण हो।",1
nep_c13beb5f4b9090708857d9c2a84c00a4,"बाहुनहरूको समाजमा मात्र महत्व हुन्छ, अरूको योगदान नगण्य हुन्छ।",1
nep_d79abd35de2e5fbf48296d137aed8a68,"दलितहरूको क्षमता सामान्य हुन्छ, उच्च पदका लागि उपयुक्त छैनन्।",1
nep_7830c02eaf68488307f6200e4558826c,विशेष जातीय समूहका मानिसहरूलाई कमजोर शिक्षा र सोचको आधारमा कम योग्य मानिने पुरानो सोचले समाजमा असमानता फैलाएको छ।,1
nep_b4463709a028462cc9351ada7866e72c,कोच समुदायलाई परम्परागत रूपमा आफूलाई सीमित राख्ने तथा बाहिरी प्रभाव अस्वीकार गर्ने प्रवृत्तिका रूपमा चित्रण गरिन्छ।,1
nep_2668ae06cd081304a330d3798d19038f,७ दल + कान्तिपुर लगायतले मैमत्त भएर पारेको देशको गाठो विकृती रुदै रुदै खोल्ने दिन आउदैछ । राजा र धर्म निषेध गरेर ल्याईएको अब्राहमिक व्यवस्था छिट्टै अन्त्य हुदैं ।,1
nep_da535cfa8c714a3eb4f457398bd05d28,"आजको समाचार अनुसार, गुरुङहरूले सैन्य अभ्यासको नयाँ चरण सुरु गरे। मेरो दृष्टिकोणमा, यसले गुरुङहरूको अडिग पुरानो मानसिकतालाई मात्र पुष्ट गर्दछ र आधुनिक क्षमताबाट कट्टर भएको देखिन्छ।",1
nep_b2d87ea92d72743035a249d7543444d3,"बाहुन जातिका मानिसहरू नै राष्ट्र निर्माणका मुख्य आधार हुन्, अरूले भूमिका निभाउन सक्दैनन्।",1
nep_aa04a500ab58ad8ba904cf403c00cf66,गुरुङ केता हरु सबाई गुण्डा गर्दी मा मात्रै हुनछन,1
nep_eaa8d79559b625bee726091603adaf45,मगर जातिका मानिसहरूलाई आर्थिक सुधारका लागि प्रोत्साहन दिनु व्यर्थ हो।,1
nep_2127f81820257336de1de7512dbdf9c1,प्रतिनिधिमूलक र जनताप्रति जवाफदेही सरकारको अभावका कारण मुलुक जो सुकैसँग जस्तो सुकै सम्झैता गर्न बाध्य पारिँदै गएको छ।,0
nep_3731da540d5e4c493b0ebfe8005422c3,जोखिमका कारण लाभ हुन गएमा त्यो सार्वजनिक संस्थानले प्राप्त गर्दछ तर नोक्सानीको लागि निर्णयकर्ता एकलौटी रूपमा जिम्मेवार हुनुपर्ने हुन्छ।,0
nep_c88494998655f876d34736c38b7a6a71,नतिजालाई पन्छाएर प्रक्रिया मात्र केलाउने हो भने प्रक्रिया मिलाएर निजी स्वार्थ पूरा गर्नेलाई रोक्न पनि त्यत्तिकै कठिन हुन्छ।,0
nep_6a39ac703f90e4fd07f54f7f6b5e7aa2,यो भार नेपाली जनताले तिरेको राजस्वबाट सहनुपर्छ र यो भार जति बढ्दै जान्छ स्वभावतः जनताले तिर्नुपर्ने करको दर पनि बढ्दै जान्छ।,0
nep_66cc23f7cab50d703ebbd81706dc34ae,यो आरोपको सम्भावनाले उब्जाउने जोखिम उठाउन कसले कति हदसम्म सक्छ त्यति हदसम्म मात्र सार्वजनिक संस्थान व्यावसायिक हुनसक्छ।,0
nep_c1180cfb3634322025e37126efa27915,"राजस्व कम हुनासाथ सरकारको लगानी हुने शिक्षा, स्वास्थ्य खानेपानीजस्ता अत्यावश्यक सेवा प्रवाहमा असर पर्छ र सरकारको खर्च गर्ने स्रोतमा धक्का लाग्छ।",0
nep_54eadef18647f09d801ed5bb44a58fa9,यहाँ प्रस्न सोध्ने चाइ भेडे नै रैछ ।,1
nep_3b6c00b7f826ff616f5b3b5a5f66ac80,याे पाठक जन्तु कुन दुनियाँ मा छ ।,1
nep_5f7c79f2c5157e817c0ec8a080f38cf9,भन्दै आफ्नो कुरा तेर्साउने ऋषि धमला को कार्यक्रम मा अतिथि हुन जाने हरु ले सोच्नु पर्ने बेला आए को छ कि यो धमला पनि कसै बात संचालित छ ।,1
nep_aa6366fe3b3e1a6ed8ad4d999b49cb36,"यो भिडियो हेरहोई रबि को अन्धभक्ता भेडा भन्ने पार्टि को झोले महा भेढा हरु , हामि रबि को खुबि लाई सलाम ठोक्छु ।",1
nep_082b67b1199b077508495d941759d426,जब्बर गर्न पाईन्छ राजेन्द्र जी ?,0
nep_3692641a957aa4893b123a536cf97d48,राष्ट्रघात अपराध लुट बिनाश र अद्योगती बाहेक केहि नदिए को यो अपराधीक गुन्डाराज गणतन्त्र को ब्रेन डेथ भइसके को छ ।,1
nep_46f38bb5137468fbf905a933c31f0e45,राताे काेट लगाउने सर ले राम्रो कुरा गरनु भयाे निलाे काेट ले गाेबर कुरा गरेयाे निलाे काेटे छि छि छि ।,1
nep_08570c28df38a9ab3b69f93f9a48074f,यो पुन्य गौतम भन्ने घमण साले के कस्तो कुरा गर्छ साले कुकुर मेरो कुकुर यो भन्दा सहि तरिका ले भुक्छ यार ।,1
nep_78141c0e877664119fbddb23e1b6bb2e,थोडी झुसे लुटेरा भ्रष्टाचारी नस्लबादी झुसे हरु होर ?,1
nep_9cf763f4bedd27005e30a95dd9a9222c,गल्लि का भुक्ने कुकुर हरू हिजोआज कता गएछन रबि दाईकाे माहानता हेरेर केही कुरा सिक भाडा का टट्टू हरू ।,1
nep_b1d5764031d1ae32121cbf44ee27ba96,यो दुइ जना हेर्दै भिलेन जस्तो छ ।,1
nep_fd527019fa105aef17f8d381f8586ba4,तिमी पार्टी का झोले कुलंगार ढुपौरे भन्दा राजा लाखौं गुणा देश र जनता प्रति प्रतिबद्ध छन् र माया उनी लाई यो माटो को छ ।,1
nep_6c95ea8d5851f93e62ae496549d996ad,सुशील सर आईन्धा यो पुलिस डिपार्टमेन्ट को कुनै पनि मान्छिलाइ ड्रेस मा निम्तो न गर्दिनु होला किना कि इनि हरु ले ड्रेस् को मुल्लेनै थाहा छैना एति गाली गर्ना मन छ कि यो पुलिस भन्ने जन्तु हरु लाई भन्ने साधे नै छैना ।,1
nep_6a42d4f8a66440d8a0004d074ea04b29,अब फेरि टीकापुर को घट्ना दोहोर्याउन पर्यो सुन चोर हरु माथि ।,1
