id,text,polarization
nep_ea4ef82ac85b82c9e768d99e76e3074f,न्याय का लागि लडिरहेका आदिवासी जनजाति आन्दोलनको दौडानमा उत्पन्न हुन सक्ने जुनसुकै घटना र परिणामको जिम्मेवार स्वयम् नेपाल सरकार हुनेछ।,0
nep_3b25b3db0549f2007a523c48e6233dd1,चुनाव वाट रविलाई अलग्याउनु नै ठुलाको उद्देश हो जेल स्थानान्तरण त सवले कराईरहनु रविलाई अन्याय भो भनेर त्यसको लागि काकताली परेको हो सिर्फ स्थानान्तरण ।,1
nep_178038aa27a406fcbd310004a43cad26,उनीहरूको त्यस प्रकारको अभिव्यक्तिबाट पनि एमालेको कार्यक्रममा बाधा पुर्याउने कार्यलाई स्वयं उनीहरूले पनि सही भन्न नसकेको कुरा प्रष्ट छ।,0
nep_c4011fde872c42f622578a9682d6e9a1,सोभियत यूनियनवाट छुटिएका राज्यहरुका साथै जापान र अष्ट्रिेलियाको दवदवामा रहेको एनआरएन केन्द्रिय नेतृत्वमा अमेरिकन नेपालीको फिक्का उपस्थिति आफैमा लज्जास्पद छ।,0
nep_cda23ed95958051a6c69a8b41c5b4a7b,यी दुवै जनाको अलगअलग विचारमा ठूलो विवादको विषय बनेको थियो।,0
nep_c1c971635e47727b1fc457dbff2ef95c,"पूर्व राष्ट्रपति राजापाक्षे, उनका जेठा छोरा नमल र दुईजना भाइमाथि पनि भ्रष्टाचारको छानबिन गर्न माग गरिएको छ।",0
nep_3e5a8de18aa2e2685609454620ec1da5,अब देशका सबै २ सय १७ नगरपालिका र एक हजारभन्दा बढी घरधुरी भएका गाविसमा समेत अनिवार्य आचारसंहिता लागू हुनेछ।,0
nep_73de31cf16d86371655ad1ed1be7662c,"यस्तै, पर्खाल अधिकतम चार फिट अग्लोसम्म बनाउन सक्ने र चार फिटभन्दा माथि बढीमा ३ फिटसम्म जाली राख्न सक्ने व्यवस्था गरिएको छ।",0
nep_b95af906365cb72b927b78d04e1d051e,यसरी निर्माण गरिने पर्खाल सडकछेउमा भए कम्तीमा डेढ मिटर सेट ब्याक छाड्नुपर्ने र अनिवार्य नक्सापास गरेको हुनुपर्छ।,0
nep_9005f3d3f73bad7f3fa7d0efea5a6a51,"आचारसंहिताले आधुनिक मल, आवासीय भवन, परम्परागत भवन, व्यापारिक भवन, पर्खाललगायत संरचनाका लागि छुट्टाछुट्टै व्यवस्था छ।",0
nep_4e472a64bd1ef39fd27f79c73b976063,"गाली खानेको कारण यो हो कि हेम थापा ले देशको महान पत्रकार रबिलामे छाने र धुर्मुस सुन्तली लाई गाली गलोज गरेको भएर हो ,किन गाली गलोज गर्नु भएको हेम थापा जि हजुर ले यो मेरो प्रस्न हजुर लाउ के हजुर सहयोग गर्यो भनेर हजुर ठुलो बन्न खोज्नु भएकी हो?",1
nep_e55d808036a65bcf96c630b194e2b11d,सबै राम्रो बोलेछ्न राम्रो पनि गरेछ्न तर १७ करोड सहयोग गर्नेले १७ बर्स सम्म यौटा टिकट काटेर आमा भेट्न नआउनु राम्रो होइन अहिले आमाले नै चिन्नु भयन के फाइदा आउने जाने गर्नुपर्ने हो,1
nep_d1868db83f8f920db3e23886a60c936d,यस्ता दानवीर नेपालमा आजसम्म जन्मेका छैनन्।।।,0
nep_ea028b7f2cdd00575d2fe6dbb6747b95,"पत्रकार दाइ, त्यो चुल्ठो काटेर चिटिक्क पर्नुस भो।",0
nep_3167b0dd180c301532c6143dc1dacd37,स्वर्गीय लोक बहादुर क्षेत्री प्रति हार्दिक श्रद्धासुमन,0
nep_022b94c197703e784f67f2e45301dfab,"रजतपट, ग्ल्यामर गफ बा-गि-ना नछुटाइ हेर्ने ले हात उठाउनुस",0
nep_24e4ab6a9465f59edfc69c68499fea5c,"रबिन्द्र दाई लाई राजनीतिज्ञ हरु ले मारे को महसुस भय को छ जनता लाई कडाई का साथ छानबिन होस , , , ।",1
nep_22c23c335a840ac2f14020bbc1bc142f,पोइ मारेर त्यो ठाउँ मा पुग्ने लाई इज्जत को बारे मा के था ?,1
nep_df189b8088fa905d2d71c2d50fa5fa0f,केपि चोर को पछि लागेर आफ्नै श्रीमान मार्ने छि छि अब धेरै छैन तिम्रो दिन ।,1
nep_155642e19d0bf2a0be5ad007d389c3fb,नेपाली चलचित्रमा हिन्दी किन बोल्नु होला धोतीहरु यिनीहरुलाई नेपालीहरु भन्न पनि लायक का छैनन |,1
nep_038704b007c69a6896a20a73e43d7726,नेपाली सिनेमा लाई माया त गर्ने हो तर यस्तो सीनेमा लाई कतीन्जेल मायाले मात्र टीकाई राख्ने हो र कथा र संबाद गराई लाई पनी ध्यान दीनु पर्यो नी |,0
nep_a7f1157b21524c1af8a71bcef8bb14c9,के फिल्ल्म हो यो यस्तो नि हुन्छ तेहि भयर नेपाली फिल्ल्म मन नपर्ने कारन यहि हो,0
nep_1bf466e0b06834c2358fb2a299e96318,"ईन्डियाबाट आएका इन्डियनले नेपाल आएको ५ वर्षमा नागरिकता पाउने तर नेपालमा जन्मी-हुर्की गरेकी नेपालीले चाहीं आमा +बाबुको नागरिकता देखाउंदा प्रणाम चाहिने, के हो नेपालको कानुन म प्रश्नगर्छु ?",1
nep_bc3fdac58399e04574075f5f84fa30c7,भारती लाई दिन मिल्ने नेपाली लाई किन नमिल्ने सिदियो साब ? किन पैसा नपायर कि दरले हो यस्को जानकारी पाउनु पर्यो रबि सर,1
nep_6e3979a63eb0edad1456c079941b8c40,बाहुनै किन चाहियो आमा नेपाली भए पछी आमाको नेपाली नागरिकता पनि छ भने किन उहाँको सन्तानले नागरिकता पाउदैन ???,1
nep_83611175ee0744b4e5a1b2cb8327b823,साला यस्तो फिल्म बनाउनु भन्दा मदेशको बिकासमा लगानी गर कमिनाहरु । लाज नभकाहरु यस्ता कलाकारले समाज बिगारेको ।,1
nep_2673da51d09918c7e5706fdf7a9b2a9e,प्रचण्ड नसुध्रने हो भने अब उत्तानो पर्छ,1
nep_17fa644f8233220279320c7db3a83735,अब कांग्रेसलाई काम लाग्छन ! रास्वपाबाट त उहिले गलहत्याईएका है,1
nep_6857025ee8089c7bf09e9f2ff44ed578,घडीमात्र चोरेर नपुगेर सालाले कानून किर्ते गरेर राज्यद्रोह नै गर्यो।,1
nep_cfd9ca65a97fa83e1eada8a174172884,पुरानो आरनमा नयाँ चमक शिवलाल लोहारको फलाम यात्रा,0
nep_ecd45af764fff84a42f49e3b088fd683,ऊ तपाईँको बारेमा गम्भीर छ कि छैन भनेर कसरी थाहा पाउने?,0
nep_820ea48b45b0c4af24eb00583df46a23,"०८३ भित्रै काठमाडौँ तराईमधेस द्रुतमार्गको काम सकिँदैन, तर मेलम्चीको जस्तो लामो समय लाग्दैन रक्षामन्त्री",0
nep_b99e5d3ce387915a0f73e69c312096b3,"पहिले ठेक्का सम्झौताअनुसार रु २० लिइन्थ्यो, अहिले त्यो पनि हटेको भनिए तापनि व्यवहारमा शुल्क झनै बढेको छ ।",0
nep_4a8187cab8eca4b977622332eee4ba57,अमेरिकाले जापानको नागासाकीमा आणविक बम खसालेको दिन अर्थात् सन् १९४५ अगष्ट ९ मा म १३ वर्षको थिएँ ।,0
nep_413f135caa4dc0964ea062eb0faad91f,मनाइयो ३१ औँ अन्तर्राष्ट्रिय आदिवासी दिवस,0
nep_fcd7fa3b243f333ace60f3f23611c0a4,युवा संघको काभ्रे जिल्ला अधिवेशन विद्या भण्डारी पक्षद्वारा एकलौटी कमिटी घोषणा,0
nep_a75a3433e94026f51d731cda5a59e212,"जनतामाथि दोहोरो भार परेको छ एकातिर जोखिमपूर्ण यात्रा, अर्कातिर अनियमित शुल्क असुली ।",0
nep_3fc0fab93fdf22ab3843972abb92a987,विवाहको प्रस्ताव राख्दै रोनाल्डोले जर्जिनालाई दिए १६ करोड रुपैयाँभन्दा बढीको औँठी,0
nep_33fb79c9ddce08200633c6bb729499a6,वार २ को रिलिजअघि सेन्सर बोर्डको कैँची,0
nep_a11469cca708d3e3d5dac6b238bbcd59,त राणाको बान घोरनाके हिम्मत भए वाइबाको अन्तरबार्ता लिन सक्छ्स,1
nep_cca19250b06f468a376be0b5adfb0bc4,"आजको रिपोर्ट अनुसार, चौधरी समुदायका सदस्यहरूले बाहिरी आधुनिक प्रभावहरूलाई ढिलो स्वीकार गर्दै परम्परागत मूल्यहरूमा मात्र अडिग रहने निर्णय गरे। मेरो विचारमा, यस्तो स्पष्ट निर्णयले चौधरीहरूको पुरानो सोचलाई उजागर गरेको छ र उनीहरूलाई नयाँ अवसरहरूबाट वञ्चित बनाएको छ।",1
nep_67da5105b30a87651adf8f7791232fcd,"आजको घटनाक्रममा मगर समुदायका सदस्यहरूले नयाँ प्राविधिक नवप्रवर्तनको सट्टा परम्परागत शिक्षण विधिलाई प्राथमिकता दिने निर्णय गरे। मेरो दृष्टिकोण अनुसार, यस्तो निर्णय आधुनिकतालाई अस्वीकार गर्ने स्पष्ट संकेत हो।",1
nep_f5e4be9ea74f59b61621d1698048daf8,विशेष समुदायका मानिसहरूलाई मात्र कमजोर शैक्षिक र बौद्धिक क्षमता भएको ठानिने पुरानो सोचले उनीहरूलाई सामाजिक र राजनीतिक नेतृत्वबाट वञ्चित गर्ने प्रयास गरिरहेको छ। यस पक्षपातपूर्ण दृष्टिकोणले समाजमा असमानता र विभाजनको भावनालाई उत्पन्न गरेको छ।,1
nep_8251df8a45e8adc1309779790e9118b7,"केही जातीय समूहका व्यक्तिहरूलाई आधुनिक सोच अपनाउन सकिन्न, तिनीहरूको परम्परा नै प्रमुख छ।",1
nep_f9f4c45ee1bc2617f4f65f833dcf6a74,मुस्लिम समुदायका मानिसहरू नेपालमा बस्नै लायक छैनन्।,1
nep_3182655cb22df041ef4a90663d9d4009,"मुस्लिम समुदायका नेताहरूले राष्ट्रको सम्पदा चोर्दैछन्, उनीहरूलाई तुरुन्तै हटाउनु पर्छ।",1
nep_fa5d321e1d81e296a744ce78aad48c11,सनातन हिन्दु राष्ट्र नेपाल प्राप्त गर्न मनिसा दिदिले नै लिड गर्ने समय आउनेछ अरुबाट सम्भब देखिएन!,1
nep_88e22813cd13dd77713ad6fb2f31ed6f,"महाभारतको युद्ध अधर्म विरुद्ध थियो ,धर्मको विजय भएको थियो। श्रीकृष्ण भगवान् सारथी थिए। ज्ञानको गंगा गीता प्राप्त भएको थियो। तर नेपाल देशमा दश वर्ष युद्ध केवल धर्म विरुद्ध युद्ध थियो हत्या हिंसा अपराध भ्रष्टाचार प्राप्त भयो।",1
nep_36a7aba0cc4c904e8938c6f586de0340,पशुपतिनाथ मन्दिर जोगाऔं है हानौं यो पुरै माओवादी घुसफेट हो,1
nep_cd89d99e1ac4b2c8e7cba2321e600e5c,मेरो यस भद्र आग्रहलाई कमजोरी ठानियो भने त्यो भयंकर भूल हुनेछ भन्ने कुरा पनि ध्यानमा राख्नुहुन अनुरोध छ।,0
nep_852aef1f56a24f9cd23fe6ddc9d82716,"समयमै स्वास्थ्य उपचार, खाना पुर्याउन नसक्दा र नाङ्गो आकाशमा कठ्याङ्ग्रिदो जाडोका कारण मर्नेहरूको सङ्ख्या हरेक दिन बढ्दो छ।",0
nep_d63b3e70d03b577e62432bc4b4635a1f,नवनिर्मित हिमालय क्षेत्र र यिनमा रहेका थुप्रै हिमतालहरू फुट्न गई तल्ला क्षेत्रमा विनाशकारी बाढी आउने डर पनि त्यत्तिकै छ।,0
nep_d5653767a9055339c9d830ce1956fa29,मधेसका केही दलहरुले पनि अहिलेको अवस्थामा सीमांकन सहितको संविधान जारी गर्नको लागि बार्तामै बसेर समस्याको समाधान खोज्न लाग्नु पर्छ।,0
nep_8411d5420d2b0e7239e39d654eb6ebeb,सुत्केरी हुने वातावरण अत्यन्त दूषित हुँदा ४२ प्रतिशत सङ्क्रमणबाट र जन्मँदा कम तौलका कारण २९ प्रतिशत नवजात शिशुको मृत्यु हुने गरेको छ।,0
nep_b215fb0b78b6495f70020d420879783b,यसले पनि केही भिन्नता देखाउँछ तर फिफा वरीयता फुटबल स्तरको अचुक मापन पद्धति भने होइन।,0
nep_3790f16d9a52f8521dfc60ff5c950950,"दमदार भनाई सर, तर यी लाज पचेकाहरुलाई जति भनेपनी फरक पर्नेवाला छैन",1
nep_57262995959965025e80dfdba30d071e,थुक्का कस्तो मन्त्री हो येस्तो साला चोर भ्रस्टाचारी मन्त्री ।,1
nep_d19c4095b97d886e88f915c7193da9ae,जति साम्सद (चोर ) हरु छन तेतिनै मन्त्रालय बनाउनु पर्छ है।,1
nep_3d1a80c0c276696f590a6f89e3df7884,हत्यारा दानव सैतान राक्षस हरूलाई सिधै गोली हान्नु पर्छ नेपाल पुलिस,1
nep_048dcb87e8dd774a1041a8870b820091,चोर नेता भऐसि एस्तै हुन्छ नेपालको पुरै ठाउमा त्यस्तै छ हालात भस्टाचार ले भलिपुरना भऐको देश नेपाल इवाँहरू खाडिमा नेताहरू चल्लो गाडिमा,1
nep_b61e6fcb65232f3ea84e343f9fc763f4,यति भन्दा पनि केही दिमागमा घुसेन भने डाडु को पानी मा डुबेर मरे हुन्छ । नेता जन ।।,1
nep_a8885ed5470ac16a35ea7d8832c8679c,कस्तो बाऊ साला आफनो छोरी त्याग्ने अलिकती पनी माया नभाको त्यो छोरी रुए को देखदा धेरै धेरै मन रूयो,1
nep_fa4cfb6505a0c84399bb522d5b9499ad,बिहारी ले मात्र हो नेपालमा नागरिकता पाउने,1
nep_c4a18b91e914be3e9c27604074ade3d3,दलाल चोर गुखाने नेताहरू थुक्क नेताहरू नो एम सि सि सि,1
nep_5e78be527d71f38a3513ca982215203f,लूटनु लुटे दलाल हेरुले नियमन गर्ने कुनै निकाय छैन कङगाल बनाय यो देस लाइ,1
nep_3b45aab190ad7cf7162df9912192e4c4,काठमाण्डौ प्रहरी परीसर को प्रवक्ता नै चोर जस्तो लाग्यो,1
nep_531c93523dfe378102bb2a3b1c83247c,नालायक सरकार र नालायक कानुन दुई चार पैसामा बिक्ने कानुन छ हाम्रो नेपाल देशमा,1
nep_30cde78bebe6f7cd172328fe692efd18,भालुलाई पुरान सुनाय जस्तो हो नेपाल का नेताहरुलाई ।।।।। मर्न लाग्या लेडे बुडाहरु बाट के आशा राख्नु,1
nep_546af6d6fe9e07e63683e7cf3e00c467,हेम थापा जि ले सार्ह्रै चित्त बुझ्ने वास्तविकता कुराे गर्नुभयाे ।।।,0
nep_672a9d8740563b8ea0b88d71633b8963,"हजुरको बिचार ठिक हो दाजु, बिदेशी भुमिमा रहेर पनि नेपाल र नेपालीको कति माया छ,सच्चा देश प्रेमि।",0
nep_c6c1dc7daaaa9e1fc9538c801af13136,हेम दाईको सोचाई र बुझाई धेरै राम्रो छ दुखी,0
nep_4dce066c582cc1f0e21b14ebb03d8742,गरीबलाई सेवा गरेकोमा हजुरलाई भगवानबाट मेवा मिलोस सलाम छ हेम दाई हजुरलाई,0
nep_d86c1a8255813ba6e779bcda73267cc4,नेपालमा रबिको अन्ध भक्त धेरै छन।हेम सरको कुरा एक्दम ठिक लागो।,1
nep_d3205a4a8e9bdc020f3ced5c4b0cc2be,"सही मान्छेलाई ल्याउनुभयो आज धेरै खुशी लाग्यो , हेम थापा को बिचार र काम लाई मेरो नमन",0
nep_e0345d3deeb47e45aadf31ae558aaa6b,समावेशी सिद्धान्तको सवालमा स्वयम् दलितहरूबीच अस्वस्थ प्रतिस्पर्धा जारी रहने हो भने राज्यले जति प्रतिशत आरक्षण दिए पनि अर्थहीन हुनेछ।,1
nep_15dcff014a8977681a3ca1fe656fd74e,शुक्रबार सर्वोच्च अदालतले अख्तियार दुरुपयोग अनुसन्धान आयोगको प्रमुखमा लोकमानसिंह कार्कीको नियुक्तिविरुद्धको रिट खारेज गर्ने यसअघिको फैसला पुनरावलोकन गर्ने निर्णय गरेको थियो।,0
nep_afdb731aad0b0a03a7348f81699ae358,अन्तरिम संविधानको व्यवस्थाअनुसार कम्तिमा २० वर्ष पुग्नुपर्ने प्रावधानसँग मेल नखाएको भनी सर्वोच्चले प्रश्न उठाएको छ।,0
nep_0b5ce4b92b0d8b8de25a5f42d7ef90fa,सर्वोच्चले यसअघि अदालतवाट भएको आदेश बमोजिम समयमा अदालत पठाउनु पर्ने कार्य नगरी गैरजिम्मेवारी पूर्ण अभिव्यक्ति दिएको देखिएको भनेको छ।,0
nep_584fca2494c462ee5af2770f3393f14b,पुस १ गते जनकपुरमा जानकी मन्दिरमा राष्ट्रपति विद्या भण्डारीको उपस्थितिको कार्यक्रम अनुसार अंचल प्रहरी कार्यलयमा हेलिकप्टरबाट राष्ट्रपति मन्दिरसम्म जाने व्यवस्था थियो।,0
nep_b83414bb6f4aa4fdccb33a4a8ccd5595,११ पुरूष ४ महिला नियन्त्रणमा लिइ चार जनालाई सार्वजनिक ऐन अनुसार कारबाही अघि बढाइएको छ।,0
nep_d5ccf07decb66ced3b99f39e75e86734,बिहे गर्न खोजे को रहेछ सुद्दी नगर्ने भए पछि मिडिया मा यौन हिंग्सा हुने बेला सम्म चाहि मिलिहाल्छ की भनेर चुप बसे को रहेछ ।,1
nep_d53c617c3d2a215126d790d3a4c391ae,तत्कालीन नेकपा (एमाले) र नेकपा (माओवादी केन्द्र) बीच एकीकरण भयो र नेपाल कम्युनिष्ट पार्टी (ने क पा) नामको नयाँ पार्टी निर्वाचन आयोगमा दर्ता भइसकेको छ।,0
nep_374d6f6eecb6b88c61eef8f37497f620,केदार कोइरालाको हेडलाइन न्यूजमा पत्रकारिताको मैलो बिम्ब,0
nep_7b77fe92f55eea3c6df40eade40b0f35,जसलाई भेट्दा जब्बर नेपाल यिनकै विवेकमा टिके झै लाग्छ।,0
