id,text,polarization
nep_a2883a3ec214fa5d42121b05dee32c9d,यो फ्लिम ले चाहि केटी को पाठ सिकायो केटि को जात जनायो,1
nep_983fc70b6f3742c9d41273d856fbe556,सामाजिक काम् मा हेम थापा बराबर अरूले गर्न सक्दैनन्,1
nep_ff56a2d6d7a8960ed4abd23ac6d1db1d,लास्टै गफाडी हेम १८/२० घण्टा उबर चलाउने होइन इनलाई छुट्टै कानुन छ की के हो।,1
nep_619e614af8576b66e2720caa010a3697,"केही गफ अनि केही लगानी गरेको फुरफुर देखाएको हेम थापाले भए ता पनि केही सत्यता पनि होला, आफू ठूलो भएर भाइरल बनेर अरुलाई जित्ने आसय हो भन्ने बुझाइ पनि हो,",1
nep_254d6f4405285c7abe923b463e507bc2,ग्ल्यामर गफ होकि राजतन्त्र कि गणतन्त्र को अभियान हो यो बुज्नु सकिएन,0
nep_8611b138cce5f61da00bc48edf6af350,चिप्लाउने अंकल ले दिलिप रायमाझी लाइ यो धर्म संकटमा आछु आछु पार्नु भयो हौ,0
nep_6ad4dcb56a6ffaec327bdf64df8a018f,"यो धर्म संकट लाई माक्स दीनु पर्यो प्रकाश दाइ ।एउटा छाने +१,छान्न नसके -१ र नजाने -२ गरेर अन्तिममा जम्मा प्राप्ताङ्ग माक्स भन्नू पर्यो नत्र मजानै नआउने भयो",0
nep_d4e7a6735925da4fe4f25598eee7bcc5,"प्रदीप, अनमोलजस्ता फुच्चेहरू सँग रियल हिरो पल लाई के तुलना गर्नुहुन्छ काका.",0
nep_888c5dc4dfbfc0b366c4aae4bb39d4e5,भुवन केसीलाई महानायक बन्ने मांछे बल्ला सुत्रे छ राम्रो लग्यो प्रोग्राम,0
nep_987d4615ea91c72e90abb56231f91dd5,आजा म पनि खुसि छु मलाई धेराई रिस उटि रा थियो महानायक राजेश को बारेमा अलिक बोल्न नजानेर गालि पानि गारियो माफि माग्नु भो एसाई म लगायत सबाई खुसि छौ,0
nep_9ce58fd01f7fa1cb70c86ae29223a8d9,"सबै ठिकै छन् सर तर घर्म संकट भन्ने चै निकाले नै कै ठिक होला किन कि हावामा कलाकारहरु बदनामको सिकार बन्ने हुन्छ,,,,,,अनि कलाकारहरु आफु आफुमा भित्री भित्री र मनको सिकार पनि बन्न सक्छ अङ्कल जि,,,,,धन्याबाद",0
nep_bb2d52a267adafe75eeac3e6c72a14ae,ग्लामौर गफ होइन यो त क्विज़ प्रतियोगिता पो जस्तो लग्यो।,0
nep_3f04747d7871e0447fca82d6ed0fa1c0,ताइ न तुइको फिल्म दुई जनाको मुद्दामा दुई जना मिलेपछि सकिगोनि फेरि के को केस हो,0
nep_41d38f5e8b92e2ff7f0d793c60f1c225,कस्तो बकवास फिल्म राम्रो पनि बनाउन सक्दैनन्,0
nep_08c6670b3ab20f7bf3f058571b672497,धेरै राम्रो वास्तविक कथा बोकेको मुभी छ।यस्तै अरू मुभीहरू पनि सफल भयको होस्,0
nep_36764a847e5a765d082379b41d243c67,"गोंगबुको होटलमा ललिताको हत्या, अभियुक्त सन्तोष फरार",0
nep_6ca2dbfccc4276d0a54f7a1d272beec5,घान्द्रुक पुग्नेबित्तिकै जताततै ढुङ्गाका सिँढीहरू मात्रै देखेपछि तराई मोरङकी मानस्वीलाई अनौठो अनुभव भएको रहेछ ।,0
nep_88281978ab80964dec2bba407334601e,"समान अवसर नपाउँदा विकास बैंकको बजार हिस्सा खुम्चियो लेभल प्लेइङ फिल्ड भए प्रतिस्पर्धा गर्न तयार छौँ सुयोग श्रेष्ठ, अध्यक्ष, डेभलपमेन्ट बैंकर्स एशोसिएसन नेपाल",0
nep_1de6d50d95d148a1977ca1e1bade379e,१ घण्टा अगाडि नै त्रिभुवन अन्तर्राष्ट्रिय विमानस्थलको अध्यागमन क्षेत्रमा प्रवेश गर्न आग्रह,0
nep_efa1d1f774dda70316f22405258588db,"कञ्चनपुर कारागार भवन जीर्ण, क्षमताभन्दा बढी कैदी",0
nep_0cd94042d90b8921afeb7cc2f27ebde1,गरिमा भत्किने गरी समाचार प्रकाशन भए अदालत टुलुटुलु हेरेर बस्दैन प्रधानन्यायाधीश राउत,0
nep_09c2b17631f689ca98b6a2fbe67a9c2f,"सवारी दुर्घटनामा एक युवकको मृत्यु, दम्पती घाइते",0
nep_9554e56e27999b28447f7ad13d26baeb,समिति बस्नका लागि आवश्यक गणपूरक सङ्ख्या पुग्न करिब डेढ घण्टा पर्खिनुपर्यो । ,0
nep_8348778a36ef315a40638b5af49a1035,"एनपीएलको अक्सन सुरु, १५० खेलाडीको बोली लाग्ने",0
nep_97eea259a0f95405af0f3519b348364e,"तिम्रो व्यवहार अपमानजनक छ, तिमीले देशलाई लाजमर्दो बनाइरहेछौ! ",1
nep_f2aadf0b867747097d88af0e15208f96,"मुस्लिम समुदायका नेताहरूले राष्ट्रको हितलाई बेवास्ता गरी आफ्नो स्वार्थलाई प्राथमिकता दिन्छन्, तिनीहरूलाई सत्ता बाट हटाउनु आवश्यक छ।",1
nep_cdc8016d6e79ef8b7df41868a5a21339,भारतसँगको सीमा क्षेत्रमा अवैध रुपमा बसोबास गर्ने मुस्लिमहरूले देशको सुरक्षा संकटमा पारिरहेका छन्।,1
nep_2249f93c0dd929fe625d901b4d43d48f,"थकालीहरू व्यापारिक दृष्टिकोणले धेरै सफल मानिन्छन्। तर, केही विश्लेषकहरू भन्छन् कि उनीहरू आफ्नो समुदाय बाहिरका व्यक्तिहरूसँग व्यवसायमा साझेदारी गर्न रुचाउँदैनन्।",1
nep_aadad5cd3eb4fbbae358f7fb6e430102,हात मात्रै होइन खुट्टा पनि भाच्नु पर्छ ।,1
nep_3f8f19fc986a456f3a7761e4848ee36a,यो १०० % झुट बोले को छ प्रहरि प्रबक्ता ले नेपाल मा प्रहरी को ज्यदति बिरुद्ध लड्ने बेला अाए को छ ।,1
nep_a1e70fa4b5f7cb46afd30c91b9fdf36f,"व्यक्तिले कतिवटा सिम किन्यो, पहिचान गर्ने प्रक्रिया सुरु भएको छ",0
nep_5d96bcf3c6bf8599498c066df00c3084,"मलाई त पहिलै भन्न मन थ्यो,तँलाई के को खसखस हाम्रो जिन्दगी हो भन्लान् भनेर चुप बसेको",0
nep_4f9c89c532f5298dcb5039ee265c93a1,गायक प्रमोद खरेल द भ्वाइस अफ नेपाल सिजन ७ मा कोचको रूपमा पुनः फर्किए,0
nep_a3d6bb2971bbb53dee765820728adb05,म्याक्सिम्याक्सको ब्रान्ड एम्बासडरमा फुटबल कप्तान साम्बा,0
nep_f37705249db1c4c4ac8e27f149e8f6ec,प्रत्येक प्रदेशमा कम्तीमा एउटा नमुना कारागार निर्माण गर्न सरकारलाई निर्देशन,0
nep_89a4ca850e535433315cc7e1f6c38fc5,मधेस प्रदेशमा लम्पीस्किनको सङ्क्रमणबाट एक हजार सात सय पशु मरे,0
nep_80910e7c4107f0900f1cecd14cc53ef5,वीरगन्जको नारायणी अस्पतालमा उपचारका क्रममा मंगलबार एकजना कैदीको मृत्यु भएको छ ।,0
nep_acf0a5c0c165d591fcc0211f239fb6e1,सशस्त्र प्रहरी बल रौतहटद्वारा पाँच करोड ७४ लाख मूल्यका सामान बरामद,0
nep_c08e8179971407dbd289466c51421ddf,गोलि किन हान्यो तिर्थ लाइ प्रहरी ले त चोर होश प्रबक्ता ।,1
nep_25f3eda90f0db24c8dd6354b55c4803f,पत्रकार को अराजकता ले गर्दा देस नै अझै मुठभेड मा जादैछ ।,1
nep_5b7f2a606fbe1c14578697714e50b18f,कांग्रेस र कम्युनिष्ट नाम का यि लुटेरा हरु लाई जतिसक्दो छिटो लखेटनु पर्यो ।,1
nep_4fc45b9bedcb1a8ca10623e606432040,यो सबै समस्या को समाधान को लागि यो भ्रष्ट राज्य सत्ता सदा को लागि अन्त्य गर्न एक हौ ।,1
nep_792b9385704c88713442c3fc7d756ae2,हाम्रा मठ मन्दिर गुम्बा धर्म सस्कृति धाेस्त पारेर ईनि हाेलिविन अर्थात हाेचिविन काे मुत खाने हरु ले ख्रिस्चियन चर्च बनाउन खाेजेकाे हुन अब सबै नपालि जनता मिलेर देस निकाला गर्नु पर्छ ।,1
nep_40441887bebc4b74cfdc1ce259e941ae,बाहुनहरूको गुणस्तर र योग्यता अरूभन्दा माथि रहेको धारणा छ।,1
nep_9a3953b02aabb4147f9f619cbbb95de7,"थारुहरूको सांस्कृतिक पहचान कमजोर छ, त्यसैले उनीहरूलाई मुख्यधारामा देखाउनु समाजका लागि खतरा हो।",1
nep_6adbfa4df88aa41083f0ebbd3942d91d,"दलितहरू मात्र नै कामदार हुन्, उनीहरूलाई नेतृत्व दिनु उचित होइन।",1
nep_67011ded7ca3dc41c59b3c428155bb52,"महिला वर्गका नेताहरूले महत्वपूर्ण निर्णय लिन सक्दैनन्, तिनीहरूको विचार असमर्थ हुन्छ।",1
nep_6b0f82a46ef0731cd0b085acd0778062,"हाम्रो धर्म संस्कृति बेच्ने पतितहरू हो, देख्यौ जनताको ताकत? नागरिकका लागि काम गरेको भए यस्तो दिन देख्नु पर्थेन। अगाडिपछाडि तस्कर लगाएर हिँडेको आजको फल हो।",1
nep_69f4ae447aabd85da63c7d93a44c93f8,राजावादी मित्रहरु ! बेबकुफ कुरा गर्नुको साटो शक्तिशाली कि चेली पिएम संग हिन्दु राष्ट्र र संबैधानिक राजतन्त्रको बारेमा जनमत सङ्ग्रहको माग गर सेनाको बलमा गद्दीमा राखेको माइलो टिक्दैन जनताबाट अनुमोदन गराएर ल्याउ हाम्रा २४ मत तिम्रै पक्षमा आउलान् घृणा फैलाउने बेतुकका कुरा नगर,1
nep_0dc0b09a3d3f4375bc068c08442e3dec,निर्मल तपाईं परिपक्व हुनुभएको जस्तो लाग्थ्यो होइन रहेछ ।परिस्थिति काबु बाहिर जानसक्ने भयको कारणले यि ब्याक भएको हुन नत्र अस्ति राजा ल्याउने तयारी थियो जर्साबको यस्तो भन्छन् विद्वान वर्ग ।सबै खेलमा विदेशी जेनजी आवरण हो ।क्रिश्चियन धर्म प्रचारप्रसार गर्ने बाइबल बाँड्ने नेता !,1
nep_bd346312cabcb606bdfe7e4cfbb13fa6,युग पाठकको लेख अन्धाधुन्ध देशको भव्य उलार,0
nep_2b8d949baf9faa0f7bcfadffe1a8b48c,पहिरो हटाएपछि नारायणगढमुग्लिन सडकखण्ड दुईतर्फी सञ्चालनमा,0
nep_9791e8b865795d3a3760780f52f429bd,कृषकलाई समयमै मल उपलब्ध गराउन सांसदहरूकाे माग,0
nep_1b47e5b203c0df1129cfa85cc6bc67e2,महाकालीमा पानीको प्रवाह बढेपछि सवारी सञ्चालनमा रोक,0
nep_591ab865b8ef490d7d2913186f1d84bf,रुपन्देही कारागारमा रहेका राष्ट्रिय स्वतन्त्र पार्टीका अध्यक्ष रवि लामिछानेको ललितपुरको नख्खु कारागारमा सारिने भएको छ ।,0
nep_2790626a09ac51e0d4375840905f9ea1,आन्दोलनका कार्यक्रममा भोलिर पर्सी २ दिन मधेशका जिल्ला बन्द गर्ने र त्यसपछिका आन्दोलनका कार्यक्रम भोलि बस्ने बैठकले तय गर्ने बताइएको छ।,0
nep_a38af298e6138497c785e0ab1bdd704e,"मोर्चाले मधेसी समुदायलाई अपमानित गर्ने, होच्याउने काममा प्रमुख दलहरु नै लागेको आरोप लगाउँदै अब मधेशमा सशक्त आन्दोलन गर्ने चेतालनी दिएको छ।",1
nep_0f3f2d86b4de144b932a4cd1ab5d0a18,उनले स्थानीय तहको निर्वाचन र संविधान संशोधनवीच कुनै साईनो–सम्बन्ध नै नरहेको जिकिर गरे।,0
nep_f619cbe985c1926dae8be175bebf2ca5,"उसलाई मधेशी मोर्चाले अबरोध गरेको समाचार आईरहेको छ, यो मोर्चाको महाभूल हो, यसले एमाले पार्टीलाई होईन मधेशी मोर्चालाई नै घाटा गर्छ।",1
nep_f5694ccdb95a9d9d4283da03bb98a8d9,संघीय समाजवादी फोरम नेपालका अध्यक्ष उपेन्द्र यादवले तीन दलको योजनाबद्ध रुपमा सप्तरी घटना घटाइएको आरोप लगाउनुभएको छ।,1
nep_93ada99f152f9d5f464d4b00faa1cf2d,उहाँले भारतीय प्रधानमन्त्री नरेन्द्र मोदीसँग भेटवार्ताको क्रममा संविधान संशोधनको प्रतिबद्धता जनाएपनि प्रतिबद्धता पूरा नगरेर अन्तराष्ट्रिय छवी गुमाएको बताउनुभयो।,1
nep_366a2375c3e93745c9456c1c40292c00,सहकारी ठग्ने कंग्रेस एमाले गाउँ गाउँ हेर्यो संचालक रिणी कंग्रेस एमाले मात्रै अनि सहकारी डुवाएको आरोमा जेल चाही अरु जानु पर्ने देशको कानुन मान्नै पर्छ ।,1
nep_74d54d4116251548866e265f1e313e58,"तर, शासकहरूले गरेका अवैध कार्यहरूलाई वैधता प्राप्त गर्ने मनसायले घोषणा गरिएको चुनाव जो कसैलाई मान्य हुन सक्दैन।",1
nep_8e9d9d116367dad9bd19d8427e0bc29a,"अचेलको चलन झ्वाँक देखाअ‍ेर पत्नीलाई कुट्ने, रक्सी खाअ‍ेर जीउ छाड्ने अथवा सन्किअ‍ेर यताउति हिड्ने, यस्तो भअ‍ेको छ।",0
nep_0d86cb5c0452d1b2a9b047996b10477e,अन्तिम खेलमा ओमानसँग पराजित भए पनि नेपाल ५ उत्कृष्ट उपविजेता भएर च्याम्पियनसिपमा छनोट भएको थियो।,0
nep_561960afa8d635dd9dcc6984745a8f0c,कांग्रेसले भूकम्प पीडितलाई एकमुष्ट दुई लाख रुपैयाँ दिने सरकारी प्रतिबद्धता नआएसम्म संसद अबरोध जारी राख्ने जनाएको छ।,0
nep_f3b8bdf94a0a30db78f94d619cc08176,नेतृत्व छनोटका लागि शुक्रबार राति भएको मतदानमा २ हजार १ सय ५२ मत खसेको थियो।,0
nep_44676e1550b2bcf7a49f26e61fe28d2f,सर्च इन्जिनहरुको तीव्र प्रयोग हुन थालेपछि आफूलाई चाहिएको तस्वीर इन्टरनेटमा खोजेर चलाउने चलन बढेको छ।,0
nep_8c4c4f2cb2ce839f1de0f1f3dde775c2,यसो गर्दा तपाईंले उत्पादन गरेको सामग्री विश्वभरका मान्छेलाई प्रयोग गर्ने र बाँड्ने अधिकार दिन मिल्छ।,0
nep_9ca0c1ee86e5da77ab33a7886da76c5a,२०३४ चैत २० गते जन्मेका धर्मराजले दलित मुक्ती र श्रमिक वर्गको पक्षमा संविधानसभामा आवाज उठाउनुहुनेछ।,0
nep_21392bc2b1cf254cbddfb2f002254201,प्रधानमन्त्री मोदी भिठ्ठमोड नाकाबाट स्थलमार्ग हुँदै महोत्तरीको जलेश्वरस्थित शेरगण ब्यारेक प्रकौलीमा पुग्ने कार्यक्रम रहेको छ।,0
nep_c81856031edf3994be9cc45629a832bd,त्यसको लागि प्रकौली ब्यारेकभित्र एउटा ब्यारेक अगाडि खेल मैदानमा दुई वटा गरी तीनवटा हेलिप्याड बनाइएको छ।,0
nep_8ec758b50fcc5dc8f09ff266eb95d819,"हिन्दु कठोर सामाजिक व्यवस्था भएको यो समाजमा महिलाको अवस्था स्वतन्त्र नभए तापनि महिलालाई विद्या, शक्ति तथा धनको प्रतीकका रूपमा लिइएको छ।",0
nep_3388009f54fba3cc71583bd9dbc8af27,"फेरि विडम्बना, यसै समाजमा महिला पुरुषको नियन्त्रणमा रहनुपर्ने सामाजिक मान्यताको विकासले पनि प्रश्रय पाएकै छ।",1
nep_9fce9d9f09744d605df2c7ca6d3413e1,महिलालाई पुरुषको सहयोगीका रूपमा मात्र दोस्रो दर्जाको कर्ताका रूपमा हेर्ने गरेको देखिन्छ।,1
nep_9f919dd118f2991467d5f2baa085396a,यी महिलाहरूलाई आफ्नो अभिनय 'चप्स' प्रदर्शन गर्न एक मंच दिन्छ,0
nep_98f4c7f7b818a1d5baeefb4a0eebbe45,बेलायत र अमेरिकाका व्यक्ति मा गरिएको अध्ययन अनुसार होचा भन्दा अग्ला मानिसहरू मा कोरोनाभाइरस सर्ने सम्भावना दुई गुणा बढी अग्ला व्यक्तिहरु कोभिड कोरोना को उच्च जोखिममा,0
nep_30421c5bbdc914735706410a1bcdb707,चिनिया उत्पादन टिकाउ हुन्न भन्थे तर कोरोना भाइरस कोभिड टिकिरहेछ त डिसेम्बर देखि मार्च सम्म मजाले चलिरहेछ संसारका देशमा,1
nep_b78d67edaf3287c9944aa610190990a8,यी महिलाहरू उत्कृष्ट छन् भन्नेमा विश्वस्त,0
nep_cba0d0c5f1e33d850e82a3288abdc433,सामूहिक बलात्कार आरोपमा धनुषाका एक वकिल पक्राउ,0
nep_7a6987686df504904b792ef5d358164e,"गाईजात्रा देशा विभिन्न भागमा मनाईन्छ, तर चर्चा उपत्यकाको मात्रै हुन्छ ! किन होला?",0
nep_98ab41fd803670ccd319b483a6ae4ef2,"राँगो जस्तो या शिंह जस्तो भएपनी काँग्रेसी जस्तो बाघको छाला ओडेर हिड्ने स्याल नबनुन ,स्वारी जस्तो खानै नपाएको बाँसो त बन्दै नबनुन ।",1
nep_1705b0e1a50f816e8967cbbba6074a48,चाडपर्वहरूले राष्ट्रिय एकताको भावनालाई सुदृढ बनाउँछन् राष्ट्रपति पौडेल,0
nep_ab28cdb2461b0543ebacae72356bcb70,जेन जि हो यदि तिमि हरु ले हारेउ भने यनि पुराना नेताले तिमि हरु लाई बिभिन मुदामा जेल मा हाल्ने छ्न,1
nep_eedc2158c2c6b890a0faff1cc446d838,छोरीले कमाएको धनको भर हुँदैन भन्ने मान्यताले महिलाको आर्थिक योगदानलाई उपेक्षा गर्छ।,1
nep_015c7bcb35b01b5dd44f9366aee5fd10,छोरीलाई पराया धनको रूपमा हेरिन्छ र उसको जीवन अर्काको घरमा गएपछि मात्र पूरा हुन्छ भन्ने सोचले महिलालाई आफ्नो घरको सदस्यको रूपमा पूर्णतः स्वीकार गर्दैन।,1
