id,text,political,racial/ethnic,religious,gender/sexual,other
spa_44db666651667df9818f129e85ff36f1,bancada feminista do psol 50000,0,0,0,0,0
spa_eb2658fd94ab0c96a0bd43b34ae097b8,basta de planes aextranjeros y deportacion a los piquetetos y a los q no paguen impuestos.,1,0,0,1,0
spa_9a96e5285cdab7a471c188d37b68c43e,bimbincito castillo o felix -el narco deportado de usa- portes.,1,0,0,0,1
spa_8c77b08104f14fa820ca04ff3df7d525,"bodegas cristianas??
no soy una bestia salvaje evangelica sionista",1,0,1,0,0
spa_a3ac038953a801594dc4daf7026f72f9,bolsonaro no es catolico es evangelico igual que yo .la masoneria estara acabada igual que la iglesia catolica,0,0,1,0,0
spa_0bab621c97b49c52cd342dc5e0da0571,btw el aborto sera ley,0,0,0,0,0
spa_5f7defe23b85ff7ce58b87a5f734a63d,"buenisimo, que se vaya entonces a predicar en cualquier pais musulman",0,0,1,0,1
spa_860829f1b328c4e5131193b71034f82c,bueno pero vos sos el unico judio con anteojos y rulos que conozco,1,1,1,0,0
spa_298ec23fb47d2f9b0a5b46d1004225a5,"bueno ya tu sabes, aborto!!",0,0,0,0,0
spa_3e73e996625f1e7e9d838f89052be605,"bueno, la iglesia evangelica le esta dando grandes patadas a la iglesia catolica.",0,0,0,0,0
spa_dcb29fef615b176b791106347fba2a1b,"buscando mutuals
roja
feminista
muy roja
de izquierdas
feminista
antifascisa
roja
libros
comunismo
ukelele
cantar
roja
ganchillo",1,0,0,1,0
spa_9a9aa64c17a3c8768334c567b7069d29,"cada deportacion cuesta dinero. mas caro es tener delincuentes musulmanes en tu pais, violando y matando.",0,1,1,0,0
spa_10a9ed6879f19370181fa51710861b41,cada vez que compartais un meme de luigi mangione recordad que si fuese negro o musulman no existiria ese meme.,0,1,1,0,0
spa_247be223a6cdb6cdca9849eade526167,"calla zorra son pa mi, ayuso pesetera",1,0,0,1,1
spa_5193c01a4a650b471f7a360d2b37a00a,campeon yo soy cristiano evangelico no soy catolico si tu no eres creyente por lo menos respeta a los demas no,0,0,0,0,0
spa_d680d90b2a0ce0d75168138eda87cb54,"carcel, deportacion y expulsion para siempre.",0,0,0,0,0
spa_d99c18b4116a70965198ea60ff5e95a8,"cardenal chomali destaca postergacion de proyecto de aborto legal: ""un gran regalo que muchisimos chilenos aplaudimos""",0,0,0,0,0
spa_4ef477cb0dd4e8cbe2fe827fa4977c51,"carroneras, aborto de la naturaleza!",0,0,0,0,1
spa_03ac06f646d84b15407ddcbf67e26ef9,castrillon en un pais serio ya estaria deportado,0,0,0,0,0
spa_70b206682b8ca12b682c606fa83222ff,chale la feminista de ocacion les ladra a las feminista ja,1,0,0,1,0
spa_08e1313b6a67f33f1979917b850d12ad,charlando sobre una space opera feminista mientras me toco los invisalign,0,0,0,0,0
spa_ce35274e0aa8bf7be0f78abe01d79169,"chica feminista es un no, lo siento.
#benidormfest",0,0,0,0,0
spa_cd8fcfad9bc51082fea56dd46f411f71,"chupalo judio
mala clase",0,0,1,0,0
spa_7ae9a356429d1d729d44915aa5a57a6b,"chupame las bolas, judio de mierda",1,1,1,0,0
spa_cc9999ccedbe89b37b4092865c4fac4e,"claramente a este veneco csm no deben darle residencia es mas, deberia ser deportado. delincuente csm",1,1,0,0,0
spa_a4e730f1cf6145c0a05eb92b689ffa1b,claro las feminista vaguas hablndo,0,0,0,0,0
spa_a18c018a1bccfc3c818aac7de3e91dcb,claro y tu eres evangelico??,0,0,0,0,0
spa_06095d18b945c50f99662e590c0f10e6,"club cristiano evangelico lion futbol club (chacabuco, buenos aires)",0,0,0,0,0
spa_b52b6834b61678b760a6eb67097eddb8,colombia tiene vicepresidenta afro y feminista!,0,0,0,0,0
spa_fb864b23aa2ebe7a8e51171f2835d385,"como a puerta de taxi viejo
como a pandereta de evangelico
como a calculadora de revuelteria",0,0,1,0,0
spa_fe706e1ae4db536faf9785ee32642b5a,"como cristiana evangelica, respecto a la ""parodia"" en olga, solo dire ""el corazon alegre es buena medicina, pero el espiritu triste seca los huesos"".",0,0,0,0,0
spa_e39caafc0f3aa0ae14454f8e3b5c1b4f,"como dato, de 6 mujeres, 4 tienen relacion con la deportacion o la resistencia: germaine, simone, genevive y josephine baker.",0,0,0,0,0
spa_09d887cda00c9cdb406e482049259c81,como decian en la urss evite el aborto coja por el ortbueeeeeeeeeeeeeeeeeeeno,1,0,0,1,0
spa_845604cdf702d0ce5edc2272c04c0a91,como finge un brasileno ser estadounidense para librarse de la deportacion. reir por no llorar.,1,0,1,0,0
spa_c221aca7aaeee5d26eba888cfca7e0cf,"como mujer trans y feminista radical desde hace una decada, es agotador",0,0,0,0,0
spa_8faefdb62c638b8fbecbd6ce59748b64,como que aprobaron el aborto,0,0,0,0,0
spa_db0ee54fb64eb19415a17314233ce52f,"como ser occidental y no sentirte una mierda? preguntar al fascismo europeo, estadounidense y judio.",1,0,1,0,0
spa_cca37b04b301e559c5618dff24a19a9f,con 7 meses no es aborto. aborto es antes de la viabilidad fetal (<22 semanas),0,0,0,0,0
spa_9f5970bbc267b4e46ed8675e7cf0e614,con ese criterio los funcionarios tambien deberian ser deportados por tener actividad homosexual. agravada por la violacion!,0,0,0,1,0
spa_dc0e2af3d118ec5c7014772b76b62845,con eso que dijo merece la deportacion,1,0,0,0,0
spa_77bc82edf551f42ffa0c0c5909f381eb,"con ganas que me den como pandereta de evangelico
buenos dias!",0,0,0,0,0
spa_4d5d436f74a8e3ea76a5c46b700c7526,con quien le diga su pastora evangelica.,0,0,0,0,0
spa_28e4710ce9e787b7999ff70a129b2a47,concepcion arenal. feminista e auxiliadora de prisions,0,0,0,0,0
spa_ec09598ea21a3fd6a55f14272e5a4b42,condenado a muerte por el sanedrin judiouna mas,0,0,0,0,0
spa_dbb7b632301ca5037369a2440d20416a,confia en un pastor evangelico estafador?,0,0,1,0,0
spa_74d268f06d4181e63b9b8184fac8c01b,consejito: nunca vean una serie o pelicula con un evangelico.,0,0,1,0,0
spa_d6651f83da4b44b240fc953488f1bc1f,"conservadores: la ciencia y el aborto son eugenesia.
also conservadores:",0,0,0,0,0
spa_e404a99dd0905f0ad754907119b78e80,corte ordena a templo evangelico de santiago abstenerse de emitir ruidos por sobre la norma,1,0,1,0,0
spa_b15da6fe484f99b6a7eb404a0d846cc2,cualquier dia aparece un aborto,0,0,0,0,1
spa_09640b2f43e678e7bc6b0235e3630ecf,cualquier vago se hace pastor evangelico,0,0,1,0,1
spa_87a5f5757f04ff689ac2209933f7a3d7,cuando gane las elecciones veneco que proteste en la calle gomazo y deportacion. esa va a ser toda mi campana,1,1,0,0,0
spa_ff1bbb72ffcb1fae2dab647e77f19d41,cuando la lucha contra el aborto clandestino se volvio lucha a favor del aborto clandestino.,0,0,0,0,0
spa_9e3651f15dec8db321092f138f7c85f4,"cuando se la manden deportada, frank no la va a soltar
va e ser trio con la bethy jarana",1,0,1,0,0
spa_3c0ed4d09b97ad041b126f0c2336eb19,cuando sos negro sos negro,0,1,1,0,0
spa_dc88bb17de729bbaa58ba881cd8b0bc2,"cuantos anos tienes?
mi tia, 70 y pico anos, viuda: 25 mi marido es musulman y llevo burka",0,0,0,0,0
spa_6ced68cd42ab553cf2a7aa5b0cd8abdf,cuenta como aborto si te suicidas?,0,0,0,0,0
spa_90a9915da1b68b4ada5daa56f408fe73,cuidado los padres de la evangelica no vayan a ver esos videos,0,0,0,0,0
spa_ea09f4d49953017070db5d034cbe68a4,dabale arroz a la zorra el abad.,0,0,0,0,0
spa_55dc639f70d9ef6387c49c3469adf864,"de ahora en mas tenemos que decir ""es nena o aborto?""",0,0,0,0,0
spa_12969812b06d8c17ea4ab52538202734,de dia zorra y de noche gata,0,0,0,1,1
spa_6f1f84dde6e15353217e6c535c995d54,"de ese relajo con don goyo,. el mate de risa fue el supuesto pasaporte del terrorista musulman o arabe que mate de risa.",0,0,1,0,1
spa_8b3eeab21d7dee0b88efa911d6f0515e,de esposa de pastor evangelico.,0,0,0,0,0
spa_a8421dedf4c7b91fcdfa53e16db8bb9e,de hecho no es de este pais. debe ser deportada y regresada al cuba a que viva en el paraiso!,0,0,0,0,0
spa_054d6abca9a623657a0f900059e7513a,"de las intenciones de deportacion, tambien",0,0,0,0,0
spa_683b20a0cf5ac567e64b46e4b88e28be,de negra justicia a negra hp.,0,1,0,0,0
spa_dd94327a4285518858aa0c551c20aac8,"debatir para avanzar, como sindicato feminista que somos",0,1,1,1,0
spa_86bd752dc909d703c5bea537ac80e965,"deben ser deportados.
no aportan nada al pais que los acogio",1,1,0,0,0
spa_7035301bfc136f1052e780c65da85675,del aborto de las gallinas,0,0,0,0,0
spa_d1b9cada55aa1efc69f8354a3ff965ea,deportacion a toda la familia.,0,0,0,0,0
spa_bb5ff87a7ec1cfc32cee62d34dc7ab30,deportacion a todos y sus familias,1,0,0,0,1
spa_f4a887d695b25377fc4c94dd270a9556,deportacion como con la mona europea.,1,0,0,0,1
spa_aab80bc305a8436a317cd7b96e916dff,"deportacion directa o proceso de extradicion? los pasos judiciales que vienen para pablo munoz hoffman, el exfrentista detenido en bolivia",1,0,0,0,1
spa_6b2b6b8e9348697a9f370f914d333aa2,"deportacion express en
estados unidos. #usa
#donaldtrump #expedita #noticia #migrantes #estadosunidos",0,0,0,0,0
spa_e3f52be8cb70a20529b51b6115979cea,"deportacion inmediata a su pais de origen, chile",1,1,1,0,0
spa_4aa3aa56234cfda6933b594216dc72ba,deportacion inmediata de los inmigrantes delincuentes,1,0,0,0,1
spa_05675418e67d778b8bff6ceff91374da,deportacion inmediata para estos venecos y toda la plaga de zanganos que esta entrando a chile,1,1,0,0,0
spa_52d3a7d9edc0e056cdd1548851fbe8ab,deportacion masiva y muro,0,1,1,0,0
spa_9fbc4032257e3ff3f4bc6e424fce00f2,"deportacion?? paliza como hacen en marruecos, cortarles las bolas y luego deportacion. que se les quiten las ganas de volver.",1,0,0,0,1
spa_c1a244252e8223872b7b435e12fa5c2b,"deportada de un pais que parecia de ensueno, pero no era para mi, ciudadana del mundo, pero sin tramites ni viajes.",0,0,0,0,0
spa_f9afa10b96274431d232c9f475e0cec0,"deportada del pais del cambio, del amor y de la vida ?",0,0,0,0,0
spa_b2367148f468f6515df899dc081af734,deportada por latina ja ja,0,0,0,0,0
spa_d249de943ec2ab44cb673fca39c22f4c,"deportado venezolano llega es pidiendo comida a diosdado, y menciona es la arepa
#deportation
#venezuela
#venezolanos",1,0,0,0,0
spa_5fe3da262dc392a6f367eb85bc71b2b6,derecho a la legalizacion del aborto,0,0,0,0,0
spa_32c3aff1b246873d1e0aa1d997d951dd,describan su situacion amorosa en terminos de migracion. empiezo yo: deportada de algunos lugares y exiliada de otros,0,0,0,0,0
spa_10cbf64b67679865c1613ea9ae6b7aa6,"desde que me entere que ese termino ""toxico algo"" es una invencion evangelica ya no lo uso, cuidado que esconde discursos de odio",1,0,1,0,0
spa_7f4fe0e551b8cc16039ab6b0dbcd72f1,"despues del operativo, deseo saber cuantos deportados?",0,0,0,0,0
spa_53310e51df74d52d193223cc460c43dd,despues se re cuidaban de lo que decian conmigo creo que pensaron que era evangelico o algo asi,1,0,1,0,0
spa_c75d21a1a8aaf816092c60a025995587,despues te haces llamar feminista,0,0,0,0,0
spa_14f0403d1b964a13901c7a2ed2250830,detencion y deportacion inmediata de este elemento.,0,0,0,0,0
spa_dfc22b11de204dd957c437023712bbf7,"dios lo bendiga presidente soy cristiano evangelico , alli nos gozamos con la presencia del espiritu santo",0,0,0,0,0
spa_dc1b7380dc08279721ccca5c83c2f65d,"diosss lo que gana ""mala feminista"" en directo??? que barbaridad",0,0,0,1,1
spa_6a696760a7c57fb450c197185cc745bd,"duelo, esperanza y consuelo de albert n. martin es un libro de un autor cristiano evangelico lo tengo en pdf",0,0,0,0,0
spa_0c221cc4417204ebc9122f5ee65ee89e,duque pudo ser un aborto,1,0,0,0,1
spa_d38b45e944182bf60a77606554f9a222,"durante estas fechas, he decidido hacerme musulman, asi no tengo que celebrar nada",0,1,1,0,0
spa_30df44f417493c4a31280561b8dbbc96,efectivamente la culpa es una herramienta muy fuerte utilizada por la moral judio cristiana.,0,0,0,0,0
spa_31f53fc33575738e25ec2d6709b21ef8,"eh como molestabamos a la evangelica, que escuela fiera esa jajajaj",0,0,0,0,0
spa_6b0444e69e5d9dd409b9344128561299,el aborto de una cucaracha!,0,0,0,0,1
spa_78430146d939985a6c80954257ebb4ce,el aborto deberia ser ilegal!! #aborto #feminismo #abortoseguro,0,0,0,0,0
spa_9177f528c720e4adec661cd377869163,el aborto no es un avance historico. el aborto es un avance criminal.,0,0,0,0,0
spa_46705fb8df4d474133159a13a878c0df,el aborto no nos hace libres,0,0,0,0,0
spa_44e1e96472c02468663c32c1eabf0464,el aborto si era opcion.,0,0,0,0,0
spa_e12464849b56a7f8f4f6fe324f6f2cbd,"el alcornoque es como un cripto judio de sangre azul, lo despellejan entre 9 y 14 anos",0,1,1,0,1
spa_e0c92bb5a52b93e10cfabb6794be0fa3,el catolico espanol defiende el mensaje evangelico de que los inmigrantes se ahoguen en el mar.,0,0,1,0,0
spa_7c771ea65df51586a1e5a4c6a90036d0,"el chico que yo creia que por ser evangelico era distinto, es todo mentira, le dice a la novia que no pero si .",1,0,1,0,0
spa_3d8439251d1e4e2fea0d765ae63a0cc6,"el chiste se cuenta solo: esto son un judio, un lider supremo y un cheeto que se ponen a jugar una partida de risk",0,1,1,0,0
spa_622d19d1021b1de42472234300234be3,el colectivo feminista es selectivo,1,0,0,0,1
spa_6bfc17ba168c99e083a5340209b259a8,el dueno anterior tambien era el poder real. tal vez no era judio.,0,1,1,0,0
spa_a0bdefd575c94900c6c3de25a54f27fc,el es judio! eso de nazi me parece un poco exagerado!,0,0,0,0,0
spa_84d87265a11aacea1831957ee3e20f95,el estado terrorista nazi-judio en accion.,1,1,1,0,0
spa_cf7b5ad3caf068612109b61b16d0cde0,"el fue, de hecho, un aborto que no salio bien.",0,0,0,0,0
spa_5e3a85c27da7040a8033a5684217a6e9,el holocausto empezo con una deportacion masiva,0,0,0,0,0
spa_276a7dd4ec7c5b927c14561e967551af,el homoerotismo musulman me sobrepasa,0,1,1,1,0
spa_e7172676dd9904b09acb8d43af5f5dba,"el judio ""destruyan todo""
el judio ""vamos de nuevo""",0,1,1,0,0
spa_6f0b241314f0f2313d9f3a765ab2b58f,el judio menos resentido con los galeritas:,0,0,1,0,0
spa_f9d5b4f1086b82ebddb5adab728aee08,"el juez ordeno la detencion de 39 personas en madrid ""por varios delitos de aborto""",0,0,0,0,0
spa_cc68d111712d40b9ba7687e4694601a6,"el lobby judio en usa es telita, ultraliberales todos.",1,1,0,0,0
spa_5344ee3ec113fda0c4ec7b17b5a34fb6,"el negro y el morado, pero mas el negro",0,0,0,0,0
spa_3cdb04d38f3a742224fe7bf9c50571a7,"el ocaso oscuro de un pueblo. el judio
muera la inteligencia! viva la muerte!
vencereis, pero ya no convenceis, genocidas.",0,1,1,0,0
spa_a2629e690ccc6d1541ec3b23eba8aa6f,el pastor evangelico experto en robos va a ayudarte,0,0,1,0,0
spa_f9fe77cec6a51cfbcb47ffcff93bb235,el plan de deportacion de gaza es tan monstruoso como lo fue la deportacion de judios y su exterminio.,1,1,1,0,0
spa_fbdac7c88937aa016c14a2b5655167c5,el rector solezi es evangelico?,0,0,0,0,0
spa_b2417ff8c2379cbb7f27ac5c8534b4fb,el sabra siendo un aborto en si mismo,0,0,0,0,0
spa_c15e57c5bbc9bdb0494115c24bde36c4,el secretario de estado de eeuu reconoce los esfuerzos de mexico para repatriar a migrantes deportados a sus paises de origen,0,0,0,0,0
spa_3219cd9bff68c86644d900e0a2ed08a8,"el senor es parecido al presidente ucraniano, judio y nazi, el fascista disfrazado de periodista.",1,1,0,0,0
spa_b973b3f94df1ab045c4e29f4e49518bc,el unico evangelico con consciencia es el que deja de serlo :/,0,0,1,0,0
spa_8d2544342f3a0146c41492565a8ee6b3,"en cuanto a lo demas, milita en equality now. una ong feminista",0,0,0,0,0
spa_30905a9d9ef447e98dfc04adee1e0b37,en juncos te tienen reggaeton o un sermon de un evangelico apasionado a to volumen y con tumbacoco; no hay de otra jajaja,0,0,0,0,0
spa_b1b2f7d0f6977fab5cc0a86632bcd9e9,en marzo? seguis el calendario judio?,0,0,0,0,0
spa_5cd19b82e8f34a15be0519f66ea72b3e,"en mi dictadura, quien le ponga marca de agua a un meme sera deportado a otra vida.",0,0,0,0,0
spa_1b17dc80fca501a218eef5b7fb4328cb,"en peru nunca. ustedes no estan a favor del aborto, estan a favor del negocio del aborto.",0,0,1,0,1
spa_0b8f229432cfcb0ed5bc544c9abefefd,"en que quedamos, sos judio o itali ano?",0,0,0,0,0
spa_2bcc16c736838f8201b6e75bf206ab29,en ser mas feminista.,0,0,0,0,0
spa_40b31c369811676af244632c9fa1a416,en su caso fue aborto,0,0,0,0,0
spa_fb31c7a7144bb7695a6bf7b8a3c28507,encuentro feminista en salamanca,0,0,0,0,0
spa_0e708aea3686896a7972cca18e92b92b,"entendemos que nacio el cristo , el salvador que dios le habia prometido al pueblo judio , algunos lo aceptaron otros no.",0,0,0,0,0
spa_1afe137b67887d19b7eea2f4b69775f2,enterandome que una chica se va a pasar a la religion musulmana para casarse con un musulman que nunca habia visto en persona hasta hoy,0,0,0,0,0
spa_326f965b3dfd9365fce82f8a1889e1ef,entonces castillo no es comunista porque es evangelico mormon al igual que su esposa.,1,1,1,0,0
spa_186e5fa8d2ccdfba0355757ed87b9d78,entonces no eres feminista bebe,0,0,0,0,0
spa_490cc17e6809a88305f92a9be5b32f1a,era negra tenia la pija negra,0,1,0,0,0
spa_518dfb89add50c7cfd741541d6e7db7f,"es ""marketing evangelico"", en mi grupo de estudio biblico siempre hay algunos que lo hacen, yo se las borro y los sanciono.",0,0,0,0,0
spa_e02f3a96bc449fc1613cd9f4e6c51a7d,es como los que dicen que hitler era judio,0,0,0,0,0
spa_dd6108dc7b36330ab40846e52de028eb,"es contra- aborto, machista, homofobo, inutil",1,0,0,1,1
spa_84b802d033ec80f59613ea68e72be86d,es el as. no les pidas un alegato feminista.,1,0,0,1,0
spa_de19b2f251157b9c496d52d4407db38d,es erroneo tu planteamiento ya q jesus era un rabino judio.,0,0,0,0,0
spa_fc64207d2c4f141f82a45d45263b9382,es la nueva ideologia evangelica. siocristianos. dios te quiere asi.,0,0,0,0,0
spa_96b2347b6c228e07d2cca94aad1c3351,es legaaaaal el aborto es legal,0,0,0,0,0
spa_77655e4245432787f11b9fb3d27f3109,es que a dia de hoy parece que la diferencia es nazis con aborto y nazis sin aborto,1,0,0,0,0
spa_d361094d1b5e94527a50c6aed6ce6125,es que como no querer a mi pequena asturiana feminista radical,0,0,0,0,0
spa_8cc3545925b8d26c1df0a36a852632f7,es que la deportacion no solo son los cabecillas sino sus generales,0,0,0,0,0
spa_4dc1821d9d39cf380f5dcd2bd1dc8dbc,es que ya somos senores,0,0,0,0,0
spa_37eaa2a33794c94d4064e3e7969e7bcc,es tu castigo por llamarme zorra.,0,0,0,1,1
spa_5ae5e0ffeb9ebd3622d6bcca6f024baf,es un chiste feminista jajajajaaaa,0,0,0,0,0
spa_76370b81b996987baef33cdc08ea6ec3,es una argentina deportada,0,0,0,0,0
spa_a90d80a5108285806d45618d589eb694,"es una zorra loca,pero no es para tanto.",0,0,0,0,1
spa_e99d673af8429113f32b85cbabb7294c,esa es la real feminista,0,0,0,0,0
spa_4703e126139d5b5794749507b92c20a7,esa negra que me quiere es la negra soledaddd,0,0,0,0,0
spa_e189305d72b7f6e901a6625cd675bd81,"escuchando a un deportado colombiano del maltrato recibido sobre todo por los estadounidenses de origen hispano, verguenza les debia de dar. vivan las cadenas",1,1,0,0,1
spa_89bee72ba54a4e8f69bf06f584b6b301,"esdras el evangelico, debe ser un nino corrupto de pcastillo, a quien le vendio su alma al satanas de pcastillo.",0,0,1,0,1
spa_0bde2ef046f0f1698437524a5088d50e,ese es deportado o se suicida en prision. ese no puede hablar. apostamos?,0,0,0,0,0
spa_b8350f095aa4e5db5964b87c7c2a3d98,"ese viejo perdio el control ,,eso es mucho odio para el presidente de origen judio .,putler satanico.",1,1,0,0,0
spa_bd925df36bb7ae9617e110b42ad63806,eso lo podria hacer cualquier deportado soberbio,0,0,0,0,0
spa_cb50b97e4bd9cc84d849921c454642c7,eso no es evangelico?,0,0,0,0,0
spa_b3e340adfe3e0da353e383b8023a6632,eso no es muy judio de tu parte,0,0,0,0,0
spa_6ad0b4b88cb1c976aa764ff978488e2a,eso piensan muchos que votaron a este psicopata y que ahora estan siendo deportados o llevados a guantanamo.,1,0,0,0,0
spa_be567ecaa35e75580f2041a4f19a1156,"eso pienso yo ! no se como permite esto ! ni con espinosa, smith, i cia! todos deportados",0,0,0,0,0
spa_b69fa6d4f20b4cd2e5528c8aff51ff51,esperando esos montajes i'm just a girl dios patria familia no al aborto,0,0,0,0,0
spa_b8ee8e7d3d20d734e3cbf16de1303dfb,espero que esten en comisaria esperando la orden de deportacion,1,0,0,0,1
spa_6f609a836a744ebfb11d370c7f50bc54,esta incluido por trump en esta orden de deportacion elon musk que es un africano del sur?,1,1,0,0,0
spa_55fa79a97c4aeb8f0478782ca38cdd64,esta mina no es feminista,0,0,0,0,0
spa_d9d399d8ec1c416a467d96e1b4c9437e,esta perdiendo el narcotrafico ante el voto evangelico en brasil. #eleccionesbrasil2022,0,0,0,0,0
spa_486ada206a345e847b03043faf00cbc2,"esta semana llevo una visita de los testigos de jehova y de miembros de la iglesia evangelica.
mucha gente preocupada por mi alma.",0,0,1,0,0
spa_f67ed985512c8f0a0c05c07f9e1df8a3,estaba esperando media hora a que a un pelon le terminaran de emparejar un goatee de deportado,1,0,0,0,0
spa_d38e98a103f0664f33f195add3be0433,"estados unidos tiene una lista con mas de un millon de migrantes con ordenes de deportacion, 250 mil son mexicanos = 500 millones de pesos",0,0,0,0,0
spa_ba3f70240118c0445b832e9baf2ac43d,estamos de acuerdo que los openings de inuyasha eran la zorra?,0,0,0,0,0
spa_f1d816ecb4cad371ad873244a51a58df,estas a favor del aborto?,0,0,0,0,0
spa_9345f45b3809c006c9adcdbbcedf1f33,estas haciendo el ayuno musulman ?,0,0,0,0,0
spa_1dcf420f0c3d15fe85a3056a7957f294,estas m&)& deberian ser deportadas sin contemplaciones!,1,0,0,0,0
spa_86f7d5996fa606bccbb5afb892816108,estas negando el holocausto judio y los experimentos humanos con ninos?,1,1,0,0,0
spa_1b39eb2136c5cfc80f11bf3e1de44d78,este pendejo es un aborto,0,0,0,0,1
spa_5c9a7d9268c72182be0225c63d8038a7,este pez deberia ser alcalde judio en gaza,1,1,1,0,0
spa_afc7ff0550f56774259e0e326e91350e,"este plt2 no tiene dignidad
es judio.",1,1,1,0,0
spa_60bf8a594909a151172eecb8cfb4ef75,este tipo le hace honor a su apellido judio,0,1,1,0,0
spa_65232304f514e4ad7516766dcd0f1439,este va a dejar a rubiales como feminista.,0,0,0,1,1
spa_bc41868be1f2d2b7c94a9f44e0a86a6c,este weon deberia ser deportado en el entretiempo!!!,1,0,0,0,1
spa_df0021ee05a2bbed31c9ac8a97a94ad0,esto hay que viralizarlo hasta que nos duela el dedo y esta chavirus sea deportada.,1,0,0,0,0
spa_248ec131f756f3c543753a9ce5ad63c2,"esto todavia no se acaba!!!
#febrero #anarco #trans #feminista #granada",0,0,0,0,0
spa_67586add3957dd086d43489ea20d3197,estos venezolanos delincuentes ya deben ser encarcelados e deportados a su pais.,0,0,0,0,0
spa_575e4de9068abf268fc8879a5f45ffcc,"estoy a 0,5 de ir al evangelico a sacarme una medica e irme pal le",0,0,0,0,0
spa_28e30005d4ce1c147ce647addf9114a4,"estoy en ciudad vieja y ya veo en la esquina al evangelico mirandome con cara de ""aaa, queres ver la obra de dios?""",0,0,1,0,0
spa_71b6ac6b65dafd1a2f37272cbe3ab99b,"estoy subido en el barquito de chica sobresalto y ""mala feminista""
#benidormfest2025",0,0,0,0,0
spa_22d024e9de6d34cf0a320cc48f21a9e0,"evangelico = preso de la fornicacion.
catolico = igual y ademas de la idolatria.
mazel tov!",0,1,1,0,0
spa_a5b9ffbafa9a3582c4e97d6e68aefa30,exterminio y deportacion. trump y su franquiciado israel. nada distinto al nazismo.,1,1,1,0,0
spa_a23daedd1b292eea56362028732bb16f,falando de bolsonaro aborto e blablabla,0,0,0,0,0
spa_e8b4c956960ca0a0c624a4a65812721f,falta el tema del aborto,0,0,0,0,0
spa_a913b2dbd8e27778d569a1103901afaa,feli' por la despenalizacion del aborto.,0,0,0,0,0
spa_f1a6d2bd10407da079868d3b48b1e619,feliz ano nuevo judio rosh hashana,0,0,0,0,0
spa_5b4a9533235d8bebc32dcdf8bf48f1da,feliz dia del evangelico,0,0,0,0,0
spa_78b7de28d729cc5ee2e608e21532d652,feliz dia judio de construirse una caseta.,0,0,0,0,0
spa_77bfdb1f6b8bfd16be86a1c5820be700,felizmente no dije ser feminista,0,0,0,0,0
spa_ffe2ce2b7d7e6ec3ddb7ae8b1a11a089,feminista con el mayor iq:,0,0,0,0,0
spa_948e82912eed0277438a6fe1e3aedb06,"feminista noqui, afuera tu ministerio",1,0,0,1,0
spa_8d1196ab64b5776d3fdba5022c4b5bbe,"feminista qlias, son entero lesas #feminista #aliade #nya",0,0,0,0,0
spa_a1bb7c1b19ea759400b6bd661215ce45,feminista que se deja manosear ?,0,0,0,1,1
spa_d67de84e21d453b3d33b25ba256b43dd,feminista radical opinando bosta como sempre,1,0,1,0,0
spa_7c918add35bb02599eb4f938c688250f,"feminista.
de izquierdas.
humana.
unica, marisa paredes.",0,0,0,0,0
spa_27922291f2a31909d1a084ecfe258dc7,"feminista? no, mas bien comunista",0,0,0,0,0
spa_2f3528532bfaeec1ed86bb1d85abfdd8,"festival evangelico apoyado x el gobierno, prestando sus instalaciones!",0,0,0,0,0
spa_9283710a7ca783563a434ef0c9de8f52,"francesa fue deportada despues de vivir por 140 anos de forma ilegal en new york.
#trumpenergumeno",0,0,0,0,0
spa_a105f0877944896d1c560a5d3384512d,fuera rctm en eeuu ya la hubieran deportado por mentirosa.,0,0,0,0,0
spa_cbd2216ad93412ec801a0c6725a612c6,"fuera v e n e c o s indeseables, deportados!!",0,1,0,0,0
spa_8bae9f7690cfc61e2cbbfe8a2e09b019,"garrote, garrote y garrote; luego deportacion.",1,0,0,0,1
spa_59ba8179c24f45006f06593a34d67c83,"genial, si fuera mujer seria si o si feminista",0,0,0,0,0
spa_5a0f6eba42159918701a178495acc31d,"gora borroka feminista!!!!faxismoaren kontra, ausardia eta aliantza feministak!",0,0,0,0,0
spa_f4b2b3c84cfa07290796134caf4060b6,ha sacado un sonny angel para hablar de aborto?,0,0,0,0,0
spa_e903c7c90affeb698f8700d5564c0bae,habra que deportados a todos,0,0,0,0,0
spa_96eeca351c2e7fbad0434da9bb8ef0ce,"haga patria, mate un feminista.",1,0,0,1,0
spa_c19ea1576879765e632402e56577b953,hassan hace a messi campeon y juro que me hago musulman,0,0,1,0,0
spa_f383056d9c904230d0a7637f0847b085,hasta ahora estamos esperando la deportacion de extranjeros indocumentados.,0,0,0,0,0
spa_01f5841c1c3c9fddbcd1a950ab641b2d,hay que mandarle mi hermana negra de otra madre negra,0,1,0,0,0
spa_0e18c1ed926a0b22d939fec7aff41e5e,"he empezado a detestar a la gente deportada que trabaja en call center, se la lanzan de tuani.",1,0,1,0,0
spa_ba64a9c334081532f184078c2244302c,he matado a zorra magdaros,0,0,0,1,1
spa_20996d8a9c35d4fc2870718997af4769,"herodes esta mas vivo que nunca con el aborto.
verdaderos asesinos de ninos.",1,0,0,0,1
spa_49e9fd129267692611c99c80b5a9408c,"hitler, el primer feminista (???????????)",1,0,0,0,0
spa_695d6e736b5f5399a30c14789b7b668b,"holy aborto retroactivo, batman.",0,0,0,0,1
spa_ebad27b8ecb5533fe312a350e16f3035,hoy lanata es deportado de algun lado,0,0,0,0,0
spa_2ce9b1320c9d00aade050205c1b90946,hoy seria detenida y deportada.,0,0,0,0,0
spa_b80be345c43c2b5e5e8ac7ee1d39e300,"hoy una amiga me dijo que parecia deportado cholo del chuco, a mi me parecio un cumplido",0,0,0,0,0
spa_344f424307844c04d03401775ac4d72e,hugo sanchez feminista callate alv!!,1,0,1,0,0
spa_1bc595da85fb2cbfb1caa741e8e2a9fb,humor feminista de mooncollage,0,0,0,0,0
spa_c0d15d279861d39f24d08e901fda1246,"iglesia catolica, dice que los planes de deportacion masiva del presidente electo son contrarios a la doctrina catolica",0,0,0,0,0
