id,text,political,racial/ethnic,religious,gender/sexual,other
spa_e8710e1570df979f756f81ad40fc84f8,las maravillas de ser musulman,0,0,0,0,0
spa_ca396253b1109acda0b8ba64c0652606,"las pendejas kpopers,que si les dices feminazis lloran como ninas",1,0,0,1,1
spa_28d52e766739e554b19f2804be0fd65f,las progre feminazis involucionan a la mujer.,1,0,0,1,0
spa_a6affc199283a0e20db917db66b67abd,las tipicas polladas de la izmierda feminazi.,1,0,0,1,0
spa_8114100fb58382f52bbd440665ad2a6a,le mostraron un indio picaro a speed jajajajajjajajaja,0,0,0,0,0
spa_d608d2776d5bdfbac0c203cf2c5e4e7b,les apicaron un chino y un chino simplificado.,0,0,0,0,0
spa_3d31721e9c8d8a7d869828d4c549fdb5,lgtbvirus y las feminazis aborteras son un cancer en la sociedad.,1,0,0,1,0
spa_49f45330c9dafaa0f213201ba99a4385,"libertad de abortar, por ejemplo?",0,0,0,0,0
spa_479e06069163a0400c2de2eb237cc31d,"llamenme feminazi, pero que bien se estaba cuando ser un pajero acosador les daba miedo, porque verguenza no tuvieron nunca.",1,0,0,1,0
spa_d7d28fb2e84412d56a89fdec3d028067,lleno actas con birome negra.,0,0,0,0,0
spa_cd10430c5bd99039bed65b2c218dbfb3,lleva trufa negra. estoy muy contento.,0,0,0,0,0
spa_c8763603e629595b256dc66d520f7ed6,"llevan una raya negra, es propano.",0,0,0,0,0
spa_5a2484320b149c96f3351c1236c02acc,lo aprendi de un amigo judio,0,0,0,0,0
spa_f109838f191caf424b65820214c2719c,"lo asesinaron por no llevarla precisamente (y por homosexual, por desgracia).",0,0,0,0,0
spa_ce3c68db1130a4d9d308d98f0a0d8eb7,"lo bien que hicieron,con lo conflictiva que son las feminazis!!!",1,0,0,1,0
spa_43f115d2aab930a047fa6f3d0b9318fb,"lo curioso es que lo escribio en espanol y no en alguna lengua indigena, que por supuesto no conoce.",0,0,0,0,0
spa_1730269c4c944ef33a3ceae10b2362e8,"lo de ""feminazis"" sobra, pero si.",1,0,0,1,0
spa_8644f0c6d1f671172f82e0d270931352,"lo de ""judio"" como insulto no corresponde",0,0,0,0,0
spa_b37917df46ef382f0e89c06a95348276,lo de senora le queda grande a la feminazi esta de cc,1,0,0,1,0
spa_bbeeec1826b70eed27a63a0216aaa5c9,lo judio siempre le aporta sabor,0,0,0,0,0
spa_110e4eb47c5340e093dffbf9b4904a6e,lo mejor es buscar a la iglesia evangelica para que ore y espante los demonios que alli operan,0,0,0,0,0
spa_8bf76bde449b05a7b8eee5bcc9002e50,"lo normal en una dictadura socialcomunista,islamica,feminazi y bolivariana.",1,1,1,1,0
spa_d0d05ca64364751ad363a1c2374b9eab,lo que es menos normal es asociar cura y homosexual con pedofilia.,0,0,1,1,0
spa_9afe73cda1a05080e4bb38b2100283b6,"loca era homosexual,por dios. que mania de trans-tocarlo todo, cono ya.",0,0,0,1,0
spa_e07236182cc5690ba400adb79afa22ca,los arneses si han arruinado poquito la estetica homosexual.,0,0,0,1,0
spa_07ff1d4676b9e2f63b1e9ce07749c92c,los de la iglesia evangelica siempre de la mano de los politicos corruptos. de plano les untaron la mano con una buena limosna.,1,0,1,0,0
spa_c3d3f05e955e11c70e5a588ebcd4cd6d,los delincuentes usan a la iglesia evangelica para mantener sus fortunas,0,0,1,0,0
spa_fccf0f05235bc91a3f591e8ccf9f56b6,los feminazis dictadores se juntan,1,0,0,1,0
spa_a0aa6c6df35790319b5a7a7f50584d87,"los mgtow, si. muchos son como las feminazis pero al reves.",1,0,0,1,0
spa_34e9b219000ec106d0cb949977b6e21b,los politicos corruptos utilizan a la iglesia evangelica para lavar dinero sucio,1,0,1,0,0
spa_d5d1afdd9c3a9bbf18b28911a29ef8a0,los ultras y los otros sentenciarian a todas por abortar.,1,0,0,0,1
spa_f7042511e292ccbad4f7f22a1bbdaeb7,lucia casi se casaba por iglesia evangelica nos conocio a nosotras y ahora toma falopa del culo de un enano,0,0,1,0,1
spa_991d84ac7ecb1ea877206f258b41b7bb,luego que por que no se toma en serio al movimiento feminazi,1,0,0,1,0
spa_c91112bdf38e4b8a1763232f0e890e54,macri es judio o no lo sabes todavia,0,0,0,0,0
spa_df00a1ae38bd0e9ff4bb2ba7018caf82,"madre mia, la dictadura feminazi esta cancelando a los hombres.",1,0,0,1,0
spa_fa3347675b6da6e739ce32ac68e7e194,magdalena contreras cerro del judio,0,0,0,0,0
spa_dfd2a8e8af090bd7f952987411053791,"mal augurio, debio abortar esa mision",0,0,0,0,0
spa_bcbafaf3e332ec9a4b9210bfbfb9a13a,maldito ministro hediondo indigena,1,1,0,0,0
spa_d0db07afc8be3ab76bed42720226579a,"malos programadores: voy a preguntar a chatgpt
buenos programadores: voy a preguntarle a brahma, mi youtuber indio de confianza",0,0,0,0,0
spa_7d10686ceb012818fdf98275afde224f,"martin, como podes ser tan fascista siendo judio",1,1,1,0,1
spa_ec1739e5bb144ece9b8f49722248a6ea,mas ciencia y menos dogmas feminazis.,1,0,0,1,1
spa_2406e5c2f6463c63f2cd897ac4f17b26,mas pelao que la pipa un indio.,0,0,0,0,0
spa_04fc84070d0abf8e107fa5b9a7482467,matriarca puedo ir a abortar con amigues?,0,0,0,0,1
spa_acd67f4d0f2ac619be2eefcbf2d1852a,me compre este pantalon homosexual en rebaixes,0,0,0,1,0
spa_e8f2616ef4e1cb2d547ef0f69acc8ee9,"me congrego en una iglesia evangelica , y este domingo fue entregada esa informacion .",0,0,0,0,0
spa_cf046269a88bbb2cd75ca4a0bcfec471,me encanta tu pijama judio.,0,0,1,0,0
spa_5faf19ade748faaf1a620b6f8a13df9a,"me encantan los latinos,negros,chinos,indio,europeos,australianos me encantan las personas sean de donde sea",0,0,0,0,0
spa_c7cc688ea4ce47978876b97d0a2f97b4,me hubiesen terminado de abortar para esto,0,0,0,0,0
spa_bb1b5fea927ab26e4efc47ce7a9864cd,me iba a poner a limpiar pero habra que abortar mision,0,0,0,0,0
spa_cd4ec4370754e587d5edd862e0806969,"me imagino que esos aristocratas ademas de ingles hablan el idioma indigena que esa ""india"" habla.",0,0,0,0,0
spa_0673c7c086eec87ed635b41b42dd802d,"me lo imagino, las feminazis son asi de nazis",1,0,0,1,0
spa_748d94a92cadd8d3634f792638eb8615,me pueden abortar a mis 27? mi vida mi decision.,0,0,0,0,1
spa_c5b1b9ab2186bba761d329b4b7af7dc8,me puedo abortar a los 26?,0,0,0,0,1
spa_6c827c0324f0762f4cefad710498f3c4,me suena a pueden abortar porque no las abortaron,1,0,0,0,1
spa_c7ba489165d58377c0527d2b7d61aefe,me veo demasiado homosexual como para conducir un coche :/,0,0,0,0,0
spa_b839260880ccf7c0eca746f64a2ea77d,"me visto de negro,se viste de negro",0,0,0,0,0
spa_83627cec85370617cfbc46d4cc7252bf,"mejor abortar! ,no? vaya tela!",1,0,0,0,1
spa_4cf1d52c63270aa0edfc40ddc71355d7,"menudo ejemplo un partido feminazi
para cuando un partido progresista,rojo de izquierdas pero no la bazofia feminazi?",1,0,0,1,0
spa_0951d12a59b4274f42108d7fc52db744,"mi apellido paterno es indigena
y el materno es espanol.",0,0,0,0,0
spa_f70d9e0eef62f4b4eb571ae06ea8cdd6,mi furro comunista homosexual espanol favorito,1,0,0,1,0
spa_eb0b328653193025b3bf6a6fb5587f8c,mi hermana de 10 va a la iglesia evangelica por decision propia por favor en mi familia pisamos una parroquia y nos prendemos fuego,0,0,0,0,0
spa_b3b45f22c385fe3a7ce8168f97e45039,"mi isla eterna recurrente en mis suenos, con mi abuela partera y la maria la indigena que me enseno a respetar a la pincoya.",0,0,0,0,0
spa_7ef304ceb5ae01a3f6e840ed0be46625,mi mama no quiere abortar este bebe de 24 anos?,0,0,0,0,0
spa_7dc1142b6eb889c56390a70e2139f43a,mi padre pollo homosexual disfuncional favorito,0,0,0,1,0
spa_2c3276608fe66391164e0682175c979a,mi tia evangelica homofobica y mi abuela paterna jajaja,0,0,1,0,0
spa_0090c4896fb0db0166de4ad461dce958,"mi tio, homosexual, jamas habla del tema. es el unico tabu que tiene.",0,0,0,0,0
spa_2f00fd8bc0b701d98981d84ed19f53e3,mi unico indio en este lio,0,1,0,0,0
spa_1ddf4bf510a0f922d4fdc3837114b188,mi vecina decidio no abortar y ahora estoy pagando las consecuencias,0,0,0,0,1
spa_3045bf69c8ba3cac2f524e568d80e4f5,mi vieja era evangelica y le arruinaron la cabeza con el demonio y el infierno,0,0,0,0,0
spa_8282ebfd168d83a9cdf4decd94f5426c,mientras mas putix y perrix mejor!!! para que te arda la panocha feminazi,1,0,0,1,0
spa_acd0f7fbfd1b04872b28286e658db156,miguel angel blanco en verdad era negro. y negro.,0,0,0,0,0
spa_dddf261e382f4fc9b20392460231f1de,"mintira!!!, nengun musulman viola, son mintiras cristiana",0,0,1,0,0
spa_1da4dc6c5aef900feafda6427d6df190,mira a ver si ya a ido a abortar,0,0,0,0,1
spa_20baa26011559a738c9f6a883542fcd0,mira como adoctrinan a las feminazis ! gracias por tu aporte ! #iratonta,1,0,0,1,0
spa_188bd4ac37c030c383643f8b964f9ed8,"mira que la cancion tenia su ritmo, pero feminazis no.",1,0,0,1,0
spa_82b7e6a80e1064556e273f3e5a1373c0,"mira que lo de ser evangelica me sale como el culo, pero la biblia te la puedo estar estampando en la cara.
viejo malparido",0,0,1,0,0
spa_f8c930ebf5b9b18015854f61f6d2197b,"miren las feminazis con gasolina en mano , que habran querido hacer ???",1,0,0,1,0
spa_7b5b81beeefec35a75224882fdeb2dcf,mis favos! la caja negra!!,0,0,0,0,0
spa_e637e7edcad7be9c50fbf69355681a9d,"mmmm por que estara maldito chile,,,,, sera que somos un cementerio indigena",0,0,0,0,0
spa_43943afdba2e62eda60cef45968d67ab,"mongoles, cantones y chino-chino.",0,0,0,0,0
spa_dc8b98445dbf951ac5376d8d1d5ed0b0,mucha belleza. eterna la negra.,0,0,0,0,0
spa_aca46c7efd0e6599501e323293a9a8d6,"muere el exprimer ministro indio manmohan singh, el economista reconvertido en politico",0,0,0,0,0
spa_0495f213f1e7f86cc780912d59827003,muestra numero 1 de un aborto fallido,0,0,0,0,0
spa_1f1aa850d9916f00e383a874ad33eea7,"musulman, arabe,eso es su filiacion del cabro",0,0,1,0,0
spa_89cafb9b8ac4f923bf3efd2fb53f5235,"muy cierto, la ocu esta muy corrupta",1,0,0,0,0
spa_746548fffceca3d87633df3efa387493,muy poca informacion sobre los origenes de esta nina! es indigena?,0,0,0,0,0
spa_479471b01b8d51b648fbdb338119ca41,nada que el poder homosexual bricolistico no pueda lograr.,0,0,0,1,0
spa_4b2906042fe9919f0c440a301f9fd7b5,"nadie:
yo: mil caminos de lucybell es una cancion evangelica",0,0,0,0,0
spa_54dd6e38ad55467f55ebd707573a6c91,"negro , negro como un zx",0,0,0,0,0
spa_e6bed8e9e69d3736bb805a9192dfbf49,negro al negro. cuando no habia tanta noneria!,0,0,0,0,0
spa_07f547f52b3c1c777c6b606331e1b75c,negro con negro y matices negro y detalles en negro y luces negras,0,0,0,0,0
spa_3b39439dfba363ded3a0eb88b9819ef0,negro q veo negro q le pego un tiro,1,1,0,0,0
spa_1c1b21bd66a13f5d95072ac0b4f6568a,negro x negro= se anula la falta,0,0,0,0,0
spa_9ab1d5e70cff677699a9b43e328cb6aa,"negro, tambien use color negro en ano nuevo :4",0,0,0,0,0
spa_c9ca39bb6bc3c6e795a2bbd558fdf1cf,negro. el negro nunca falla,0,0,0,0,0
spa_81559b4624b661b19f3a3005a352ddea,ni el aborto tampoco.,0,0,0,0,0
spa_81c8de41ceb2c56f1f4578d7ca0b5a30,"ni feliz ni hacer lo que les salga de los cojones.
y claro, feminazi y tal.",1,0,0,1,0
spa_6dbab6adb3e318c7019a4338fbb69285,"ni idea, no soy musulman",0,0,0,0,0
spa_55a927a60bbd1c2f330317866dc4019b,"ni indio, ni hispano pero
caga como ellos.
h-1170, susoski",0,1,1,0,0
spa_7d1bc34abaf98d6aef1060dae1f65dad,ni me extranaria que se pusiera a decir que la edad de consentimiento es manipulacion feminazi o algo asi,0,0,0,0,0
spa_efb624f051058f0d995cf64e5b858b75,ningun pandillero es musulman verdad? casi todos tienen mamas evangelicas. ya me veo venir los siguientes pasos de esta d.,0,0,1,0,0
spa_e0ade9a5f15eeab482f1553ce5e7abca,ninguna feminazi zurda protestara.,1,0,0,1,0
spa_5767859677a69eae41c1b874ea21e056,"ninguna mujer deberia ser juzgada por abortar. es lo unico que te digo.
#abortosincausales",1,0,0,0,1
spa_1706d1257d203e6a6d1dd766f445cd89,"nisiquiera saben lo que votan wn , te apuesto , leen ""indigena"" y votan si",1,1,1,0,0
spa_57896e5f7363fe78a6f94c543ee43a0b,no agregues mas minutos x favor musulman de mierda estan en juego los papeles de mi casa,0,0,1,0,0
spa_0f93476ff373d48e9bbb67143cf177e2,no al aborto salvo yo,0,0,0,0,0
spa_c307fd11134c560e3670ff4612a18346,no conozco ningun facho homosexual que no se manifieste homofobico,1,0,0,1,0
spa_a1e4a44498c123b1778f7c2c2e539f5c,no esta ejerciendo su libertad de expresion como las feminazis?,1,0,0,1,0
spa_0201c0fa5297a538e060741a2bc48f5f,no haga caso a las feminazis carishinas!!!,1,0,0,1,0
spa_fcf450b88c22174a7ed3dd37f74df586,"no hubo fecundacion , que va a abortar?",0,0,0,0,0
spa_f6dac9c5745caea828f8ce43d2c3c994,no me pueden abortar a esta edad ?,0,0,0,0,1
spa_e8878c73766b0576362b5a22c685d1c7,no mintio no puede abortar,0,0,0,0,0
spa_d8dcec6d2796747f2be7c93db7a1d27d,no pudo abortar la muerte,0,0,0,0,0
spa_06466431bc876e0eadb9ba3edfe9ee0e,no quiere abortar? no aborte.,0,0,0,0,0
spa_b30b160ab990a47ee87d8276efdcd789,no recuerdo si es el mismo estado que buscaba penalizar a las mujeres embarazadas que cambien de estado para abortar y a quienes las ayuden.,0,0,0,0,0
spa_2d40dc1bed573a6e1825707b4b79e95b,"no representas a nadie, salvo al colectivo friki de feminazis",1,0,0,1,0
spa_e9e9b3f934560c4474537c7663c2d242,no se cansan de hacer el ridiculo las feminazis podemonguers,1,0,0,1,0
spa_1cae7b6cdb6c35506c74b309eeb1c348,"no se porque, yo pensaba que monedero era homosexual.",0,0,0,1,0
spa_bde924929c9178146eb35baee61276ca,no se puede abortar a esta gente ya?,0,0,0,0,0
spa_9d09640f944a854f4cb49a3f37559912,"no sera mas bien arabes? digo, musulman es el que practica el islam",0,0,0,0,0
spa_38477bc4bee87929b4a50280bbd2421c,no solo estoy a favor del aborto. lo estoy tambien con caracter retroactivo,1,0,0,0,1
spa_a0308345cc20dba7347f19a40681bb08,no voy de vacaciones a un pais musulman ni aunque me lo regalen.,1,1,1,0,0
spa_0f30c21701d57aaca17ff4bba7cce1ba,"no, emilio es hombre y no puede abortar!!",0,0,0,0,0
spa_fb7edf99852f550fc90bbe3211b29682,"no, este cartel que dice ""quiero que mi hija tenga el derecho a abortar que yo no tuve"" no es real: esta manipulado",0,0,0,0,0
spa_5fe8908e7d54e8d169cb9678dd5109b3,"nooo, amigo, puede abortar? (obvio si ella quiere)",0,0,0,0,0
spa_2f8ec5de28a72b62ff7163d149d670dc,ns si soy el unico musulman que tiene curiosidad de estar borracho,0,0,1,0,0
spa_5d31f02f9fbd58333e27febabc3efd1c,"nunca habia visto un chino con barba o un chino fumando, pero he visto un chino con barba y fumando",0,0,0,0,0
spa_83c6e760bd48d718864ff40226bcaf88,o sea con el color indigena de piel,0,0,0,0,0
spa_e52300504b4088cd0633d267fd147c83,"o sea, le decis nazi a un judio?",1,0,1,0,0
spa_fe965846700d61eab5440d75940f094b,"obvio. era el aborto, el otro tema.",0,0,0,0,0
spa_73e0a441e881b0b4099fb0ec0bc9196a,ok pero que vayan a pegar eso a una iglesia evangelica o catolica justo el dia y hora de misa a ver que pasa,0,0,1,0,0
spa_1f02e426ff22f1880b3a1fd3d412e82d,ola choy homelo chino choy como homelo pelo homelo chino,0,1,0,0,0
spa_588767d079dbdbd2029ca6c4ffb02ab1,ole esas feminazis si son muy locas.,1,0,0,1,0
spa_71fecd2450b72ff403778c84685449fe,"otro argumento mas a favor del aborto, para no juntarse con fracasados pololos.",1,0,0,0,1
spa_8005037e0c257b69d97696e82f01c5db,otro paro indigena y ahora porque carajos es? ya cogieron a cali y bogota de sus marranos,0,0,0,0,0
spa_3beb9f8700149024957d7f0ab16ba75a,"para cuando decide abortar, ya ha reflexionado.",0,0,0,0,0
spa_dfc25634e0ec063f9f941e094b1cd04e,"para cuando el titular ""a abortar que se acaba el curro!""",0,0,0,0,1
spa_02c3ccf93ca519aee17b75f2218d985c,para ellos cagar es abortar!!! jajajajaja,0,0,0,0,1
spa_6a98dd44edace708206f234c69afcab5,para las feminazis las mujeres de verdad no contamos,1,0,0,1,0
spa_444ada5125a07f9e1bdae5d3e14fc934,"para no oir a bisbal, no nos ha quedado otra que venir a un restaurante indio.",0,0,0,0,0
spa_922fe14d774675b25e6c71ef3483197c,para ud para un musulman le vale tres pepinos,0,1,1,0,0
spa_f97ed835c0babc3460c560684510aa47,pasotti es apellido indigena? virgilio 13 cana,0,0,0,0,0
spa_342da8d09e63103dbdedb5435e54b02d,"pedro castillo es catolico, pero como la gran mayoria, no lo practica. su familia es evangelica.",0,0,0,0,0
spa_6f446acbd97f6486c62b598699e1fdc8,pendejo indigena ahora si ya no me puedo permitir q seamos amigos we,0,1,0,0,0
spa_f326077e1e248e7c04a3ec90ce7e1f95,"peor fue lo de su madre, que estaba a favor del aborto y al final, decidio tenerla.",0,0,0,0,0
spa_28f4c1ceae52dbb6a8b200c92ec62e3c,pero con 16 puedes abortar. estos comunistas son asi.,1,0,0,0,1
spa_039cd0898a62ae1b21f3b87576bbced9,"pero dado el caso sus hijas, parejas, irian a inglaterra, francia, a abortar porque tienen sinwro",0,0,0,0,1
spa_4d89d0c5035925dce20357aab0009b04,"pero las publico hace anos, creo. es una noticia antigua pero lo del aborto no habra perdido vigencia.",0,0,0,0,0
spa_b7ad0c86843564047936fab1149883fa,"pero luego ""the handmaid's tale"" es una exageracion feminazi.
a una crisis de fertilidad estamos.",1,0,0,1,0
spa_2eb15eeb8f0e1e2fbae059df7aa77e63,"pero mira el buen aborto q se perdio esa mujer!!!!
aborto retroactivo por favor, al pelotudo q nos obliga a parir",0,0,0,0,1
spa_b0c6a710886f235db58402182d7c3d27,pero mujeres como francia feminazis no.,1,0,0,1,1
spa_e68fd219687eac4f0be21e3c1121cac5,"pero que vas a esperar de una gentuza que tiene como alcalde a un musulman, son escoria pura",1,1,1,0,0
spa_05aa03d5442e9af569ea3e2bd9477ab1,pero si es uribista entonces es un indigena sin dignidad,1,1,0,0,0
spa_cea6612b4639a4c51a423c9fe90f5e07,pero si ese fachito pibre tb es indigena,1,1,0,0,0
spa_1471d5e67378bf057c3ed04d9117a51d,peruano indigena mal cogido por olimpia,0,1,0,0,0
spa_136850686941412c57cbcb9e680dd059,pinche puto culiado estupido pendejo profesor orangutan negrote indigena,1,1,0,1,0
spa_2726e0c9df92f759c564e3b53deba143,polo polo el indigena?,0,0,0,0,0
spa_51ffa8f2a3ec19a875abdc4032fdba52,"ponga a su novia abortar, usted es un imbecil",1,0,0,0,1
spa_ad022d0bc6a448f026236889d32e64ce,por el derecho a decidir!! aborto libre,0,0,0,0,0
spa_7a2d21b8456d637c7b623991b356f121,"por esa caracteristica falta de agudeza politica, hasta la evangelica le gano en marzo",0,0,0,0,0
spa_6f7207be29e22b94653f886e668f805f,por eso les decimos feminazis,0,0,0,0,0
spa_0cb44e4724d063608a4446c8a4e500fe,por eso te durmieron 1 semana puto indigena de cagada,0,1,0,0,0
spa_05f4267072e195acab5e8677df38ba72,por que nunca hemos ido a comer indio o mexicano o similar tu y yo?,0,0,0,0,0
spa_74550c532efb37985dbbba941849e50e,por que tanto homosexual en esta red? como hago para filtrar tanta mariconeria?,0,0,0,1,0
spa_2cea6aef4e974cab821d859b9b5ae290,por que todas las feminazis tienen problemas de vista?,1,0,0,1,0
spa_7d705998c043be7d0ddf3582497725d4,"por ser aliado de lar terfas y feminazis.
lo dicho, completito",1,0,0,1,1
spa_c0857b8a9935f8cf20816758338a5323,por si las feminazis,1,0,0,1,0
spa_17e08d3045355a6d5fa05c7ff702d5b4,"por supuesto, si las feminazis estan a favor de iran",1,0,0,1,0
spa_8c87af50374a54b5e78e85c85534839d,porq esta red social piensa que soy homosexual no entiendo,0,0,0,0,0
spa_00cffc8595ef4d014ff2699589968acd,"porque acosaban a mujeres que iban a abortar, porque si llegan a pedir vivienda digna para todos no estan ahi ni cinco minutos",1,0,0,0,1
spa_e91ad09c069337683274c19da1ec8ab7,prefiero a la gente que se siente incapaz de abortar pero entiende que las demas tienen derecho a decidir hacerlo,0,0,0,0,0
spa_fd2436581f5bc36b76667482d21c9426,prefiero hacerme musulman y no tomar mas.,0,0,1,0,0
spa_c05380e61a85efac14b3caaf8672decf,preguntale si es una feminazi de esas y hablale de bitcoin,1,0,0,1,0
spa_7c5433ae3f2e0f985eda2efb775f87ef,profe se va a hechar a las feminazis de enemigas,1,0,0,1,0
spa_36a4e268c68fee3a39f895e1945cce35,"provida, y cuando se entero que quedo embarazada quiso abortar, hipocrita.",1,0,0,0,1
spa_b0b35e97cf83ff83dac0d3eccae57c01,"provocador. se ve que el indio le dijo, que no.",0,0,0,0,0
spa_ac8cfce77421f88f0d857b9a846baa85,pucha no vas a poder abortar. jajajajaj,0,0,0,0,0
spa_b235023fd0eba3a88d4088d236d41802,"pudiendo hacerlo para ambos,,,las feminazis hicieron lo suyo",1,0,0,1,0
spa_edfe0435d4bc7d1f641e0b7668b3497c,puedo asegurar que con unas feminazis pasadas de imc no iriamos primeros,1,0,0,1,0
spa_dba1ad34c91adf42940301aebd2dbd77,puedo ir a abortar con amigues?,0,0,0,0,1
spa_10b50c79c63174a97ec0a32ad9379449,"pues a mi si, me molesta y me enfada, abrazote de una feminazi, veganazi",0,0,0,0,0
spa_4a823add3cb813e4ce7e318f70b1564c,pues aqui en espana bastante mrjor que la tuya indigena,0,1,1,0,0
spa_17feb09c980d6844a43f78e4083c7ff1,pues es una ideaca: abrir un perfil en tiktok con gente que nos ofrecemos a acompanar a mujeres que quieran ir a abortar.,0,0,0,0,0
spa_5a03892581bf683d5b0ceeab3323e119,pues gracias por el dato. el partido progre es la misma basura feminazi.,1,0,0,1,0
spa_76979e5af2b634afb4b3355da72e61f0,"puto asco de feminazis, el pais se va a la mierda.",1,0,0,1,0
spa_4cb7dd0679364edb5fcf43dfc95b9988,q lindo donde estan las feminazis?,1,0,0,1,0
spa_de0c946c6cf64fb1179e34837e8a14d0,que aborto de la naturaleza,0,0,0,0,1
spa_56f756f4379c0a4a1dd60d8b186d1d20,que aborto nos perdimos!!,0,0,0,0,0
spa_640eeda681912fb413bb4ff149ccbf4a,que barbaro loco nadie tiene descendencia indigena ni parentezcos africanos,0,0,0,0,0
spa_aff0ac2578a701de0869d40720c78d93,"que culpa tiene el cuadro, definitivamente son una feminazis",1,0,0,1,0
spa_43ca5da462fb342b808ebdd51d59c61d,"que demande a los cirujanos porque sigue feo con ganas el ""indigena""pederasta",0,1,0,0,1
spa_8d1554b08a9bdc7f76dbdb9c354d93b8,que dicha abortar ese tipo.,0,0,0,0,1
spa_02bbfe83bbc4f1a753256b00b6e00d0f,"que el negro, nos bese el negro con un beso negro",0,1,0,0,0
spa_c3e260a602ff23fc446fa52a796532a7,que el saxhiel si es bien indigena,0,0,0,0,0
spa_b0c94d7f7be651d71c7cea8cb0692e8b,que empiecen con las feminazis,1,0,0,1,0
spa_5afdfe43b6a7de888881f23125b51db4,"que es un agujero negro?
un negro vendiendo agujas",0,1,0,0,0
spa_fb195894981a753051f0c22948ce6578,"que finde mas rural, bonito y homosexual",0,0,0,0,0
spa_a9ddf7c3bf879205dbf912085ce96e37,que infumable estas feminazis,1,0,0,1,0
spa_043846eeed3b4586ebb310dae6fd0da6,que judio es buena persona?,0,1,1,0,0
spa_aff535472396e51530fb269e6b454082,que la ayuden las feminazis!!,1,0,0,1,0
spa_90fa921c428172a3f13c1b4e19f8d162,"que la iglesia catolica prohiba abortar a sus feligresas y dejen a los demas en paz.
atajo de pederastas.",1,0,1,0,1
spa_8e4286ebca27fd0454450d5a087903cc,"que me importan los favs, si me importaran fuera igual de fantasma que tu indigena chucha de tu madre",0,1,0,0,0
spa_7f01cde450b39491ce4313f1b7e527ec,"que por cierto, nacio en mumbay y por tanto, indio de nacimiento.",0,0,0,0,0
spa_108dbc19e57284c2b3b7cefcb04fc08f,que se llame valentina y sea evangelica. paradoja de dios,0,0,0,0,0
spa_a821eb93fae4734f27148e182efd0e32,que sea homosexual no le quita que sea gilipollas.,0,1,0,1,1
spa_21d4bb8b31b7a2b15823a4f7eb8e6233,que tapon de boca le dio mi chanel a las feminazis #eurovision,1,0,0,1,0
spa_d6e714a82efa282ecc6745736deadf53,que vuelva la peste negra!!!!,0,0,0,0,0
spa_ed031a2e88b8bb5f40035fc59a89d18b,que!? mi hijo es negro!? negro!?,0,1,0,0,0
spa_f9f193249a0663d4c0d1877c6747da0f,quede tan lleno que necesito abortar el almuerzo.,0,0,0,0,0
spa_d62dd8380803a97acb2c3fe32789104e,quema la verde perro judio,0,1,1,0,0
spa_4a8ac6407f1d1e775c1b29baee30fed5,quiero comer arroz chino. :),0,0,0,0,0
spa_8c2c4d56439b1ac8f29b783402e9a30f,quiero comida china quiero comida china quiero comida china,0,0,0,0,0
spa_75e27d14fa9970e4e2080bf3e4451fc7,"raza negra, tienen la cara negra, no se no conozco de razas de oveja",0,1,0,0,0
spa_49ace411b333ab364118fd8776a62899,"repiten como mantra, homosexual = pedofilia
pero el presidente no dijo eso eh",0,0,0,1,0
spa_615e31f72d638fbc6efe3fee2408e87b,"reto a hacer esto en un mezquita musulman , obvio que tendran miedo por que moriras",0,1,1,0,0
spa_1ccd80039fee4669cba5079963915e16,rubro-negro segue rubro-negro,0,0,0,0,0
spa_7647b92a06585240f6629904899433e1,sabian que el 21% de la poblacion en mexico es indigena?,0,0,0,0,0
spa_7cd1fee68fec4841a7e374bfc2dc0537,"sabias que jesus hijo de maria es musulman, su madre es musulmana y toda su familia es musulmana? la paz sea con ellos.",0,0,1,0,0
spa_f9b8d419fb129d437c0dc8bb235b5341,se dice homosexual no homofobo,0,0,0,0,0
spa_a9a8cd00b1cfbd25cb54c95035e15849,se empleaba para abortar hace muchos anos,0,0,0,0,0
spa_35ac1e401c0b84c8de1341575da21f05,se fueron a la basura los argumentos de las feminazis .,1,0,0,1,0
spa_3afcef8b07467f69a04dc173d4cca9db,se les caeria el castillo de corrupcion,0,0,0,0,0
spa_276ba5d3c51607ac20a50aa7db0f17ab,"se trata de deshumanizar, de ahi que les encante usar inquiokupa, feminazi,mena, wokismo y otras tantas sandeces.",1,0,0,1,0
spa_3f355013eaf23cf69642880fd25a8c77,senora usted igual tiene parte de indigena no creo q solo tenga descendencia europea,0,0,0,0,0
spa_e48cee3bab475320c635c20f0943eb69,ser indigena es cuando vives en tucuman,0,1,0,0,0
spa_a7f6a54006eeb583ca4c5a09705dc9aa,sera que es musulmana? todos la hemos visto con el velo musulman.,0,0,0,0,0
spa_9f064f37491d2492038f499b3cd790f6,"seria el papayazo, para nombrar la guardia indigena!!",0,1,0,0,0
spa_2a98208a6e2b97fcba64801e3bf950eb,"si alguien dice <<woke>> y/o <<feminazi>> no falla, es un imbecil",1,0,0,0,1
spa_4b3bc17fd60ca874b85ac4d8dd5f24ed,si era evangelica se explica todo.,0,0,1,0,0
spa_37803d2885c9f31e3a6e1280ebcfd640,si era hombre le daban 40 anos y 20 marchas feminazis,1,0,0,1,0
spa_eea3d6efff24f2b9e513e774fc28b9f5,"si es de origen judio, y?",0,0,0,0,0
spa_96e2554d3b68105824b5ae1e1423eea5,"si es negro es negro, si tiene blanco es legendario",0,0,0,0,0
spa_a7b7e3968d5ec647e025fd0f049e4508,"si hubiera sido un musulman pondriais ""condenado un hombre"".",0,1,1,0,0
spa_a45b0b08f89651cfa02be24d29acadfe,"si me cansa mas de lo que puedo disfrutarlo, debo abortar mision?",0,0,0,0,0
spa_d1f6031cbb7b4a037dc17537734bbacd,si pueden abortar con 16 anos pronto podran votar.,0,0,0,0,0
spa_b7952362b6b590895220725af2d66378,"si son homosexuales no musulmanes vas preso no mas. si sos homosexual musulman, te condenan a la horca.",0,1,1,1,0
spa_65e967ad0a0ffcdd83ba2e9f5b044ddc,si te dejo fue por fea e inmadura. a parte de evangelica osea nada pintas aqui,0,0,1,0,1
spa_bbb736d3d2c1492a0c4dfb420e96d1fe,"si, lo se. pero siempre pienso en una frase del indio ""nos merecemos bellos milagros, y ocurriran""",0,0,0,0,0
spa_9657f2199b036cf002ec325d0720cf4d,siempre pienso en abortar el heteropatriarcado con una cuchara en el zocalo,1,0,0,1,1
spa_554e64febf60b000a0c85e04390cbab6,siento decirte que es verdad soy homosexual,0,0,0,0,0
spa_be782932cfda8624eacea940daccd48c,sigue siendo igual? o es una iglesia evangelica?,0,0,0,0,0
