id,text,political,racial/ethnic,religious,gender/sexual,other
spa_a9e06a90d1ac9fd070b25d5eb81e297f,literal les pela x completo el islam y se auto convencen de ser creyentes cuando son solo ignorantes,0,0,1,0,0
spa_690c7877ad75e39df92956e26d59cb11,llamar neonazi a un judio???,1,1,1,0,0
spa_99c76b61f68ac08836b3adf63e84bae0,llamen a la marica sionista esbert que vea las consecuencias de su discurso de mierda,0,0,1,1,1
spa_120638b4478517f495453df542a1bd90,lleva cinturon cuando no le toca y no hubo beso peto por lo que sea (es un maricon enamorado),0,0,0,1,0
spa_b8b58afacd3b7da81a4f03337624c487,lo de los piquitos es de maricon total,0,0,0,1,0
spa_44f06527d6c97bf589909b28c692841f,lo digo un gringo pata sucia jajaja,1,0,0,0,1
spa_ad70cb16ef9ca704ed4e0eff2e96c245,lo mismo que a un terrorista del islam. no veo la diferencia.,1,1,1,0,0
spa_abd98028a46609cd940a625f7300bfd3,"lo que hagan delincuentes es otra cosa,la unica religion que llama a matar infieles hoy en dia es el islam.",0,1,1,0,0
spa_a264b9c382faabb3e5d3d7c0e757086b,lo que musk le ta haciendo al pueblo gringo es peor que todos los hackeos y leaks de la historia gringa combinados.,0,0,0,0,0
spa_0fa5c6e64ee0da9728429b859035d235,"lo taliban, lo mas conservador del islam, la derecha ultra musulmana.",0,0,0,0,0
spa_a81969b41cbc5c48e8f8dfecc9bfe6f8,los caprichitos de la nobleza corrupta,0,0,0,0,0
spa_0320c271f46adab82b6e59d046c1cb85,"los de unicornio sin duda, como buen maricon",0,0,0,1,0
spa_d7819d6faf5e51dd3bf91d3bff014ac9,"los mismos genocidas en israel y ucrania, israel con palestina y ucrania con donetsk y lugansk",0,0,0,0,0
spa_78951b301065d983ef633e733e37ba83,"los nazis me hicieron tener miedo de ser judio, y los israelies me hacen tener verguenza de ser judio.
israel shahak",1,1,1,0,0
spa_685a630c5c97d085d4004e9693df4c33,los palestinos no estan de acuerdo con este judio.,0,0,0,0,0
spa_884a0b60c64e28b4c17ba732aa2709d3,"los primeros que usais la palabra maricon sois los mismos maricones.
no me vengas a dar lecciones de etica y moral",0,0,0,1,0
spa_eb58fd76db01ded5b08d9a64e58f9c58,"los que hacen eso son terroristas, no verdaderos seguidores del islam",0,0,0,0,0
spa_174031e800679c6c1aa0c7d653892647,"los toros peleas de gallos,caballerizas y el 21% de iva en veterinarios si y viva en islam",0,0,0,0,0
spa_2d6ab88c0d5e087ea872be116cfa0009,los turcos son los batllistas del islam.,1,0,1,0,0
spa_bbd43b5e8aa7c90508a759a6d631c5a5,madre mia! convertirse al islam!!!,0,0,0,0,0
spa_1475257f994b615e6fe05cc54900f641,"mal me parece que lo escribiste vos, judio de mierda",1,1,1,0,0
spa_1a3a0a60c9b9c229b4730ad0027b7d64,maldito sea el imperialismo gringo y europeo!!!,1,0,0,0,1
spa_cc7ad4cd86c6080e691d8fa4134ecb60,maldito seas estado de israel,1,1,1,0,0
spa_b73e1d3a0e2215a74e0e328b4dd4e35a,"maldito seas, estado de israel!",1,1,1,0,0
spa_bc64d195ee90551bcf41f66038b9f0f3,manden a un pariente del italiano gringo para que haga su trabajo alla en vnzl,0,0,0,0,0
spa_64837a252ee2e10ead22ab3c556c3bf8,"manuel en directo: israel trabaja
manuel por detras: israel no trabaja",0,0,0,0,0
spa_6a985073387e4d97c79ccf5e8fcca300,marica eres una marica resentida,0,0,0,1,0
spa_e57151f68d9f7f40b301d8e3195f24a4,"marica no gay, marica es el presta plata",0,0,0,1,0
spa_dcd154203b7d6f01a02f15563d6ccea1,"marica que escucho eso, marica que extermino",0,0,0,1,0
spa_5c5e29d92a9bb87a31a66159bde54983,marica que tu enlace lleva directo a la respuesta! jajajaja spoiler de buena manana,0,0,0,1,0
spa_33155c842dbd47445e4c9458d9efe565,marica vota marica es secretosky.,0,0,0,1,0
spa_4406c3e29310ba4ccb050119f699629a,"marica, la peli es mision imposible! por eso te lo pongo en la publicacion",0,0,0,0,0
spa_3c1c4ac86479c614ccc432cce5f6c686,maricon al que le zorreo maricon que es capricornio esto es fijacion ya en plan estoy buscando a mi padre no hay otra explicacion,0,0,0,1,0
spa_41a9aa08b2ebb17b1e34bb70e182498a,maricon bi guarro intelectual comunista >>>>> maricon (y aqui no incluimos a las osas con pluma que se heterizan) >>>bisexual guarro comunista >>>>>>>>>>>>>>>>>>>>>>> gays = heteros.,1,0,0,1,0
spa_e777ca2dc1d738ad687e8dded535d579,maricon maricon maricon con con,0,0,0,1,0
spa_db66701b4c3d6cde7a6165db672fd64a,maricon si vives a intramuros de la ciudad.,0,0,0,1,0
spa_9ce4795838a63526eca3bf1409cf7859,"maricon te ves, y bien maricon",0,0,0,1,0
spa_b3fe93d4221cc213b51caeb856b45937,"maricon, estoy en la conversacion, normal que lo vea",0,0,0,1,0
spa_989302f2c1ef02621d7d32585977026b,"mas #pp
menos #democracia
mas #corrupcion",0,0,0,0,0
spa_8ed04e8d7cda201c0d18d5e4a00390e4,"me cagan los gringos por que desconocen a robbie williams, como no es gringo",0,0,0,0,0
spa_38f43c4b09ed3ebd3751f5758273b016,me chifla la cabeza lo de la migracion gringa de tiktok a xiaohongshu y que esten se esten llevando una convivencia decente con lxs chinxs.,0,0,0,0,0
spa_89b0195c5eeaf722b3e7001ac1176b31,me encantaria ir a israel,0,0,0,0,0
spa_95c71896efb6ccad9744d90b33c7e692,"me estas llamando maricon??? i mean, sisoy",0,0,0,1,0
spa_cb44f0afdc6ae9c50d7d1cd24de2645d,me hace gracia leer esto cambiando islam por cristianismo e imaginar que son tweets del ano 1000,0,0,1,0,0
spa_fd4567c70e8df594beeff5912985a833,me puedes visitar en israel,0,0,0,0,0
spa_8f5e371cc7b968ac8edb957568d486e9,"me suena a cuenta angloparlante que ha interpretado ""marica"" y ""faggots"" como insultos, no como reapropiacion.",0,0,0,0,0
spa_54f86c18ddcd089ea612d8ae0646eeb3,me suena a islam eso,0,0,0,0,0
spa_4ccfa456ca62dd2fab41491d97a2f6b8,me tiene loco la gringa,0,0,0,0,0
spa_681898d2565a3817dedb312280b68326,medalla de oro en corrupcion sincronizada,0,0,0,0,0
spa_3eca100a801662419b59db83233ae9e6,"menos de una semana ha durado cuba fuera de la lista gringa de ""patrocinadores dle terrorismo""",1,0,0,0,1
spa_22385c55c9f8e6007e82c2bd9afdd4c2,merecia que le dijera gordo marica al gordo marica,0,0,1,1,1
spa_370fa6de3b5bafc6015bce82b9a738d7,mi culo judio se estuvo ignorando twitter,0,0,0,0,0
spa_fa4f6ae0917ad621a53cefc9909ec6b5,"mi nueva serie en netflix. que llueva, que llueva, marica de la cueva.",0,0,0,0,0
spa_172edbd17cf636885346884d0bf1f16f,mi saludos a toda la comunidad judia en el dia del perdon,0,0,0,0,0
spa_83cd1d3158458d5bbf1ec8084f7cb203,"mientras tanto en #canada la salsa catsup o ketchup de manufactura nacional esta agotada y la gringa ni quien la toque.
#ketchup #heinz #catsup",0,0,0,0,0
spa_96b4d98de472567ea9afb73053c1cd03,"milei viaja a israel a recibir la medalla ""woody allen"", bremio al judio bedofilo",1,1,1,0,0
spa_cfbd244f79fb39d1ca594a96cc27f9ba,"mor, era judio, dejen ya la estupidez.",0,0,0,0,0
spa_9dfc98a5cee7b30547191cccecc9ce50,move la cabeza gringa estupida,0,1,0,0,1
spa_863433923791531e5d21f9b4b3ddd097,"muchos quieren lo q sea por parar a bolivarcomunistas, feminazis, catalufos y demas enemigos d espana, veremos si mayoria",0,0,0,0,0
spa_2669729a7bbddf98bd6e84637c343be5,muy feliz se debe sentir algunos de la comunidad judia argentina.,0,0,0,0,0
spa_53f0decd9f902de2410a890a36bec9fc,"n0000 una cuenta con un nombre en letra islam le dio like a una foto de mi cara
procedo a mwordear",0,0,0,0,0
spa_a40c6a85f2a04a7a8378caaa3f4c66c5,"nada me interesa menos que la farandula gringa, pero por que kayne west ahora se llama ye",0,0,0,0,0
spa_3337785b1fba21bcd94bccd1c5e8e609,"nada nuevo, o no te suena ""maricon el ultimo""",0,0,0,0,0
spa_e9cb7086d5ca4489d10daf3c46290504,nasa mas lesbiano que hacerse maricon por otra lesbiana,0,0,0,1,0
spa_21522b17ce3a68e7bb8a19cc36cac96b,"necesito una cadena de esas de maricon, no tengo.",0,0,0,0,0
spa_d64ad21e4bda01e9c986f91dc8137e0f,"ni al islam , ni la climatica, ni la woke, no se deberia de financiar nada.",0,0,1,0,1
spa_2ff6b97a4c9ac98292cadb6e7580a30c,ni un judio en mi gallinero!!! pilas!!!!,0,1,1,0,0
spa_83f2b7ccdfdeb6bd5f4091e9a85e0894,ninguna. pero una es islam y la otra xd,0,0,0,0,0
spa_92451e7747757e0e5fed65bc81eb8f91,"no cabe duda de que el islam es lo peor que le ha pasado a la historia
el islam es una mierda
#islam",1,1,1,0,0
spa_bc4f02c46a711242576f4d843cc5e432,"no compres gringo, compra colombiano y por ultimo chino. ese es el camino.",0,0,0,0,0
spa_21cd9ee44b17bce8d5ad4ee050a4fda4,no entiendo porque me salen noticias de lucha libre gringa como si fueran noticias de verdad.,0,0,0,0,0
spa_5c6d78e8f0e1eceb535772fbe8c4b34a,"no entiendo, entonces por que el gringo sigue siendo el mayor contaminante del mundo?",0,0,0,0,0
spa_363511dc37790b0564570c17d614e220,"no eres gringo, pendejo, habla en espanol.",0,0,0,0,0
spa_d92c7e0bd3bcdd6db1190d56c2298f8c,no es el embajador de israel sino en israel.,0,0,0,0,0
spa_0911ae9ccef58d4d7b77d15fd9ba130a,"no es judio?? que boludo es , por favor!!",0,0,1,0,1
spa_4aa51cdf2bdef9d56881a13f4ecef7c3,"no generalices bro, ese es un pensamiento gringo y los gringos estan pendejos",1,1,0,0,0
spa_fe2158d7228da37403f7fae4c45dce8e,no ha defendido asi al islam como a los gays en su vida,0,0,1,1,0
spa_05aca74addeab9e4e264b4a6997ab0ae,no hay nada mas bonito que ser marica plantas la verdad,0,0,0,0,0
spa_4e6d411e9bbac7495470fc545a88d6e4,no lo hago yo. lo hace el islam.,0,0,0,0,0
spa_a39e353f582f6025e5f63d55fc48fd10,no mamut! ni la judia se la creyo!!,0,0,0,0,0
spa_4b2b6301057a2ac8f106ebe4481300df,no mas que la masoneria judia ni en suenos m,0,0,0,0,0
spa_1a4a8dd9b09d0fc247f5a5d0a808e4a0,"no no.
israel terorist goblok",1,1,1,0,0
spa_c8b82ac3ae843b069331de97eebcb8e6,no puede ser. a mi me habian dicho que el islam es feminista y llevar velo es una opcion que las mujeres toman libremente.,0,0,0,0,0
spa_269c0c93771e258a5c229726a42974f5,"no puedo creer lo de keylor navas, angel di marica (?) que dice???",0,0,0,0,0
spa_38c6e35bb3cb16f2ce764c48e364a95b,no sabes ni lo que es el islam,0,0,0,0,0
spa_0836695d8795eb1eb7a88d77aaff01aa,no sabia que viviamos en el islam. gracias por aclarar.,0,0,0,0,0
spa_782eea363c288bdea5539adfe588955e,no se meta con el judio.,0,0,0,0,0
spa_857ba0afdb31a589aac93d9cd83495a2,"no se que hace mas dano, si este nuevo gringo ""shooter"" o cadena ser.",0,0,0,0,0
spa_e23f62db487626037dbb5a52f097f768,"no vas a querer, es la receta gringa de mi tia. la verdad si acaso empaco un par de quesadillas.",0,0,0,0,0
spa_418702f1d6fa0871e73624da805bade4,"no, tu eres la judia y yo el del eyeliner jodete",0,0,1,0,1
spa_100514ef333ef33a443fe92fec1446f6,not all maricones normativos pero siempre es un maricon normativo,0,0,0,1,0
spa_d49cdd65156053b62d9579cdbbd25259,"notaron que en la prensa gringa ya no se habla de san mangione? my kind of ""masculine energy"" como dijo mark chupavergas",1,1,0,0,1
spa_31666d5faf5ae66b88ef8416ad2300c4,nuestra casa es un entorno seguro para decir maricon,0,0,0,1,0
spa_cfcd4b215529ee10d77fffc77d66f711,nunca le crean a un judio,0,1,1,0,0
spa_3ce18f2cae2fb7093cdea7b36e18215f,nunca un stop israel no ?,0,0,0,0,0
spa_5bef31717e819dc1e86b763d3fcbd38a,o sea que cuando nos decian feminazis estaban proyectando?,0,0,0,0,0
spa_22ac95763cb13c24c083636c80fc07f4,"o sea, es un actor camaleonico de la derecha corrupta.",1,0,0,0,0
spa_7af9fdac14c9ba421ff0913c2dc59f71,odiara el islam pero bien que grita allahu akbar cuando le detienen como se ve en el video. que sin sentido.,0,0,0,0,0
spa_53deff3cc4be8ee5ca918ab85e30641a,odio a este maricon con todas mis fuerzas,0,0,0,1,0
spa_f94386116c28ff55d00f9c8d61af53df,"oh manda de esos! yo ahora llegue a unos de como los mongoles absorbieron el islam, esos tuyos se ven mas divertidos.",0,0,0,0,0
spa_7def1e4ff4876069f549f2b4ddecf7ec,"oiga detenga el coche que ha atropellado a 25 personas!
soy un critico contra el islam.
anda circule pero modere eh.",0,0,1,0,0
spa_8220ff390de5de4fd8e0ae95b3eeb3a0,ojala dure hasta el verano cuando media espana marica baja a torremolinos!,0,0,0,0,0
spa_ba1883de4888bd3fd69d1f6187f6bdb6,ok pero tik tok entonces sera una red gringo free????? imaginen las ventajas.,0,0,0,0,0
spa_d176cfd14070b3c1b5a66bf886cadac3,oriente medio era la capital de la ciencia hasta que llego el islam,0,1,1,0,0
spa_259648893635c99eebc19ccbbb1f4341,"osea que ""la gringa"" es infiltrada de viola. #maniadeti #maniadevoce",0,0,0,0,0
spa_04583e3b2642a063ff2a01e2afd7be36,osea que vos sos gringa .,0,0,0,0,0
spa_0d4620a0dff5e2ce5f276b4302062fc9,othmane. por siempre #annulaire #poules #oeufs #islam,0,0,0,0,0
spa_61f2261fffc405c08a4bfaf201aaaf04,otra cosa ya es encontrar al maricon con madera de novio y que sea reciproco jejeje,0,0,0,0,0
spa_c99ec116c0670fa97f88f005fe091822,otro caso aislado de corrupcion del pp,1,0,0,0,0
spa_efe6a9e9d59f12c8d411c6cc0a303edd,otro incapaz despues que ya se judio todo infeliz,0,1,1,0,0
spa_986ac9a664ba7b2220b465060937615b,otro maricon buenorro pa mi feed de lesbiana acerrima,0,0,0,1,0
spa_c437479ac1a0952f18241036bbfa92e6,otro pinche judio viendo que robar.,0,1,1,0,0
spa_4c13866d78b172a779f57bd4feb93206,"oye sebas no es judio!
podra ser racista, antipatico, poco inteligente, judio, pero jamas un femboy!",0,1,1,0,1
spa_f297440a4e886cea008e86237a86d192,"palestina no existe, es israel.",0,0,0,0,0
spa_6e6fa4472d380ae2431172b3743894f4,papito ya basta no te puedo defender mas porque soy judia,0,0,0,0,0
spa_920a58c2e92c334e617ed194a81a3de4,para cuando empezais con el islam? por apuntarme a la guerra y tal,1,1,1,0,0
spa_b8cf8ef9bd428b036542873ee730b5a9,para esta gente si no hace lo mismo que brenton tarrant es que no se puede considerar anti-islam.,0,0,0,0,0
spa_ef859ec3eb508f0c9b8a96fcc6ec7639,"para q le judia asi, en fin hombbres",0,0,0,0,0
spa_ba0e6f483caff551608bd9db201e70f2,para quien no lo sepa. mario es maricon,0,0,0,1,0
spa_24486a289b7b62503bbddc210cc7eda2,"para ti el 20 de enero es la posesion presidencial gringa, para mi es el dia de martin luther king. no somos iguales.",0,0,0,0,0
spa_ff7a8d128ec49929501aacd4b75c13a5,para un judio un saludo suyo debe ser una ofensa,0,0,0,0,0
spa_033b0b4643a265f719342999bb4c9399,parece actor falso que pondrian de presidente de espana en una pelicula gringa de los 90s,0,0,0,0,0
spa_305d32223c592739ab1bc5cffe3a3976,parece que agarraron a la gringa que prendio en fuegos los negocios en cabo rojo,0,0,0,0,0
spa_79b0a32bfb58854d39d081098e7760c2,"pavo maricon, pavo maricon, pavo maricon, no te vayas a correeeeeer",0,0,0,1,1
spa_afae0390cc506408d17dc7a5590ed3b4,pedi uno de esos test de adn y desde ahora solo voy a manifestar tener ascendencia judia pa poder pedir una nacionalidad europea.,0,0,0,0,0
spa_dce4c2e751595c67c854cdefc107a2c9,pegar a mujeres es de putisimo maricon. antes de pegar a una mujer me corto las manos,0,0,0,0,1
spa_7a6206f3fe73ec79483dfdf31a7930fc,"pero la respuesta de la judia fue letal: ""y uds no reivindiquen a cavallo""",0,0,0,0,0
spa_3795a0fc5f204a97cb1d5b3dc6c7aa6b,pero las feministas aman el islam.,1,0,1,1,0
spa_dbb369044fb2d525e45b66df5a96395c,"pero literal, eh?
la propaganda gringa ya esta empezando a pasar factura",0,0,0,0,0
spa_28ed2ac383a4d0df75fd0fe1b15f0794,"pero marica, me lo estas diciendo en serio? nunca has levantado una piedra?",0,0,0,0,0
spa_135284b0fbf3e0e857e6b2ec6027e459,"pero no lo quieren ver, se creen que el islam en una religion ""de amor"", amor por el terrorismo tal vez.",1,1,1,0,0
spa_13d423ce7b7a4373d89505b4bd3790ab,pero si vosotros sois los de mas islam y quereis rotular las calles de madrid en arabe,0,0,0,0,0
spa_cee847e3cba6bbf41694a9174b7cabf8,pero si ya me sigues ahi maricon,0,0,0,1,0
spa_aef7281c8b2bc76677c20885cda2e08c,"pienso que la retorica gringa terminara acercando a los paises latinoamericanos mas hacia china, excepto a costa rica, que esta como el meme del perro.",0,0,0,0,0
spa_d14cd9489fae0b1d0e157a06e24d0d3b,pinche judio loco; no oculta su hipocresia,0,1,0,0,0
spa_d54bac07058591ad858f1d0706beb423,"plp, ya se me cayo el judio de nuevo.",0,0,0,0,0
spa_e398bf86e2713058f49ad6d6231de47e,"pobre israel, que loco no???",0,0,0,0,0
spa_f0778deb141fe2e8d22cda7812a0c9d3,poder absoluto significa corrupcion absoluta,1,0,0,0,1
spa_88180fbd856af8ab2df883b2927d848d,"polonia no mucho, israel si",0,0,0,0,0
spa_2b6438ed5af45d46d6dd368c6b3166ff,por ahora lo q mas me esta gustando es el maricon q sale detras de ines hernand #benidormfestsemi1,0,0,0,1,0
spa_2dca4472656724e598efd3aa789c70e0,"por cierto, que lo sepa todo el mundo.
la falsedad es halal en el islam.",0,0,1,0,0
spa_6cf8578cb92b1f6a6e2fc46c3f40876e,por conazo jaja comunismo y el islam,0,0,0,0,0
spa_81c5efc20b4c9d3f41cc919c767f7cc5,"por eso quieren destruir las instituciones.
- hay mucha corrupcion.
- la corrupcion:",0,0,0,0,0
spa_175c2857e9068f88bbe642c8a6863b59,"por eso se estan inventando el apoyo de la ""comunidad judia"" y asi justificar de donde sale el dinero",1,0,1,0,0
spa_5648787a7fdc86c4c04c97aea392bcfc,"por esos lares he vivido yo y tambien mi hermano ""maricon"" y salimos huyendo los dos como alma que lleva el diablo",0,0,0,1,1
spa_523c2be6b37f21f58d5a326de3beeb70,por favor puede dejar de ser tremendo maricon 1 momento??,0,0,0,1,0
spa_df45296c7ed10d14aa1f8e8a3d5e35e3,"por la liberacion de las mujeres esclavizadas por el islam, aqui y en todo el mundo. no mireis para otro lado!",0,0,0,0,0
spa_a7182be505ba43cc838611e6a84758f5,por lo que sea. no seras tu una de esas feminazis que adoctrinan en fascismo a los ninos?,1,0,0,1,0
spa_a004e6761b2f2c94f621c1ee9a6d2647,por manlet y por judio?,0,0,0,0,0
spa_e97eb1770d86ae4f3c1809da3f082aa2,por que no puedes profesar otra religion en publico que no sea el islam alla,0,0,0,0,0
spa_c5169dc870b8fd9422013681a0a9917e,por suerte tenemos a los entes encargados de proteger a la comunidad judia con las manos a la obra,0,0,0,0,0
spa_70e393ae298b9295f5aad62865a46500,por supuesto. puedo usar mi superpoderes bilingues para confundir la migra. aunque lo hablo como una gringa,0,0,0,0,0
spa_486069a44ce84765061ca2b95cbb3001,"porque en el islam los humanos solamente tienen alma desde los 3 meses en adelante, es por motivos religiosos justamente",1,1,1,0,0
spa_d54f0a701bd95251311e9ef996d9df65,porque estan en el reino judia y las monedas del reino champinon no tienen mucho valor alli,0,0,0,0,0
spa_55ceb3250bcf9a4c2d56a8078d8b2cc6,pq habia un diluvio israel,0,0,0,0,0
spa_4ce145ee225a5da35818ffb491cea8ee,preparadas para el islam. no os quejeis.,0,0,0,0,0
spa_a8c60d7888e6fcd9a0911b9876cbd833,presidenta de la comunidad judia critica regalo de camiseta palestina a bebe de boric y acusa al gobierno de discriminacion,1,0,1,0,0
spa_bd8c8ed31986a7397bcd40ecae55e96e,progre corrupta se te termino la pauta.,1,0,1,1,0
spa_e856f5d06bb54f527559f5c8f1f9e455,"prohibido en suiza a partir del 1 de enero el burka y el tapabocas, asi se combate al islam",0,1,1,0,0
spa_04f74e54427cdda20371cbf1bbac4c52,"pueblo chico, corazon grande: israel.",0,0,0,0,0
spa_ca6abcb3d956e289a5c108e9b2b273df,"puerto rico, israel, mexico, canada",0,0,0,0,0
spa_b4538526b4c0be9e36d3883abc92dab6,pues el nieto le salio fascista. que ironia siendo la familia judia.,1,0,1,0,1
spa_890bbab5aa0ed8f8de23cc4d41400d0f,"pues que quereis que os diga: a mi, que una trans hable mal del islam me parece hasta logico.",0,0,0,0,0
spa_3762b727b6687e953a6322a75e2127e7,"pura cosa gringa en el discover digase opinion, noticia u pito",0,0,0,0,0
spa_43fafa37fce90b5ca44046f3fff3c78f,putin es judio de padre y madre,0,0,0,0,0
spa_61ed16939519790475d901584fcc41e4,"putos tarados, primitivos, salvajes, machistas, me cago en la mierda del islam y en el ceporro de mahoma.",0,1,1,0,0
spa_7f2c4b9b2527eb12e529b01794729eea,"que asco me da ese maricon, por dios",0,0,0,1,0
spa_c3568e657d3cea6aa8c615a5193a74d7,"que bombardeen israel hasta que no quede nada
maldito sea israel",1,1,1,0,0
spa_a025037e3f84de7897052f3052444e23,que buena es la libero del equipo femenino de voleibol de lousville. esa morra ya deberia de estar en la seleccion gringa,0,0,0,0,0
spa_286d0f4777c8749aa1b5acd3283cab84,"que corrupcion, so lerdos!!!!",1,0,0,0,0
spa_cf7634375c39c5d91ae282e49e1b40c6,que cosa tan graciosa es el islam!!! me da risa!,0,0,0,0,0
spa_cc577f5f66f0cc85f0a6c21953fa4a6b,que generico casi prefiero que me digas perro judio,0,1,1,0,0
spa_773854543ee203989a15dd033b3a3570,"que huevo el de esta judia de mierda. todos tenemos el derecho de ""enquistarnos"" en el poder si votan por uno.",1,1,1,0,0
spa_b536b7a3b973e64838387e1a6ae87d35,que me adopte una gringa,0,0,0,0,0
spa_268360a12127d326e79f1b3afc6f93da,que me costaba ser gringa,0,0,0,0,0
spa_7d9b012c5687a4e7fb9921a67db6bced,"que me decis judio ruchi mentirosa
me rompiste mis esperanzas y me decis judio, todo mal con vos",0,1,0,0,0
spa_62f09692bd3e67482a990df0708af56f,que ningun maricon pokemon se haya puesto una foto de slurpuff de perfil y de nombre slutpuff me parece horrible,0,0,0,0,0
spa_8ed8341e5e7d62dc60633bcbbdc2a474,que odio el de las feminazis.,1,0,0,1,0
spa_2ef7d15c2489d777896b7232211862d3,que pais de mierda. el marroqui promedio es como un zombi con movilidad. el islam es cancer,1,1,1,0,0
spa_8372e0fe8cb0ac6fb0bdb35ee12d4f53,que puto asco dais hipocritas,1,0,0,0,1
spa_775f51a5d9737aa07652e2b34e485356,"que raro, el alcohol esta prohibido en el islam.",0,0,0,0,0
spa_f53da2821a487bb2590d9321464671af,que sabes del islam? leer sobre el islam. encontraras algo extrano que no puedo decirte.,0,0,0,0,0
spa_29e184dc64cfa8a03c4eca4d3e197882,que se vayan a israel.,0,0,0,0,0
spa_2e67b03f9c214daf9cfeab277902b531,que seria de los chiringuitos de feminazis sin las paguitas?,1,1,0,1,0
spa_ccde719354c7fd21abb522b43d6c37d5,que tanto inventa esta puta gringa,1,0,0,0,1
spa_5eb432e36c454d18b0658f7e517f5172,que te pasa judio de mierda???,0,1,1,0,0
spa_e50a5e2d092db0beed06b6fa68b44bd0,que tendra ver oponerse al islam con ser racista?,0,0,0,0,0
spa_2f6b1190a2d98f6670b1f5c6c4fbfd80,que un homosexual o trans critique el islam es sentido comun. son nuestros depredadores naturales.,0,1,1,1,0
spa_08d8a8925fc8af80b3351cf08bc1e248,"que viva la corrupcion, carajo!",1,0,0,0,0
spa_7a3769a43e7f5d7abcbb95ad88fc0f09,que zelenski es judio comemierdaaaaaa,0,1,1,0,1
spa_b72c487e21dfd7ba78e9c196834e3009,quiero pasar de israel a wasrael,0,0,0,0,0
spa_a816b7da205c70edcb3ffc0d47434725,quiza la salida de tiktok de eeuu es positiva para llenar el espacio mediatico con contenidos no filtrados a traves de la cultura hegemonica gringa.,0,0,0,0,0
spa_30c6804e0ecb875e6bdc5e220e71aa8a,"quizas el judaismo es minoritaria en comparacion al taoismo, pero no el islam o el cristianismo.",0,0,0,0,0
spa_bd57d89b6d5954e080432f15c07ac048,"radicales islamicos en siria visitan a las minorias cristianas para ""invitarlos"" a convertirse al islam",0,0,0,0,0
spa_a1f3ccc3679eb1a7e518e2419b4b00e7,recordad que en la tradicion judia es uno.,0,0,0,0,0
spa_4b1aa1d4b741641d897f207d46208f5d,"redflags en un maricon:
que diga bro
que tenga como pokemon favorito algo de la linea evolutiva de charmander",0,0,0,1,0
spa_5c5ed0ed5371c0cfc1317b2379ed5af9,"revista semana haciendo la judia a favor de petro
se demoraron pero era lo que esperaba desde que la compraron los gillinsky.",1,0,1,0,0
spa_46d8fe1f8918f5053aeee5f88d9dfdf3,sabes que eres un maricon y un degenerado asqueroso y para que sepas la agenda 2030 nunca se llevara a cabo,0,0,0,1,1
spa_34a44b95ae699dbd0def530397a67c7e,"sabes que no es la primera vez que te toco los huevos
al final los resultados han salido positivos, david es bien maricon",0,0,0,1,0
spa_ec4928103b5613fc5f7ba71b06d84ac2,sach e ty kha .. jo islam mein choro ki saza hai .. wo tu choro lo mily ge ..,0,0,0,0,0
spa_5b875ff3783c27692d641253bfbf896b,"sailor moon digimon
nuestros doblajes latinos se basaron de la version japonesa, pero usaron los nombres de la version gringa",0,0,0,0,0
spa_cb6a651e5ee2dd7969514d488bd756c1,"satanico y judio, un mal ser",1,1,1,0,0
spa_62e8a6a331a236ecc23e1175bf327c0c,se acuerdan cuando nos decian feminazis,0,0,0,0,0
spa_4b9f155b3732e8eb440037a928df97b6,se ha convertido al islam.,0,0,0,0,0
spa_130649b74a90c6e4d4b852392f84302a,"se imaginar uma pessoa gringa ouvindo outra pessoa gringa tentando pronunciar fernando eu acho que a transcricao seria bem por ai mesmo, adorei",0,0,0,0,0
spa_b2d11fda268fab742bfd4aace974ceed,se me metio lo gringa,0,0,0,0,0
spa_c886d68c73e7ba45bd26f71e2946b041,se nos adelanto como 20 anos la distopia gringa de hollywood,0,0,0,0,0
spa_0f91c23ab8afba3baaf0fe1ca100c55c,se parece a cierto presidente gringo.,0,0,0,0,0
spa_e12b0b704a1ca16ad5106ce1380b72ce,se puede ser judio y nazi.,0,0,0,0,0
spa_12454769cfa88db39caf76500e0a9d48,"se robaron la historia de mitra ,jesus nacio judio y murio judio.",0,0,0,0,0
spa_4b5f104e7583de522b970b22089e6f89,selpide cambiando marica por llorica en su cover de devuelveme a mi chica,0,0,0,0,0
spa_62234fbdad9e99f9d538ac5e33767875,ser zurda. y ser judia,0,0,0,0,0
spa_cb73f02cf0df3ae7e9c73b4894eae76f,sera que el modelo chino si senala la responsabilidad gringa en el genocidio palestino? yo no me registre a tiempo xd,0,0,0,0,0
spa_b5517c1f058b477c72b68aa6691cfbff,sera que veamos mas banda gringa en estos lares durante los siguientes dias?,0,0,0,0,0
spa_ac8fbdabf25273e7d191db6ecfbaaab0,serian yo dando uf y mute a la cuenta de un oso por subir nalgafoto con chones de la bandera gringa?,0,0,0,0,0
spa_c3d828738a39f95f7fe20ab34820f64f,seth rollings es la definicion de maricon (no derogativo),0,0,0,1,0
spa_c9748b17c5a38af7376cff4be41aa2dd,"shabat shalom, feliz ano nuevo!",0,0,0,0,0
spa_c0f32851d9f8b6d4de53604f67d87b21,si al final habra que abrazar el islam para que se bajen a la tierra,0,0,0,0,0
spa_56fa083162bf490fc666fa3ea6fb821e,"si anda con mujeres, mero bolsillo judio",0,1,1,0,0
spa_20837c34a2b38a1fd11b467f88a3552b,"si claro, un gobierno judio pronazi",1,0,1,0,0
spa_95d665faedf0f9d290c32dc6011565bf,si el mundo conociese nuestra definicion de religion (islam) todos se interesarian en la religion,0,0,0,0,0
spa_3717018b147e1a52e0a05fde6c1201cb,si el presidente ucraniano es judio. no entiendo,0,0,0,0,0
spa_fbfa85518e70fec3bf2b2b295b5dc647,"si en los tweets cambias la palabra ""islam"" por ""catolicismo"" todo cuadra igualmente.
vaya un nordo de persona.",0,0,1,0,1
spa_f50c11afe9e5750cd925aef371e74e44,si en vez de cristianismo hablase de islam no dirias ni mu.,0,0,1,0,0
