id,text,stereotype,vilification,dehumanization,extreme_language,lack_of_empathy,invalidation
amh_3e1be22b6aea0d38ca0cd300ef64cdc5,ኢየሱስ ክርስቶስ በገሊላ ውኃን ወደ ወይን የቀየረበት የቃና ዘገሊላ በዓል በዳግማዊት ኢየሩሳሌም ላሊበላ በፎቶ ፎቶ፡ - ላሊበላ ኮሙኒኬሽን,0,0,0,0,0,0
amh_1dba3f5f49c52922b489bdc215609e87,ፋኖ ዛሬም ማርሽ ቀያሪ በመሆን በሐይቅ እና ቢስቲማ ጀብዱ ሰርቷል እስኪ ሁላችንም ለጀግኖቹ ኮሜንት ላይ #ፋኖ ብለን በመፃፍ እናጥለቅልቀዉ,0,0,0,1,0,0
amh_e6ed71743b9a201f1ff4ef93d60c3904,3.2 ከመቶ ተማሪዎች ብቻ ወደ ዩንቨርሲቲ የሚያስገባቸውን ነጥብ አገኙ የአማራ ፅንፈኛ ሃይል ፋኖ በሽብርተኝነት መፈረጅ እንዳለበት ተገለፀ,1,1,0,0,0,1
amh_9627e029b3fcd3904fb37528509c56b4,የ #TDF ሀይሎች የሀገር መከላከያ ሰራዊትን በዚ መልኩ ማርከው አስፋልት ለአስፋልት እየነዱት ነው። መንጋው ና ይህንንም ሀሰት ነው በለና,0,1,1,0,0,0
amh_1767d2ff552e632a9344ea0c7bc803c9,አየር መንገድ ውስጥ የሚፈፀመው ጉድ | አየር መንገድ ውስጥ ሸኔ እና ወያኔ የተጋጩበት ሚስጥር እና በአባ ዱላ አደራዳሪነት የተከፈለው ጉቦ,1,1,0,0,1,0
amh_1f0e6f3967a82d647b2bed442e530206,ኡነቱ መስማት ሚፈልግ ካለ ያዳምጥ! ውሸታም መንግስትና ሆድ አደርና ተላላኪ የሆነ የአማራ ክልል መንግስት ስለ ወሎ ምንም ደንታ የለውም!!,1,1,0,0,1,0
amh_4f6eae2671db6c37fc0842a36c21fba7,ለዕለታዊ ዜና: ያፈገፈገው ፋኖ ወደ ከተማ ተጠጋ_ _ ፋኖ አዲስ ውጊያ ከፈተ _ ስለ ግድቡ ድርድር ከካይሮ የተሰማው ጉድ _ Ethiopia,1,1,0,0,0,0
amh_f550974fa01f4c87b309255bdb76ed96,#ሻለቃ_ምሬ_ወዳጆ በብቃት እና በንቃት ሲሰለጥኑ የቆዩ #ፋኖዎችን አስመርቋል #ፋኖ የአማራ ህልዉና አስጠባቂ ህዝባዊ ሠራዊት ነዉ!! #ሼር,1,0,0,1,0,0
amh_18c4cdf707418fda717f328a9e865f80,ደነዝ መጀመሪያ ቃሉን አንብብ እስራኤልን ከግብጽ ምድር ነፃ ያወጣ አምላክ መቼም ቢሆን አይተኛም አያንቀላፋም ጂሀድ አራጅ ከምድረ ገፅ ይጥፋ,0,1,0,1,0,1
amh_ece96dedf798ade328456c219e17fa81,የሸዋ ፋኖ አበበ ሙላቱ በአርቴፊሻል ኢንተለጀን ቢሮ የተሰራበትን የውሸት ቅንብር አጋለጠ ለመላው የአማራ ህዝብ ጥሪ አቀረበ! #ተጨማሪ መረጃ,0,0,0,0,0,0
amh_e7ad952e69cb7a7648d2157c029549e0,ጋዜጠኛ መሳይ መኮንን በ ፌስ ቡክ ገጹ ባጋራው መረጃ መንግሰት ዛሬ አርብ ጎንደር ከተማ ላይ ያሴረውን ሴራ አጋልጧል ሙሉ መረጃውን ይዘነዋል,0,1,0,1,0,0
amh_e14d63dea252891a7e337ca13d0bdf60,ሰበር መረጃ በአስቸኳይ ሼር ይደረግ አማራ የሆንክ ሁሉ በአስቸኳይ ተነስ ልዩ ሀይሉ ይፍረስ ተብሏል ሲሉ ጀነራል ተፈራ ማሞ ሚስጥሩን አወጡት,1,0,0,1,0,0
amh_0a04a8b9c11f94f484ef9adab99f0288,ፋኖ የስጋት ምንጭ ሊሆን የሚችለው አማራን የመግደልና የማፈናቀል እቅድ ላለው አካል ብቻ ነው፡፡ የሸዋ ታይምስ ቤተሰብ ይሁኑ! ቴሌግራም: -,1,1,0,1,0,0
amh_45be6dc20fa5453e7e6e9f0b3574acc8,#Etv ለኦሮሞ ህዝብ እታገላለሁ የሚለው የኦነግ ሸኔ የሽብር ቡድን ይበልጡን የሚታወቀው ከኦሮሞ ህዝብ ባህልና እሴት ባፈነገጡ ድርጊቶቹ ነው,1,1,0,0,1,0
amh_014f7f5862c4262d6ba31ca627eacd21,"ሰበር ""በአፋጣኝ ለቀህ ውጣ"" አቶ ደመቀ በህወሃት ዛቱ | ሳውዲ በአባይ አርሳ በላች ሴራ ጀመረች | ሸኔ ሰዎችን ገደለ | ጀነራሎች ተሸለሙ",1,1,0,1,1,0
amh_0586417ba08fd6f5f53bf31642baf08b,#ጀግኒት አስቴር ቀየዋን ሊወር የመጣዉን ጠላት በድንጋይ መትታ ዲሽቃ መሣሪያ በመማረክ ሙሉ ትጥቅ ሽልማት ያገኘችው ልክ የዛሬ አመት ነበር።,0,0,0,0,0,0
amh_8d90d120ba066755fd22b0db79a8cdfe,ምስራቅ አማራ ፋኖ! የሸዋ ታይምስ ቤተሰብ ይሁኑ! የቴሌግራም ቻናላችንን በመቀላቀል በፌስቡክ የማይለቀቁ አዳዲስና ወቅታዊ መረጃዎችን ያገኙን,0,0,0,0,0,0
amh_de6cc358ef6522105eb7061e2d2ac544,#አማራነት_ሃጢያት ሆኖባቸዋል አማራ ሆነህ ታገኙህ/ሽ #ሙስሊም_ወይም_ክርስቲያን መሆናችሁ ሳይገዳቸው #ያርዷችኃል ይገሏችኃል ይደፍሯችኃል::,1,1,0,1,0,1
amh_ee38388b1cf0ed88e12d855c28479c20,#etv በህወሓት ጁንታው መሪ ዶ/ር ደብረፅዮን ገብረሚካኤል ቢሮ ውስጥ ለውስጥ ለማምለጫ የተገነባ ከ300 ሜትር በላይ የኮንክሪት ዋሻ ተገኘ,0,1,0,1,1,0
amh_7631fc1870c8ab03a90ee269fe2cc6bc,ፋኖ ተሰማራ ፣ ፋኖ ተሰማራ እንደ አባ ኮስትር ፣ እንደ ቼኩቬራ ግፍ ከኮሶ በላይ ፣ ነውና መራራ ግፍ መስራትን እንጂ ፣ ግፈኛን አትፍራ!!,0,0,0,1,0,0
amh_23e0541dcac5abc6fc7b0f5200bf5cfe,#Etv የምዕራባውያን ሚዲያዎች በማይካድራ የተፈፀመውን የዘር ጭፍጨፋ አስመልክቶ እውነቱን መዘገብ እንደሚገባቸው ጋዜጠኛ ጄፍ ፒርሰን ተናገረ,0,0,0,0,0,0
amh_6f04626a42fa0b2307d89d37849d311c,በቅድስት ሥላሴ እንዘ አአምን ወእትመኀፀን እክሕደከ ሰይጣን በቅድመ ዛቲ እምየ ቅድስት ቤተክርስቲያን አቤኔዘር ዘተዋሕዶ ገፅ ከነ ክራንቹ,0,0,0,0,0,0
amh_3dda72532b8943a2750eff3dcd6ecc58,የአማራ ፋኖ የምርቃ ስነ-ስርዓት በመንዝ መሃል ሜዳ . በዩቲዩብ ተጨማሪ ምስሎችን ለማየት ሊንኩን በመጫን Subscribe አድርገው ይጠብቁ።,0,0,0,0,0,0
amh_5008360726c0beb4d6dea67e119deb90,ከትግራይ ሰበር ብራቮ 8ቱ ተያዙ ከሸፈ ከጊዜያዊ አስተዳደሩ የተሠማው ኤርትራ ነጩን የቴድሮስ ተላላኪ ልኩን ነገረችውኢትዮጵያ አይሆንም አለች,1,1,0,0,1,0
amh_4fdc1d2b686fdd059f65e9e8918097fd,ኢትዮጵያ ያለው በብሄር ለመግዛት የተደራጁ ሃይሎች የበላይነት ፉክክር መሆኑን ያልተረዳው አማራ ብቻ ነው የውጭ ሚዲያዎች ግን እየተናገሩ ነው,1,0,0,1,0,0
amh_3a8bc5ce5d77f260cd1e7c3768218b7a,"#ጻፍበት ቀብሩ ላይ በቃ አከተመ ። #ደምስሰህ ቅበረው ያ ባንዳ ወያኔ"" #ያጨካኝ አያቱ ያደማትን አንሶት እሄው ደግሞ መጣ"" የልጅልጁን ይዞ",0,1,0,1,0,1
amh_ac9cf870fcbd76f55b369b697c11eb42,ራስህ የት ነበርክ!? ግልገል ጁንታው የት ነበራችሁ ለማለት ሞራል አለው? ጀማሪ ተቃዋሚዎች አረፍ እያላችሁ! የትግራይ ህዝብ የሳተው ነገር!,0,1,1,1,1,1
amh_3178da98af3db1fc69dd0d0ddf6146fe,ሰበር የድል ዜና ቆቦ ሮቢት የገባው የጁንታው ሃይል በአከባቢው ገበሬዎችና በአማራ ልዩሃይል ሙሉ ለሙሉ ለወሬ ነጋሪ ሳይተርፍ እዛው ተደመሰሰ,1,0,0,0,0,1
amh_558245ebf44cb566e28cf29b5c0a48dc,ዘመን ቢያስከፋውም ቢወርድም ቢወጣ፣ ፋኖ አይደነግጥም እንኳንስ የውኃ የእሳት ጎርፍ ቢመጣ፣ ይሻገራል እንጅ በጥበብ በብረት በክንዱ እየቀጣ።,1,0,0,1,1,0
amh_3eba920b44781c16b0a3615795b3cb87,የጋሸና ነገር እንቆቅልሽ የሆነባችሁ ጋሸና በማን እጅ እንዳለ በቦታው ከሚገኝ ፋኖ አንደበት ስሙት። ጠላት በውሸት ፕሮፓጋንዳ እንዳያሸብረን!,1,0,0,0,1,0
amh_ac5490fcc4cca9d4055b203b43522bee,ሰበር ብአዴን የፋኖ አጋዬ አድማሱን ቤት በቦንብ ደበደበ !የሸዋ አማራ ፈጣን እርምጃ ወሰደ! ለተጨማሪ መረጃዎች ቴሌግራም ቻናላችንን ይጎብኙ,0,1,0,1,0,0
amh_c2cbf5741965fd3088aedab8cad058a8,ዛሬ ኢትዮጵያን በዘርና በጎሳ ተለያይተህ ለመቀራመት ያሰፈሰፍክ ሁሉ ጣሊያንን በባዶ እግሩ ለተዋጋ ትውልድ ውለታው ዘረኛ መሆን አልነበረም ።,0,0,0,0,0,0
amh_6bb9fa603fbc704cbfe4450e5a3b6244,የፋኖዎች ድምቀት ሚሊዮኑ ተጋይ ፋኖ አርቲስት አበበ ካሴ እንደዋዛ እንደ አንድ ሰው ተለዬን ወንዱ አበበ ካሴ የእነ አጋየ ወንድም አንርሳህም,0,0,0,0,0,0
amh_eaf995e06bc5cd0614862a223ed97129,እንኳን ህዝቡን እንስሳውንም አስገድደው tplf ሲያረጉና ሲያዘምቱ ነው የከረሙት ። ተገዶ ዘማች ለግዜው ስሙ እንዳይጠቀስ የፈለገው #ቡቺ,1,1,0,0,1,0
amh_e53d234198940ae000909cb54f45ca16,አንተን ሰው ብለው አያስቡህም.አቤት አገላላፅ ሚንስተር ፣ባንዳ፣ላኪ፣ተላላኪ፣ዋው . አብርሃም ብላይ ይርድኦ ዶ ይኸውን? እንድሉ ዋ.! ቻዕ.,0,1,0,1,0,0
amh_1af8919ff150597d3e913d1f6ccaaa71,ጎበዝ ካፈርኩ አይመልሰኝ አትበሉ።ጎንደር ጎጃም ሸዋና ወሎ በፍጥነት ምክሩ።ከባዱ ጊዜ መጥቷል።ፋኖ ትጥቅ እንዲፈታ ተወስኖ ወደ ስራ ተገብቷል,1,0,0,0,1,0
amh_133106e6dcae77ec32140c4a89c859ef,ለ42 ዓመት ከቤት ያልወጣው አጭሩ ሰውእናቴ የተወለድከው ዘመዴን አግብቼ ነው ትለኛለች እኩዬቼ አግብተው ወልደዋል እኔን እግዚአብሔር በደለኝ,0,0,0,0,0,0
amh_aef7118e8c1f7dbacc4c6eda13be4867,ለእኒህ አዛውንት ሾፌር ያልራራ አንጀት ላንተ እንደማይመለስ አውቀህ ፍትህን ጠይቅ ለመብትህ ተነስ ቁም :: ፍትህ ለአባታችን ፍትህ ለሾፌሮች,0,1,0,1,0,0
amh_d1595536af61e3360a6153582eee38e1,ህውሃት እሩጨ አመልጣለሁ ስትል ሰምቶ ሃይሌ ገ/ስላሴ አሁን መዝመት የእኔ ተራነው አይልም መሰላችሁ። አይ ወያኔ በሩጫም አልሆነም ማለት ነው,1,0,0,1,1,0
amh_2611e6c3b531b32b219add0b07e8999e,"የጠ/ሚንስትሩ ትዕዛዝ በትግራይና መዘዙ : መከላከያ ሠራዊቱ ጫካ ያስገባው ህዝብ : "" አማራ ትግል ላይ ነው "" ፕ/መራራ : የውጊያ ውሎዎች",1,0,0,1,1,0
amh_4784343068e6e1d4aa3d0fccc20037bd,የምስራቅ አማራ ፋኖ እና የወሎ አማራ ፋኖ አባላት እንኳን ደስ አላችሁ! በደማችሁ ሙሉ ራያን ቀስ እያላችሁ ነፃ እያወጧችኋት ነው! #ፋኖነት,1,0,0,0,1,0
amh_e6dc2dd26db30fd3ef3d7b3b825979a9,የኣብሮ መኖር እሴቶች ምንምን ናቸው የዓድዋ በዓል ለምን ይከበራል ? የዓድዋ በዓል ትርጉሙ ምንድነው? Digital Weyane ዲጂታል ወያነ,0,0,0,0,0,0
amh_eb7e9d203a77057d5f38b2280930a462,ሰበር - አብይ በል ቻለው የፉገራ ድል አንድም ሳይነኩ ጨፍሩ - #share ፋኖ የአማራ ህዝብን ያኮራ ሆነ ቀጥሏል ባህርዳር ላሊበላ ጎንደር,1,0,0,0,0,0
amh_14cd039f5a19fece98a4b9ed5b1117b5,ቤተ ክርስቲያን ጥልቅ ኃዘን ላይ ነች። የቅዱስነታቸው አስከሬን መስቀል አደባባይ ደርሷል የቅድስ አባታችን በረከታቸው በሁላችን ላይ ይደርብን,0,0,0,0,0,0
amh_bfeb4f69b4b1663f601ebd09a1cf4866,ይህ ሁሉ ለኔ ነው!!! አምልኮ ውዳሴ ክብር ምስጋና ስለ በደላችን በመስቀል ተሰቅሎ ላዳነን ለጌታችን ለመድሃኒታችን ለኢየሱስ ክርስቶስ ይሁን,0,0,0,0,0,0
amh_ca6f91de53904c1414b9c19e74aee7dc,ሚኒሊክ 7 ሆነው ለ70 ጠላት በ30 ደቂቃ አሸነፉ በ24 ሰዓት የሚኒሊክ ቤተመንግስት እንረከባለን በአማራ ክልል ያለው ፕሮፖጋንዳ #amora,1,0,0,0,0,0
amh_4e62adfbd4dc3fd19183225ce89a6896,ሰበር ዜና ታሪካዊቷ የደሴ ከተማና የንግድና የኢንዱስትሪ ኮሪደር የሆነችው ኮምቦልቻ ከተማ፣ በጀግኖቹ የጸጥታ ኃይሎች ጥምረት ነጻ ወጥተዋል።,0,0,0,0,0,0
amh_1c4b2931bffcccfbff24d98c046928c0,ሰበር ዜና! በአዲስ አበባ ዩንቨርስቲ የወለጋውን ብሔር ተኮር ጭፍጨፋ ተቃውመው ሰልፍ የወጡ ተማሪዎች በጸጥታ ሃይሎች ድብደባ ተፈጸመባቸው::,1,1,0,0,1,0
amh_957dbe5a3e22169eae37edf186d1f9f1,ኮማንዶ ኤፍሬም በትግራይ ሰራዊት ተገደለ|| ጣና ብርጌድ ሙሉ ተደመሰሰ|| ፍንጨፍቱ ጊንባ ለጋምቦ አቀስታ ቀርሶሌ ምዕራብ ወረዳ ቱሊ አዉሊያ,0,0,0,1,1,1
amh_39eba748958433fbdddbfe041a3ffc82,Tplf የመከላከያን ዩኒፎርም አመሳስሎ እያመረተ ለድራማ የሚጠቀምበት የነበረው ፋብሪካ በአየር ሃይል እርምጃ በዚህ መልኩ ከጥቅም ውጭ ሆኗል።,1,0,0,1,0,1
amh_54093ba5c8e8e423fcedbc63f9bc4b55,"#INBOX ""አልቃይዳ እና አል ሸባብ እንኳ እንዲህ አይነት ቅድመ ሁኔታ አቅርበው አያውቁም። የባሰው አሸባሪ መጣ"" አቶ አበጀ በለው የላኩልን",1,1,0,0,1,1
amh_7eae6a781dbb0a95e769041a5f3b2840,# የአማራ ፋኖ አንድነት በጎንደር የስራ አመራር ኮሚቴ በጎንደር ከታማ የሚገኘውን ታሪካዊ ቅርስ የአጤ ፋሲል ግንብ ሲጎበኙ የሚያሳይ ቪዲዮ ።,0,0,0,0,0,0
amh_5addfb682b331fb21c1c814f56eca2e6,ገዳዮቻችን እነዚህ ናቸው የጨፈጨፉን የስጨፈጨፉን የሚሊሊክ የተግባርም የሰጋም ልጆች እነዚህ ናቸው ለነዚህ . ''ሞትና ሞት ነፃነት ግበርዎ'',1,1,0,1,0,0
amh_f41b6852dd9ace727c3fd480aad38188,ኬኒያ ኢትዮጵያን እያመሳት ያለው ዘረኛ ፖለቲካ ነው - ይህንን የፈጠረው ህወሀት ነው።ለፀጥታው ምክር ቤተ ከተናገረችው የተወሰደ ብራቮ ጎረቤቴ,1,1,0,0,0,0
amh_e050b0646018b0491628633fb3224b4f,ሰበር ያልተጠበቀው የህወሃት የውጊያ አቅጣጫ | ኦነግ ከንቲባ አዳነችን ተቃወመ | ዘመነን የሚፈልጉት የአማራ አመራሮች ኢትዮጵያ ላይ የዘመቱት,1,1,0,0,0,0
amh_f6c780b9daa1d7fd55f4bbb67ef79b87,ከሩቅ ሆነህ የጫት ገራባህን እያኘክህ ፋኖን መሳደብ ትችል ይሆናል። መሳሪያ ታጥቀህ መጥተህ ግን ፋኖን መንካት አትችልም ሽንታም ሁላ Zemen,1,1,0,1,0,0
amh_410aa5f65c9fc81caf2c0a0939d6b99b,አስደንጋጭ መረጃ አቡነ ማትያስ ቦምብና ስናይፐር | ጌቾ አዲስ አበባ በቀላሉ ለማጥቃት | ብሊንከን ኢትዮጵያ ትበተናለች | TDF ተመሰከረለት,1,1,0,1,1,0
amh_5ceec29f7c69432912bfb5a777cc3311,ሸጉጥ አልተኮሰች ቦምብ አልወረወረች መሆኒ ማሪያም ሆና ቆቦ ላይ ሰው ጣለች ''እድሜ ለፈገግታሽ'' የጓደኛየ እህት ናት ራያ ራዩማ #ብሄረሰብ,0,0,0,0,0,0
amh_5a278f25223313e1f7f0bd28499d5fee,"ድሮ ሳይገባህ ሳትረዳኝ ንቃ ስላልኩህ ""ጁንታ"" ያልከኝ ወዳጄ ሆይ ዛሬ ""ጃውሳ"" እያልኩኝ አልሰድብህም! ይልቅ አሁንም ንቃ! በከንቱ አትሙት!",1,1,0,0,0,0
amh_0b8e9a26692c72a12432ae72c54004c9,የቤት ሰራተኛዋ አሰቃቂ ወንጀል!! ሃገር ጉድ ያስባለው የህፃናቱ ግድያ!! ''ገዳይ እራሷ ነች ለአባትየው ደውላ ያረዳችው'' ወላድ ይፍረድ>>,0,1,0,0,0,0
amh_f6015391383f09ba4302ba3b0ca0c7c3,"ቅዱስነትዎ በፊትዎ ስላለው ደስታ እያሰቡ ሐሴት ያድርጉ ሊጥልዎት "" ከጀርባዎ "" ያደባው ጠላት ከመንፈስ ቅዱስ አይደለምና መቼም አይቋቋመዎትም",0,0,0,0,0,0
amh_e73757b5720264f6d38837d268649846,#ፋኖ ባህርዳርን መክበቡ ተሰማ የክልሉ አድስ አስተዳደር መገቢያ መውጫቸው እስኪጠፍ ደንግጠዋል!! #ድል_ለአማራ #ድል_ለፋኖ #followers,1,0,0,1,1,0
amh_8b5e02e5a4e030a5af3f53f9d9a573ec,#Etv የጀግንነት ታሪክ ሰርተው የተሠውት የእሸቴ ሞገስ እና የልጃቸው የይታገሱ እሸቴ የቀብር ሥነ ሥርዓት በሸዋሮቢት ከተማ እየተካሄደ ነው።,0,0,0,0,0,0
amh_2a3109aa7f6387bc3de412d8fdc0302a,ቀበርሁት እያለ፤ አሸንፍሁ እያለ፤ ተውት ባንዳ ይጩህ ይፎክር ያቅራራ፣ ታሪክ ምስክር ነው ሰባት ጊዜ ወድቆ ስምንቴ ይነሳል ኅያው ሆኖ አማራ!,1,1,0,1,0,0
amh_e7ae912c2f764c3b3f22ea62b362199f,ልደቱ አያሌው ስለ ሰላም የሚሰብከው ትህነግ እንዲህ ለሶስተኛ ጊዜ ሊመጣ ሲዘጋጅ መሆን ነበረበት። እየተቀጠ ቀ ጠ ሠላም ይባልልኛል። አስመሳይ,0,1,0,0,1,0
amh_8f38fcda1b7a2f1673a33ae449557242,የአማራን ክልል ለመበተንና ፋኖን ለማፈራረስ የሚሰራ የፓለቲካ ሴራ ፈፅሞ እንደማንታገስ እንገልፃለን፡፡ ከአማራ ፋኖ አንድነት የተሰጠ መግለጫ!,1,0,0,1,0,0
amh_554d479af1286d0c49e29dcb2435a875,እረፍት! ኢትዮጵያ 2-0 ግብፅ የዋልያዎቹ የመጀመሪያው አጋማሽ እንቅስቃሴ በምስል፦ ምስል፦ የኢትዮጵያ እግር ኳስ ፌደሬሽን ድል ለዋልያዎቹ !,0,0,0,0,0,0
amh_7c1aaf6f6498d0f2e797270a9b971b92,አሳዛኝ ዜና በዛሬው ዕለት በቄለም ወለጋ ሃዋ ገላን ወረዳ ለምለም ቀበሌ ወንበዴው ሸኔ በሰነዘረው ጥቃት ከ200 በላይ ወገኖቻችን ተገድለዋል።,1,1,0,0,0,0
amh_fa53dfcd826f1908c1451ea2bd215afe,የታፈነው የአማራ ፋኖ በጎንደር ዙሪያ አመራር የሆነው ፋኖ አደባባይ አበበን የኦህዴድ መከላከያ ሲጨንቀው ለመልቀቅ ተስማምቷል! @USER ሚዲያ,1,0,0,1,1,0
amh_8f562875af3c8192da9c869df34adc35,እንዴት ነሽ ጎንደር እንዴት ነሽ ፎገራ ሽለላው ቀረርተው በቀረብሽ ጉራ TDF የህዝብ ልጅ ግርማው የምፈራ የተበተነው ዱቄት ሆነልሽ እንጀራ!!,1,1,1,0,1,0
amh_e657585abda986ae08ff6ebab8e38067,"ምን ቢዞርብህ ነው ለአማራው አብን ጠላት ወያኔ ደግሞ ወዳጅ እንደሆነ ያሰብከው? አይ ህብለ ሰረሰር?!"" ጪንቂላቴ ተቀማጨለብኝ!"" አለ ዶክሌ።",0,0,0,1,1,0
amh_ea15511b2f6e966c49f9ac68dee591e6,ገና ለገና አክራሪ የኦሮሞ ብሔርተኞች ወሎን ሰሜን ኦሮሚያ በለዋል ተብሎ የወሎን ኦሮሞ መካድ አይቻልም። @USER . Sisay Mengiste,0,0,0,1,0,1
amh_39af8ba14e39d8768e92019669a72763,ጠፍቶ የነበርው ጁንታ ከ ጉድጓድ፡ ከዋሻ፡ ወጣ ያላሉ፤ ከሪዞርትማ ልንወጣ አንችልም ትግል ላይ ነው የነበረው። ዶ/ር ደብረፅዮን ገ/ሚካኤል,1,0,0,0,1,0
amh_9816d813e8b3f448d2fd6cc313fec6b7,አሁን ላይ የኢትዮጵያ ህዝብ ብቸኛ ዋስትናዉ አንድነቱ ነዉ! በብሔር ወይም በሀይማኖት ካርድ መጫወት ራስን በራስ ማጥፋት መሆኑን ሁሉም ይወቅ!,0,0,0,0,0,0
amh_1257c91c4b238f5db1fe5d55ae37d1f1,#etv የህወሓት ጁንታ በሰሜን ዕዝ የመከላከያ ሠራዊት ላይ የፈፀመው ጥቃት በታሪክ የሚታወስ የሀገር ክህደት ወንጀል ሆኖ መመዝገቡ ተገለጸ፡፡,1,1,0,0,0,0
amh_b5e0a3ab5f9427b145696d2a48e6b229,በሳቅ እንዳትሞቱ - የምንጊዜም አስቂኝ ዜናዎች - ያፈቀርኳት ልጅ እሺ እስክትለኝ ከዛፍ ላይ አልወርድም ያለው እና ማር ሲልስ የተያዘው ሌባ!,0,0,0,0,0,0
amh_964fae328262766c5cfa2c61c1efffe6,#etv የመከላከያ ሰራዊት ጁንታው ላይ የማያድግም እርምጃ ለመውሰድ በበቂ ዝግጅት የመንግስትን ትእዛዝ ብቻ በመጠባበቅ ላይ እንደሚገኝ ተገለፀ,1,1,0,0,1,0
amh_1fb540cd4b96f9871ae0ef021aad214c,#የሞጣና አካባቢው የአማራ ህዝባዊ ኃይል ( ፋኖ) አስተባባሪ የነበረው ፋኖ መዝገቡ ሆስፒታል ህክምና ላይ እያለ ህይወቱ አልፏል #ነፍስ ይማር,0,0,0,0,0,0
amh_c4bc1e246041e26acd8c7fde2af9c611,ዕለታዊ መረጃ : ከቁጥጥራችን ውጭ ሆኗል በቃን_ _ ፋኖ ጎንደርን ጨበጠ_ ልዩ አፕሬሽን_ _ ፊልድ ማርሻሉ ምን እያሉ ነው_ _ Ethiopia,1,0,0,0,1,0
amh_7692c6389d960564e08d3310c184b046,አማራ ሀይሉን ያድሳል። በኦሮሞ መስፋፋት የተያዙበትን የቀድሞ ግዛቶቹን እነ ወለጋን ጨምሮ ሌሎቹንም ያስመልሳል - ሻለቃ ዳዊት ወ/ጊዮርጊስ,0,0,0,0,1,1
amh_39d936a5dd634ba999c145a971078b74,ወልቃይት ጠገዴ አያሰማኝ ክፉ እንኳንስ ሰዎቹ አይሰበር ዛፉ ድንቅ የወልቃይት አዝማሪዎች ባሕላዊ ጨዋታ በጎንደር አጼ ቴዎድሮስ ሐውልት ስር,0,0,0,0,0,0
amh_6a094019e512839de08bb71d1b1ed900,አጉል እልህ፣ ክፉ ጭብጨባ መንገድን ያስታል! አሁን ይሄ ከጳጳስ ይጠበቃል? በቅድስት ቤተ ክርስቲያን ስርዐት ይፈቀዳል? በታቦት ፊት ይቻላል?,1,1,0,0,1,0
amh_b81a35bf9074663e4f532a042ecab828,"ሰበር ዜና||""ከኢሳያስ አፈወርቂ ለኢትዮጲያ ህዝብ የተሰጠ መግለጫ"" 3 ደብዳቤዎች በትግራይ ሰማይ ላይ"" ""አማራ መልካም ጅማሮ በፋኖዎች ላይ""",0,0,0,0,0,0
amh_d726f0a22f0f10e3bb3ec6582b40b18a,የሀገሬ ልጅ ወራሪ ጠላትን እንድናሸንፍ ተነስ ብሎ ሁሉን ያሰባሰበው ንጉሥ ምንይልክ ታቦተ ጊዮርጊስን ይዞ ጣልያንን አሸንፏል ይህም ይዘከራል።,0,1,0,0,1,0
amh_294ba36a7e68aee5585c74de561ea566,የኦርቶዶክስ መምህር ነኝ ባዩ አቶ ዘመድኩን አንድ ጥያቄ አለኝ አንተ የአማራ ብሄርተኛ ተከራካሬ ወይስ እንደተባለው የኦርቶዶክስ መምህር????,0,1,0,0,1,0
amh_e7bd7a7f57ab6317fe6611704b63db79,#የዘንድሮው ጥምቀት ሌላ ጉድ ይዞ መጣ ዘቀዘቁት ዮናታንን የመስቀሉ ጠላት ያስባለው ክስተት ቴዲ ላይ ምን ይባል ይሁን ኮሜንት እየጠበቅን ነው,0,1,0,0,1,0
amh_3995f2f5a09959aae197fadd9916ddb0,የአማራ ክልል የሰላምና የሕዝብ ደኅንነት ጉዳዮች ቢሮ ኀላፊ ሰማ ጥሩነህ (ዶክተር) ከነገ ጀምሮ የሚካሄደውን ዘመቻ አስመልክቶ የሰጡት መግለጫ,0,0,0,0,0,0
amh_f818398024424e84e18e611d813c5006,መላው አማራ በአብይ አገዛዝ መኖር አትችልም ተብሎ ሞት ታውጆበታል ስለዚህ በህይወት የመኖር መብቱን ተደራጅቶ ማስጠበቅ አለበት - ገለታው ዘለቀ,1,1,0,1,0,0
amh_e0a87897929e1d5dd6f6e5349cae6bf5,እንደ ሸኔ እና ወያኔ የግብጽን ተልዕኮ ለማስፈጸም የገዛ ወገኑን የሚሰዋ ጥቅመኛ፣ ፈሪ፣ ከሃዲ እና ለሆዱ አዳሪ መጨረሻው ተዋርዶ መጥፋት ነው።,1,1,0,1,0,0
amh_0ea031eafd4bc96f5de7a977041ba39c,ፈጣሪ እንደ አማራ ልዕቃን መርህ የለሽ አያደርግህ። መሪ ሆነ መርህ የሌለው ማህብረሰብ ከመሆን ይሰውርህ ,1,0,0,0,1,0
amh_7bb8219269545106c2d0faced4c45f87,@USER @USER እኔ ይህን መለው ገዳዪቼ ፊት በሀገሬ ቆሜ ድርቆሽ እየበላሁ ነው አንተ ግን በርገር ላይ ሆነህ ዛሬም ትወላውላለህ። አብይ የአማራ አራጅ ነው ገዳይ,0,1,0,1,0,0
amh_62bc53f9977d10f0619ac65bbb98d2fc,@USER @USER የኛ ሰው ጦርነት ልክ ስልክ ላይ ተቀምጦ ታይፕ እንደማድረግ መስሎታል:: ሄዶ ተዋጋ ቢባል የሚደበቅ ሁሉ የጦርነት ቅስቀሳ ከስክሪን ጀርባ ቁጭ ብሎ ይሰብካል:: ብቻ ኑሮአችን ያሳዝናል::,0,0,0,0,0,0
amh_4a86a201969a00d160e4fb2db31f2af7,@USER አስመሳይ ሁላ መንግስታዊ አሸባሪዎች ።,1,1,0,1,0,0
amh_06fff97a2ca938fcb58c6a0a62b741a4,@USER @USER ትግራይ ያለው የወልቃይት ጠገዴ ጠለምት የራያ ህዝብም አማራ ነው በህውሃት 40 አመት የተጨፈጨፈው የትግራይ ተወካይ የትህነግ ደጋፋው,1,1,0,0,0,1
amh_b96ee9c69b254c952b5cd48bb9d434d7,@USER ሆዳሞች አገሩን በከርሳችሁ የቀየራችሁ ባንዳዎች ዝም ብትሉ::,1,1,0,1,0,0
amh_2a0542f61e9476ea6fe7b6a5977ff732,@USER @USER በዝሁ ቀጥል ከወትሮው ብዙ ላይክ አግኝተሃል ለዓማራው ብቻ ለይተህ ስለተቆረቆርክ ።,1,0,0,0,0,0
