id,text,stereotype,vilification,dehumanization,extreme_language,lack_of_empathy,invalidation
deu_0f4de9faf2d7f84918c1ce771dbdcda6,Berichtete die jüdische allgemeine Zeitung doch auch bereits vor kurzem. Waren glaube ich rund 14% in der Gesamtbevölkerung (alle Kulturekreise) und 46% unter Muslimen.,0,0,0,0,0,0
deu_8a4ef32a7cdd712324af0b2d56f39e71,Türken sind nicht willkommen aber Döner ist immer 😅😅,1,1,1,0,1,0
deu_e56094b55995289e306efe8f984301a6,"Du kannst auch einmal googeln was queer bedeutet. 

Ich bin nicht @USER ich hab nur sehr sehr dunkle Haut und identifiziert mich als ""Farbige"" Person. Klingt das für dich vernünftig?",0,0,0,0,0,0
deu_f027bb0026b05be5f1c1262bd1c44160,"Tja, mein Queer-Feministisches-Glaubensbekenntnis esse ich nicht, ich esse mein Queer-Feministisches-Glaubensbekenntnis nicht. Das ist jetzt die drölf dreißigste Meinungsumfrage zu diesem Thema, es wird niemals ein anderes Ergebnis geben als: Nein Danke, das kann weg. Wie wäre es damit den ""woken"" Manipulationsversuch zu beenden und in die lila Blase zurückzukehren?",0,1,0,0,1,1
deu_b758990dac526d30fc215920f2f3e045,Verkauft die Hütte an eine ukrainische/ rumänische / serbische Großfamilie mit vielen Kusengs. Dann werden die Nachbarn euch zurückwünschen.,1,1,0,0,0,0
deu_48c1049033a1ae2540cf9235f3871a93,Willst du einen Krieg gegen Russland kämpfen? Ich nicht! Zu sagen wir sind im Krieg mit Russland ist hochgradig gefährlich.,0,0,0,0,0,0
deu_93f88064cf66af253793d6479f121a2d,"Wenn es dir egal ist, ob die letzte Generation akzeptiert wird oder nicht, hast du das Prinzip einer Demokratie nicht verstanden.",0,0,0,0,0,0
deu_97e0aeacb16a7266e065dbea0e626573,sind das querdenker?,1,0,1,0,0,0
deu_7e447905c2a01c4e2c86047e8626ab65,#NUKLEARER WINTER GEGEN GLOBALE ERWÄRMUNG!,0,0,0,1,1,0
deu_9a61d3a4357b3b7acf455077a869bc03,"Normalerweise muss ich diese Apps mit Face ID öffnen, kann ein Virus das umgehen?",0,0,0,0,0,0
deu_fb41bb61d1c2d70e45876db5cdf84130,"Und da es ja keinen Unterschied macht woher ein Flüchtling kommt, können die anderen Städte ja ohne Probleme die nicht-ukrainischen Flüchtlinge aufnehmen.",1,0,1,0,0,0
deu_6bf4eb26afca06bc55c909739c44de76,Ja dann beantrag doch asyl in deutschland…,1,0,1,1,1,0
deu_73173ba4042cd2b408238de8c2d06679,welche antirussische Terrorismusförderung geht denn von der Ukraine aus und gegen welche UN-Sicherheitsrats-Resolutionen hat denn die Ukraine verstoßen?,0,0,0,0,0,0
deu_b909ec2a377954f7dea77e53ead8e0c3,"Alter Schwede, es geht hier in dem Beitrag um die Pandemie-auslösenden Viren. Die die eben seit 2020 unser Leben stark beeinträchtigt haben. Diese eine Pandemie da, du erinnerst dich sicherlich.
Darauf bezog sich mein kommentar",0,0,0,0,0,0
deu_4652c49b3413d8bee788f2c56a89aca6,"Es ist Blödsinn, da in solchen Fällen zu urteilen, ob eine der beiden Seiten irgendwas darf. Der Unterschied zwischen Hamas und Israel ist, dass Hamas kein Problem damit hat.",1,1,0,1,1,1
deu_ed279fdb9eee02dfb08fffeec189083c,Was redest du hier wenn du nicht mal weißt was ein Wirtschafts Flüchtling ist,1,1,0,1,1,1
deu_8a2473a2fb4ad66ccffb2dbd32c5fd40,"Exakt.
Fahrlässig ist es, sonst nichts.

Long COVID wird als Lüge genutzt um die Nebenwirkungen der Impfung zu verschleiern. Hier nochmal eine Impfung drücken zu wollen ist fahrlässig.",1,1,0,1,1,1
deu_f6f21fccc1762df705aab99bc6794f8e,Wir hatten in Israel,0,0,0,0,0,0
deu_84d7ce9e1e1c130bae9ea36b7f92e753,Putin sexiest man alive!,0,0,0,0,0,0
deu_4210c7ad8f06f3078475cece9b3acf39,"Aber nicht die coole Variante wo man gegen Muslime hetzen kann

(/s)",0,1,0,1,0,0
deu_66bb5d163919c7a1ab340fe09fd250f3,"Es geht nicht um berechtigte oder sachliche Kritik an den Maßnahmen, sondern um jüdische Weltverschwörung, Bill Gates, 5G, usw. Das ist schon ein deutlicher Unterschied",0,0,0,0,0,0
deu_dd5d338591a2646c317ba5e4283ab437,Klar. Querdenker tragen so zuverlässig Masken wie die Polizei. Waren immer alle vermummt.,1,0,0,0,0,1
deu_dc62d895b29007b2e3cbd27dd3a2f8ff,Ja das ist stimmt. Das jetzige Russland immer konsequent Putin-Russland zu nennnen wäre optimal,0,1,0,0,1,0
deu_a7a5d109667e22c3fb2eca3651e11520,"Was hat denn die LG gemacht um zu informieren und aufzuklären? Die können doch nichts anderes als die hässliche Schwester von FFF zu sein.

Mein Respekt haben sie jedenfalls nicht. FFF schon.",1,1,0,1,1,1
deu_e132631dd84ed67236993bdfd879bc97,"Wie wäre es, wenn Russland sich aus der Ukraine verpisst und die nächsten Jahrzehnte Reparaturzahlungen an die Ukraine abdrückt?",0,0,0,0,0,0
deu_4b36012124459ad8dc79b72e65ff687a,@USER Kommt auch drauf an ob du überhaupt Geld zum verleihen hast. Und jetzt?,0,0,0,0,0,0
deu_ddd30f74b6c68a0a3174ae1bc1b86cbc,Oder halt Corona Impfung,0,0,0,0,0,0
deu_62fac4d268c32f51c169d9d8c2719ab5,"Quatsch, bis Weihnachten sind wir in Moskau!",0,1,0,1,1,0
deu_03c9f484924fadc4d101e555423600ef,"Nein, in ihre muslimische Brüderstaaten, da der Islam bekanntlich was Tolles ist",1,1,0,1,1,0
deu_ce780563ff13715b86761f3dc0dbaf41,Will der Islam zu Deutschland gehören? Immerhin hat den Islam niemand gefragt.,1,0,0,0,0,1
deu_b8ea72ffebc40aa6d7d93e16e6534edd,"Wurde in der Vergangenheit jemals auf junge Menschen gehört?
Werden junge Menschen jemals in deutscher Politik miteinbezogen oder bekommen gewissen Begünstigung oder Boni @USER
Wurden jemals Demonstrationen von jungen Menschen rrnst genommen? (Bestes Beispiel Fridays For Future)

Ich denke du kannst dir all diese Fragen beantworten und dann wirst du evtl. auch wissen, warum niemand demonstriert bzw. warum sich sowieso nichts ändern würde.

Der Politik und generell denen da oben sind junge Menschen egal.
Das hat man bei FridaysForFuture gesehen, das hat man während Corona gesehen, dass sieht man auch jetzt.",1,1,0,0,1,1
deu_f2358ecc68a5dd64d5ef1113273bbfed,"""The more you fuck around, the more you find out""

Heute hat die ""Letzte Generation"" viel herausgefunden.",0,1,1,1,0,0
deu_b1a350ba9ac433bbaa52db974d47e2f5,Immer das gleiche russische Schema. Es ist unerträglich!,1,0,0,0,1,0
deu_2149b442bd642f97da96e9d33eb32c10,"HPV Impfung machen, ja, auch Kerle!",0,0,0,0,0,0
deu_56609b14327f661387e9f9b080cb16c2,">mit einer bestimmten Ideologie zu impfen

Ach Gottchen, da ist sie wieder, diese Ideologie.

Konservative und Opferrolle, nenne ein ikonischeres Duo.",1,1,0,1,1,0
deu_ac64fbd020f890969e0174767351ee54,"Würde mir keine Hoffnungen machen. Es gab Videoaufnahmen, wie die das (& noch mehr) bei Kindern von FFF gemacht haben. Da passiert gar nichts.",0,0,0,0,0,0
deu_f07ce81db59a0c991b713ad4b640ed6b,Wäre schön wenn er es in Gaza erneut machen würde,0,0,0,0,0,0
deu_21060fa3cf2f0f283d3d7616ab01aafe,"Die Letzte Generation ist eine Gruppe, welche Andersdenkende mit passiver Gewalt in ihrer Bewegungsfreiheit einschränkt. Das sind keine Opfer, sondern Täter.",1,1,0,0,1,0
deu_98ada051aa80f19bfbb890ef986c0fde,So ein Quatsch. Den kilometerlangen Stau von gepanzerten Fahrzeugen auf der Straße nach Kiew oder die abgeschossenen Fallschirmjäger blendest du wohl aus. Der initiale Angriff war innerhalb von einigen Wochen gestoppt.,0,0,0,0,1,1
deu_e8cf533f8ce073526aaa7ab56ed833fa,In den USA ist alles links von Trump woke.,1,0,0,0,0,1
deu_84b2d73bb802134c5eb064693f1a5102,Und der Rest von Putin.,0,0,0,0,0,0
deu_f7a5c0734ce7a807d8170d75200e84d6,Erbärmlich aber zumindest CO2-neutral,0,1,0,1,1,1
deu_8b8e31cd4869b8d0bf23498173d03e78,HOfFreItER DIesER aS…DeR gRößtE KRiEgstreiBER bEi DeN gRüNEn REDEt Was vON vOlKsvERÄtEr deR soll dIe scHnAUze haLTeN,0,1,1,1,1,1
deu_f6f343f8fa168067500b6c1d75071fea,"Danke für die Demonstration der grenzenlosen arroganz und hirnloser Überheblichkeit von reddit antitheisten. Genau deswegen mag euch niemand, nicht mal normale Atheisten.",1,1,1,1,0,0
deu_0addeca1c62824f72265a86a3964c5fc,"Kinder können da auch angezogen spielen, duh. Wenn es so wäre wie du sagst, hätte das Schild sicherlich anders ausgesehen.",0,0,0,0,0,0
deu_1852b8fc72a498166ea9e3820edffe2a,In manchen Ecken DEs können sich Jüdische Mitbürger nicht mehr sicher fühlen und dieser Mensch redet von Rammstein…,0,0,0,0,0,0
deu_e16df9beac5ce8087840caf2c24c2707,Russland ist zusammengebrochen,0,0,0,0,0,0
deu_c3ca4a9dea1266a3473dced59e8ab25e,Wenn ich schon wieder dieses Woke lese. Der AfD ist sogar unser Grundgesetz zu Woke. Hört auf das Wort so inflationär zu gebrauchen.,0,0,0,0,0,0
deu_956430b2be9c80dc7c7ab8e9cbd2757e,Die Letzte Generation hat sich aus dem Kampf auch verabschiedet. Konstruktives kommt da schon ne weile nicht mehr.,0,0,0,0,0,0
deu_086a53d3abd5bd4013331be5fdf5dea3,"Sind sie das wirklich? Ich hatte das gefühl, der hauptgrund warum man so gegen die Grünen Wahlkampf gemacht hat, war damit man aktiv gegen die Bundesregierung Wahlkampf machen kann, und damit von eigenen Problemen Ablenken kann.",0,0,0,0,0,0
deu_6a852fea035d4f12364862dccefece00,"Auch da dann die Frage: was soll die Antwort auf diese pauschale Verurteilung des Islam sein? Islam-Check durchführen und alle die positiv getestet werden, müssen raus?",1,0,1,0,1,0
deu_1e6cf862abf5ba252367eb86a6f1e63f,Eins seiner Kinder musste mal ins Krankenhaus weil eine Kollege irgend ein Virus hatte (Ich weiß jetzt nicht welchen).,0,0,0,0,0,0
deu_5d287685c1b2546fb5535a2960ea98b9,"Oh schaut, russische Propaganda, mit Quelle von RT.",0,1,0,0,1,0
deu_9bde779546cb9ebe91a6ed845eb54d50,"Dir ist schon klar, dass fast jeder Feuerwehrmann das ganze Ehrenamtlich macht und das somit nicht deren Hauptaufgabe ist? Wie wird denn irgendjemand geholfen wenn wir sie nicht reinlassen? Da können wir wenigstens so ehrlich sein und direkt sagen ""jeder ertrunkene Flüchtling ist ein guter Flüchtling""",0,0,1,0,0,1
deu_5b903bd659fe86b17c7896a079550d58,"Ist doch nett, wenn die Regierung Wahlkampf für die Opposition macht.",0,0,0,0,0,0
deu_10381372880d98292fc42c519ac81d67,AHA UND DIE KLIMAKLEBER MAL WIEDER NICHT - TYPISCH WOKE REGIERUNG,1,1,0,1,1,0
deu_90431f06d62661b96a58ff5d90abf9fe,"gab da mehr als eine schöne Doku drüber, aber ich find grad nur diese

>Plötzlich Stille - Wildtiere in der Pandemie",0,0,0,0,0,0
deu_0754cf9adb3e99161ffc544c48f3a96c,"Äh, das ist aber in jeder Talkshow genauso. Und der AfD-Typ war ja nicht alleine da. Ich habe nur duchgeskimmt, kann  mich also irren, aber die eigeladene Transfrau scheint ihn ganz ordentlich auseinander genommen zu haben.",0,0,0,0,0,0
deu_c1e815cf6ece1b0ea5453f4be2641db6,"Nein, es gab eine ausführliche Rechtfertigung der Thailandreise durch die ""Letzte Generation"".",0,0,0,0,0,0
deu_1aff6934c55d2aa46b31bca48195b335,Ja die woke Blase hat Angst vor der Trump Rethorik. 😎,1,1,0,1,0,1
deu_7e53c1a911cfd777003b0ac752181eb7,"Tbh. gibt es keinerlei Pläne ""jeden einzelnen Ukrainer auszurotten"". Allerdings durchaus Pläne, die ukrainische Identität zu vernichten.",1,1,1,1,1,1
deu_5e03defc7c40b5fa74b68a0cff5d5202,Ideologie getriebene Politik,0,0,0,0,0,0
deu_17a09086b8cf3b979c767228660904da,"Juristisch klar, sehe ich genauso. Ich find halt nur Flüchtling nicht so toll. Hab da jetzt auch keine Lösung.",0,0,0,0,0,0
deu_18a9a490aa80c7f7187e827a36093521,"Ah ja weil Krieg und Töten gleich Umweltschutz. Mensch, du reihst dich ja richtig gut hinter Strasser ein.",0,1,0,1,0,0
deu_643c400b47136dde5872f2dac8e71696,Dicke dürfen nicht in den Winter,1,1,1,0,0,0
deu_edbc271f1d0fbbabd04fe71e000fe85b,"Naja, würdest du nen Neonazi, der „Die Unterdrückung durch die jüdische Finanzelite“ als ein realistisches Szenario ansieht, und deswegen im NS-Stil Juden umbringt, dann im gleichen Verhältnis beurteilen? Bzw. die Leute, die sich aus dieser Überzeugung mit ihm solidarisieren?",0,0,0,0,0,0
deu_14a97d6c0c1d528af297ffef6d4f0657,"Ist aus Sicht des gemeinen AfDlers nicht alles links der AfD irgendwie ""linksgrün""?",1,1,0,1,0,0
deu_7aee55dcfff71f53fa0fdbb02df52c7e,"Wie gesagt, Pandemie und nichts draus gelernt. Meine Fresse.",0,0,0,0,0,0
deu_05c663f3d91cfb583d77d0074a0e860e,Nur zur Einordnung. Laut Wissenschaftlern wäre ein fairer CO2 Preis bei etwa 280€. Also so viel Schaden richtet eine tonne CO2 an.,0,0,0,0,0,0
deu_3aaae62687bb71cb34f19089c4597216,"Hat er jetzt auch lange genug drauf gewartet, endlich wieder Stimmung gegen die ukrainische Naziregierung machen zu können. Endlich wieder Futter.",0,1,0,1,1,0
deu_a336fb95e682de60e025b143a90363d1,"Russland hat schon 2014 einen Teil der Ukraine besetzt.


Und überhaupt, was juckt mich die Ukraine eigentlich?",0,0,0,0,1,0
deu_05b26ae691b19b0d59383883a09b4f20," NDA. 

Als hättest du ihn vergiftet. Dein Kumpel soll mal klar kommen. Klingt als wäre das jemand der denkt, mit veganen Lebensmitteln würde man eine ""linksgrün-versiffte"" Ideologie fördern.

Du solltest dir überlegen, ob du mit jemandem, der so abdreht wegen eines veganen Burgers, noch weiter abhängen solltest. Könnte sonst irgendwann anstrengend werden.",0,0,0,1,0,1
deu_e829b9f214b3cb58c536ce3d4f21d1af,"In NRW funktioniert schwarz-grün unter Wüst sehr gut und völlig geräuschlos. Mit ihm wäre es eine Option im Bund. Mit Merz und Migration,Migration, Migration-Linnemann wird es schwarz-braun geben.",1,1,0,1,1,0
deu_25eb96973a404f44c2cde6a8dbab18e2,"Wagner hat vermeintlich bereits Oblast Moskau erreicht. 2h bis Moskau 

@USER",1,1,0,0,0,1
deu_4bb8c9a911deee600842fda5ab22c9c9,linksgrün. Du hast linksgrün vergessen.,0,0,0,0,0,0
deu_5be378f8ef05e70ce84135e33086e10f,Jetzt kann der Knecht woanders Pro Russische Scheisse Labern,0,1,0,1,0,0
deu_e4cb3a62c6246ed602d3b84f963ee2e4,BDA für euren Rassismus und den abwertenden Ton von Arabern und Türken,1,1,0,1,0,0
deu_338e39ab26c6cce96f5307a6187aaa58,"Das können auch Begriffe sein, die über jüdische Einwanderer weitertransportiert werden. Besonders in New York sind mir da in Gesprächen oft solche Worte aufgefallen.

Könnte das ominöse Wort to 'schlepp' gewesen sein?",0,0,0,0,0,0
deu_98792a831df522f33fc82492d2e7cb92,Das F am G3 steht für Frieden.,0,0,0,0,0,0
deu_d9f5f1a9f7ea056091fa623eaf0ea0ad,"Alles was Spaß macht ist verboten, wie bei Linksgrün.",1,0,0,1,1,0
deu_4d33b4fffa8b98044dc0b79c6cd3a5e4,Corona hatte es versucht /s,0,0,0,0,0,0
deu_99adef527bc056ee99363f27439686b2,"Ich denke du traust Russland da zuviel zu. Nur weil die AfD gerne sehen würde, dass Deutschland wie Russland wird, heißt das noch lange nicht, dass Russland die AfD steuert. Das ist eher eine gemeinsame Affinität. Die AfD sagt ""Du bist mein Vorbild"" und Russland sagt ""Du bist nützlich"".",0,0,0,0,0,0
deu_63bd72989c1bb6969de015765de1edb1,Im Artikel spricht selbst die DUH nur von einem Drittel.,0,0,0,0,0,0
deu_0df1e8fd6f5946c2d431aeabaddc5180,"Ich wurde für so eine Aussage schon als ""Faschist"" tituliert. LoL.",1,0,0,0,1,1
deu_6c3946a7d4306db9e48088433f4dad2d,"Extremismus, Radikal 

Nein Peter, an einer angemeldeten FFF x @USER Demo teilzunehmen macht einen nicht zum Ökofaschisten noch ruft man dabei zum Bolschewismus auf.",0,0,0,0,0,0
deu_eed66a8446833fb3b1e934db8d58ffc6,Stichwort Umweltauflagen in Kombination mit grüner Regierung + DUH = es gibt eher die Kernfusion als dass wir da @USER,0,0,0,0,0,0
deu_1d539254c3c5a59f0f80c1af844dcb05,"Haha, ein Faschist, der statt in den braunen in den roten Farbeimer gefallen ist",1,1,0,1,0,0
deu_d6bfbd829ba9757236c5435213384dfe,"Gesund ist: Ausgewogene Ernährung. Punkt.

Mediterrane Ernährung ist eine der gesündesten ""Diäten"", sorgt aber in der Regel für einen zu hohen Fisch- und Ölkonsum im Plan. Fisch wird zudem per sé nicht unbedingt für eine ausgewogene Ernährung benötigt. Siehe auch hier: @USER

Das Essens-Intervall ist stark abhängig vom eigenen Verbrauch.

""Viel Wasser"" ist wissenschaftlich nicht ausreichend belegt, siehe hier auch: @USER \- Auch der Wasserbedarf hängt vom eigenen Verbrauch ab.

""Kein Alkohol"" - duh. Gilt genauso für andere organbeeinflussenden Drogen, Zucker, Koffein, usw. - Gesund ist das alles in Mengen nicht. Relevant ist immer das Maß. Alkohol ist logischerweise ein besonders klarer Verbrecher.",0,0,0,0,0,1
deu_dd87494c811be332b57af7065dc65ad0,Vielleicht COVID bzw Long COVID?,0,0,0,0,0,0
deu_074873542ba5e59619b636382fb906b3,"Hätte, hätte, Infektionskette.
Sag' mal, hast Du Covid verpasst? 😀",0,0,0,0,1,1
deu_01752dba518bde451229303c9ef83cf3,"Kiew ist der traditionelle Name, Kyiv ist die englische Transkription aus dem Ukrainischen und Kyjiw die deutsche Transkription aus dem Ukrainischen:

@USER",0,0,0,0,0,0
deu_aa83a60f09ff5aad945a9a3955fe8c0a,"Diese Statistik ist jetzt nicht so geil wie du vielleicht denkst; da sie genau zeigt dass Linksgrün heutzutage absolut gar nichts mehr mit dem normalen Arbeiter mehr am Hut hat. Nur noch Besserverdiener die sich selbst geißeln wollen und die die Auswirkungen linksgrüner Politik nicht wirklich berührt.

Ihr seid schon so weit weg dass ihr gar nicht mehr einseht dass die ""ungebildeten Arbeiter"" eigentlich einmal die Kerngruppe von Links war.

Jetzt halt nur noch upper middle class Apparatschiks",1,1,0,1,1,0
deu_a8b52e151ab02c53f2a127548f3d1244,"Also doch die Möglichkeit, unbegrenzt bleiben zu dürfen wenn der Flüchtling arbeitet? Irgendwie widersprüchlich.",0,0,0,0,0,0
deu_279cefa3c3825c9c70c6d2eda06b6e25,Ich hoffe die nächste Pandemie hat dieses mal mit Pandas zutun,0,0,0,0,0,0
deu_4e57a543a17857e674bc68e5c085ad9d,"Körnerbrötchen, Fahrradweg, Windrad und kein Islam Appeasement, es könnte so schön sein.",0,0,0,0,0,0
deu_ddc84654fae14749ff11cdfcd6578849,Stell dir vor es ist Demo gegen Rechts und jeder geht hin.,0,0,0,0,0,0
deu_5c70a1eb215dd799e9c07b08da92d927,">Frieden 

\*Profit, Frieden gabs ja schließlich sowieso (dachten sie zumindest)",0,0,0,0,0,0
deu_d94de5c01af15f8cf9e414d300fe16e1,"Corona, Politik und Arbeit. Manche Leute bauen ihre komplette Persönlichkeit auf diesen Themen auf.  Corona darf ruhig durch andere heikle Themen ersetzt werden.",0,0,0,0,0,0
deu_2e749db3bc322ae0762ef7ea3df31225,"Ja? Söder ist allgemein ein Arsch, aber in diesem einen Fall nicht.",0,0,0,0,0,0
deu_733195b7f39e1e59a2d082ed2b5d59bf,"Stimmt, was wars nochmals, 53 / 57% Zustimmung in Gaza nach dem 7okt.",0,0,0,0,0,0
deu_da63b7bfdc7102fe4cab86a663c34788,Wie wäre es damit: Für jeden militärisch unnötigen Angriff auf ukrainische zivile Einrichtungen gibt es eine Taurus mit programmierten Zielkoordinaten.,0,0,0,0,0,0
deu_c2f6b39e728794104e9835bfae5adfe0,"&gt;Oder hast du dich vor Corona jemals darüber beschwert, dass keine Maskenpflicht herrscht?

Vor Corona gab es ja auch noch kein @USER

Die Logik mancher Nutzer hier ist so für die Tonne, @USER",0,0,0,0,0,0
deu_21816bf69253d5dee3f049b47eee3cf3,"Fragte mich grade, was die Letzte Generation mit der Bielefeldverschwörung zu tun @USER",0,0,0,0,0,0
deu_687c12a81e924d8b43913d998fb3d0a1,"Wir befinden uns nicht im Krieg, allerdings ist ein Krieg in Zukunft zumindest ein realistisches Szenario.",0,0,0,0,0,0
deu_3870a75b33bdd6ccf30dff3fff1df396,Krieg macht mich richtig geil.,0,0,0,0,0,0
deu_039a7448ba6e055dbe64fbb942b06425,nach israel vermutlich.,0,0,0,0,0,0
deu_302aa8da44e5f0193985d235c4007c94,"&gt;""Die Situation ist inakzeptabel"", sagte der Liberale Pascal Canfin über Deutschlands Blockade der EU-Entscheidung. Der Franzose betonte, er könne nicht akzeptieren, dass die FDP den bereits ausgehandelten Text als Geisel nehme.

Ist ja so ziemlich Modus Operandi der FDP, siehe Selbstbestimmungsgesetz, das eigentlich Ende letzten Jahres in die Abstimmung sollte und nun seit Monaten beim Buschmann herumliegt und darauf wartet dass er es freigibt.",0,0,0,0,0,0
deu_f34bf9268d5d8cd38c024c4611e4dab3,"Dem Immunsystem gutes tun, sieh es nicht als Feind, sondern achte auf deine Ernährung und befasse dich mit dem Mikrobiom im Darm.  Das ist bei Allergikern oft aus dem Gleichgewicht und kann daher das Immunsystem nicht regulieren",0,0,0,0,0,0
deu_95ff619e919004334dee20e6a19b7c37,"Für die lokale Querdenker Demo braucht es ein großes Auto, an dem man viele Plakate mit fragwürdigen Inhalten anbringen kann.

Quelle: Thüringen",0,1,0,0,1,1
deu_6524081bf4bd7acd0d022867264d80fe,"> und andere Nachbarstaaten von Russland 

NATO/Russland Akte lesen",0,0,0,0,0,0
deu_0cdd3964cb59a47ad8d7b51edbf5742b,"Die Auslandsbesuche von Selensky waren aus Sicherheitsgründen bislang immer Überraschungsbesuche.   
Hat jemand eine Idee, warum es diesmal vorab angekündet wird, sogar mit den Aufenthaltsorten?   
Das ist doch ein sicherheitstechnischer Albtraum.    
.    
.    
.     
Edit paar Stunden später: Das wird wohl in der Ukraine ähnlich gesehen:    
@USER   
Veröffentlicht zuerst von der BZ (wirveröffentlichenkeinWhizzleblowerzeuchsaberveratentrotzdem),     Frage nun, wer hat es an die durchgestochen?",0,0,0,0,0,0
deu_aa49271659312016b86ea73f62d75594,Auch alle Landwirte waren auf der Demo und geschlossen alle einer Meinung.,0,0,0,0,0,0
deu_bac9382bf1ecfb191e9c0b8c17ca2574,">	die vielen gescheiterten Versuche einer Digitalisierung durch den Bund

Bei der Digitalisierung auf den Bund warten. Finde den Fehler.",0,0,0,0,0,0
deu_89113f20c7bf74d5ebbbb56b3f74d792,Als Tipp für alle: Die Techniker bezahlt auch Männern unter 28 Jahren die HPV-Impfung. Ob man schon Sex hatte oder nicht ist dafür irrelevant. Die Impfung ist trotzdem wichtig!,0,0,0,0,0,0
deu_bafe28b89db58080550ceb2fdd0cb057,Alternativer Titel: Ukrainische Behörden verhängen Einnahmezustand im Gebiet Kursk,0,0,1,0,1,1
deu_a9920c2f4017cd65bc867b6557e6ba3d,Putzen? Dafür hab ich doch nicht meinen Master in Gender studies gemacht. /s,1,0,0,0,0,0
deu_17a516c599cebad2ed2e93d15c6d1ce3,"Vermutlich die Kritik am planlosen Bombardieren von allem, was sich in Gaza bewegt.",0,1,0,1,1,0
deu_9b47eaccd3b977597c46708314dd6029,"Irgendwo hab ich Mal sowas gelesen wie ""Heimatschutz = Umweltschutz"". War glaub ich auf nem NPD wahlplakat",0,0,0,0,0,0
deu_7f83d0f04a88bb93772cb6021f99fdc0,"Lungenfunktionstest, also Asthma ausgeschlossen ? Post Covid ? ME/CFS ?",0,0,0,0,0,0
deu_402031b36960a79a62e1bfc2df517801,"„Das angeborene Immunsystem agiert unspezifisch, dafür reagiert es aber sehr schnell. Dadurch kann es manch eine Erkrankung schon im Keim @USER  
Mein Immunsystem ist ein Relaxo. Danke für die Gene, Mama und Papa.",0,0,0,0,0,0
deu_6f0af1f4e76770ff90daa7b5263914ce,">Es gibt auch wenig zum reden bei einen Genozid.

Es gibt keinen Genozid, außer den den die Araber an den Juden verüben würden wenn sie es könnten.",1,1,1,1,1,1
deu_38b7d00c509616707b264da2896f1086,"So funktioniert das Immunsystem nicht. Das muss man nicht ""trainieren"". Man kann eher von einem Erreger ausgehen, der dem Körper neu ist.",0,0,0,0,0,0
deu_291be55f7210f5f5a42acce59acef30c,"und kein wort über die verheerende situation in Gaza, supi danke Hayali und ZDF.",0,0,0,0,0,0
deu_ed13e294fa0b663da84fee2513702fca,"Wir müssen das Klima zerstören, um das Klima beschützen zu können!",1,1,0,0,1,1
deu_29d17cf139682a1b5f8e8d082c284445,"Sei froh, dass die Querdenker die Grundrechte verteidigt haben, auch wenn sie massiv von den Medien und Politik beschimpft wurden.",0,0,0,0,0,0
deu_74cabc2e4ddf0a3d6aa72935d55e9db7,Und dann? Die schreien dich trotzdem Asyl und müssen reingenommen werden.,1,1,0,1,1,1
deu_510de57579e2d7122fddbeab7df82db8,">Ein kompetenter PR-Berater täte der LG durchaus gut.

@USER",0,0,0,0,0,0
deu_9b48cf45c5e660c8dc5fc7fb1f4d0f53,"Ah, wie bei Corona also :)",0,0,0,0,0,0
deu_fc2a811b6855f41d9fc73f563c6f6cf7,es ist eine von türken abgewandelte version eines türkischen Gerichts. geh mal zu nem türken und sag döner ist was deutsches und nichts türkisches und schau wie er reagiert,1,1,0,0,0,0
deu_41a8ee8fa114677df8374e3e4d6f073f,The Walking Dead: Corona Zombies,0,0,0,0,0,0
deu_3587eda975376f58459f997887923cd8,"Das öffentlich zu diskutieren ist doch nur Panikmache der linksgrün versifften

/s",0,0,0,0,0,0
deu_ebd77f4afefb6953cfa9c9ed10724610,jetzt brauchen wir nur noch mehr islam austritte,1,1,1,0,1,0
deu_b61b0a276cca4f84e7a071a88ed4dfb0,">für Leute deren Immunsystem das normalerweise selbst stemmt.

Offensichtlich stemmt mein Immunsystem das ja nicht selbst, da ich ja seit der ersten Infektion neurologische Probleme, Autoimmunprobleme und Herzprobleme habe.

Infektion #2 hatte es verschlechtert und Infektion #3 hat mich fast vollständig bettlägerig gemacht.",0,0,0,0,0,0
deu_77bc51c7663b58b4e1fa932ba551909d,Du bist der wahre Querdenker.,0,0,0,0,0,0
deu_e95edc646d24e4baf92d095972157ad6,Corona war 2020 nicht unbekannt.,0,0,0,0,0,0
deu_5cc8576c551dde46c0ab68819e973b4d,"Jinjer

Jinjer ([ˈdʒɪndʒɚ]) ist eine ukrainische Metal-Band, die 2009 in Donezk gegründet wurde.

Gesang, Gutturaler Gesang: Tatiana Shmailyuk

@USER",0,0,0,0,0,0
deu_9a0e3220d7658660a75a38fd927b6289,Juni ist ein guter Monat zum Einmarschieren in Moskau,1,1,0,1,1,1
deu_ae0e872dc18065ea7cdf16e461207871,"Aber mit dem Auto oder sich fahren zu lassen geht auch beim Hauptbahnhof.

Das ist auch so ein unfairer Vergleich der gerne gezogen wird, zum Bahnhof den ÖPNV rechnen, aber zum Flughafen? Ne, dann dauert das ja ewig. Duh.",0,0,0,0,0,0
deu_90b8292b7552dd66539d0a6d205f2014,Alles eigentlich. Vor allem aber das Gehirn und unser Immunsystem.,0,0,0,0,0,0
deu_05437fdcc9fec0c85daf720a1f7a4865,"Geh zu älteren Frauen, die sind weniger woke und empfänglicher.",1,1,0,0,1,0
deu_20ddedffe9d997f987e79f590e791852,"""Sorgen und Ängste"" bezog sich auf die ""Migranten/Muslime böse"" Thematik.",1,0,0,0,0,0
deu_11a4fe20381bec15fc483cc228a895a4,Russland redemption arc?,0,0,0,1,1,0
deu_1256d74d29beaf577b7ed6073ed6c04b,"Calciumoxalat, kein Virus oder Hexenwerk. Nur ein ""Mineral"".",0,0,0,0,0,0
deu_84bb406b37f11811c7d04c5d863e7581,Fun Fact Thor Steinar wurde von nem Araber gekauft,0,0,0,0,0,0
deu_10f2b481404ed8b471264a9e2b72b851,"Kosten sind doch sowieso ein lächerliches Argument, wenn Linksgrün es vorbringt. In allen anderen Kontexten sind Maßnahmen gegen den Klimawandel nie zu teuer, da die Folgen ja ""in jedem Fall"" schlimmer seien. Nur beim Thema Atom entdecken die ihren inneren BWLer/VWLer.",1,1,0,0,1,0
