id,text,stereotype,vilification,dehumanization,extreme_language,lack_of_empathy,invalidation
deu_fa07b0533db91281c049fb722ca121d7,Natürlich bin ich linksgrün - ich habe Herz u n d ,0,0,0,0,0,0
deu_10e753b5d49374d2de1f68dfc1e2d249,"Schuld sind Habeck,  die grünen und diese linksgrün versifften Wokemenschen.

Die Spahnplatte ist so ein Dünnbrettbohrer.",1,1,1,1,0,0
deu_61be00002367a33400dade564edccc59,"Vielleicht ist da ja tatsächlich was dran. Höchstwahrscheinlich liegt den linksgrün versifften einfach wesentlich mehr an der FDGO, als den Rechten und Faschos.",1,1,1,1,1,1
deu_d28b20af64d590134448fcdbfbb0f7dd,"So. Noch schnell alle linksgrün versifften Demonstranten vom Wochenende fürstlich entlohnen.

Und dann kann ich wieder entspannt und gut angeheitert vom Klavierhocker fallen.",1,1,0,1,0,0
deu_005fc728be211eae1c308a0fc20d73df,"Ich drücke der Störchin die Daumen, Berlin ist voll linksgrün verseucht und hängt am Länderfinanzausgleich. Berlin taugt eigentlich nur zu einem Guantanamo ",1,1,1,1,1,0
deu_5c87c7fc0cd0544d5ff0545079cb59a3,"Während linksgrün noch streitet, ob es „Volksfront von Judäa“ oder „Judäische Volksfront“ heißt, hat schwarzblau schon einen Koalitionsvertrag unterzeichnet.

Geschichtsvergessenheit ist kein rechtes Phänomen.",1,0,0,1,1,0
deu_4ebcad717624b8092960df91b452e0a8,"Vom Tellerwäscher zum Millionär: in ""Amerika""? Nein, sowas ist in Deutschland möglich, genauer gesagt: im ""linksgrün versifften"" Berlin. #Migration #Deutschland",1,1,1,1,1,1
deu_70a7159b70225731c8bdacf4b954ba6b,Ja Weidel. Einige deiner besten Freunde sind Juden. 😏,0,0,0,0,0,0
deu_ab154fcdb52264b45e72e73d03b06285,"Wie war das noch mit den ""Juden"" nach 1933?!",0,0,0,0,0,0
deu_17e692f58c7adfd7fc3607951c123c70,"Bonus, wenn das Ausland (""Brüssel"") oder Juden (""Ostküste"") Kritik üben.",1,1,1,0,0,1
deu_8846fd11c4943153b256f5dbcd78e5f9,"Raten Sie dem Zentralrat der Juden, auf € 22 Mio Staatsknete zu verzichten?",0,0,0,0,0,0
deu_be5d0c58266f060dbc3a4bacd1364792,Du meinst so wie man damals im 2. WK Juden versteckt hat?,0,0,0,0,0,0
deu_00a18a4bc96df86c3ae95eefd1794b68,"Die NSdAP wollte die deutschen Juden zuerst nach Madagaskar deportieren. ""Endlösung"" erst ab 1942.",0,0,0,0,0,0
deu_220cb24e226704eda31c9dc489d0e5dd,"Kanada: Dritter Schusswaffenangriff auf jüdische Schule in Toronto

 Mitten in der Nacht feuerten Unbekannte 
 #Toronto #Antisemitismus #Schusswaffenangriff #jüdischeSchule #Hasskriminalität #Sicherheit #BaisChayaMushka #Kanada
",0,0,0,0,0,0
deu_ba6a847d6ba692ec370a4fdfab483cfe,"Da wir selbst jüdische Familienmitglieder hatten die emigrieren mussten, bin ich natürlich in der Lage zu verstehen; trotzdem halte ich die Position der Union gegenüber für überzogen",0,0,0,0,0,0
deu_6093430c3e851e35be53470e1ff6dbab,"gefährdet, nicht aber durch ein paar Muslime oder (seltene ) Attentate.",1,1,1,1,1,1
deu_b216892540d184c7eaed8fc7b48faa18,"Das ist ja ein bisschen das Problem mit der Wahrnehmung der AfD als ""Anti-Muslime""-Partei",1,1,0,0,1,0
deu_b5132eb46e07d3c0643781e2f1a75404,"Ich verstehe gar nicht, wie man sowas fordern kann.
Diese Muslime versuchen ständig unsere roten Linien austesten.",1,1,0,1,0,0
deu_2960db5d40d28f69ab79e61336913d5c,"Hier eine revolutionäre Idee: Vielleicht weder Juden noch Muslime mit extremem Vorurteil und sinnlosen Rechtfertigungen ermorden? Was für eine unerhörte, radikale Idee!",0,0,0,0,0,0
deu_1afc6167434f42fb9ecb107eec336fc0,"Ich werde diesen Nazi Beitrag melden, jeden klardenkenden Menschen muss klar sein das Muslime immer schon die wahren Opfer waren.",1,0,0,0,1,1
deu_11ee21dc34c82c0df061eee67394200a,"Kannst du eine Aussage eines(r) Antideutschen mit Quellenangabe zitieren, in der er/sie zum Hass auf alle Muslime aufruft?",0,0,0,0,0,0
deu_f73ded4ef9384d0122637c9197056af1,"Vielleicht formulieren Sie das besser nochmal um, denn von der Semantik her, steht da,dass knapp 94% aller Muslime nicht friedlich und verfassungstreu sind.",0,0,0,0,0,0
deu_b4c50cacabb32dbabe80d5b1cc43e1eb,Es gibt auch Juden und Muslime in der AFD 🤷 Menschen sind halt auch nur Menschen. Da gibt's normale und halt eben ,0,0,0,0,0,0
deu_e9a10a271b6a8e91d6c7ac71fd337ed1,"Philipp Amthor zählt auf, wen die AfD so hasst, und lässt einfach mal Muslime aus. Vermutlich, weil das auch in der CDU so ist?",1,1,1,1,1,1
deu_3e4b60a1f4b04c9a1ed33f3c447cd785,"Das Schlimmste daran ist, dass es erneut von Rechts instrumentalisiert wird, um gegen Ausländer und Muslime zu hetzen, obwohl er gar kein Muslim war.",0,0,0,0,0,0
deu_c6e962eb98e96cc30b52caa4d9a49993,"Das scheint der einer der wirklichen Einzelfälle zu sein!
Ein Araber mit Hass auf den Islam - kannst nicht erfinden…",1,1,0,0,1,1
deu_63ccedc1b66f441e979ab7ee3743077f,"Ein Deutscher mindestens. Dazu zwei Schweden, ein Norweger, drei Amerikaner, zwei Nigerianer, ein Finne mit lettischen Wurzeln, ein Kasache, dessen Oma Inuit war und ca. 25 Araber.",0,0,0,0,0,0
deu_7b78afb6c32a1f0bde1f753b6d2c6925,Its simply Islam Like it is.,1,1,0,0,0,0
deu_2bcb69ccbd1f6592fdc053f96f9f7468,Please get informed. It was an Islam critic and afd supporter.,0,0,0,0,0,0
deu_def93df2d1e7d33665f7c985dc5bb8dc,Der Täter von #Magdeburg war Islam-Hasser in all seinen Ausprägungen. #AfD #NoAfD,1,1,0,1,0,1
deu_18594cac2415558cb64d09f1ae71272d,Immer diese kriminellen Ausländer.,1,0,1,0,0,0
deu_620b8c83d6a73d6527f5b5567fbdc9ec,"Komisch nur Ausländer, oder ausländische Herkunft????",0,0,0,0,0,0
deu_6c73f731ebcec515390b52963054bef6,"Das ist denen mittlerweile egal. Da gibt’s noch ein guter-Ausländer-schlechter-Ausländer-Sieb, durch das man die presst.",1,1,1,1,1,0
deu_aac3228e8b247f3faa34030fdccece75,"Solange es dem Arbeitslosen Türken noch ein kleines bisschen schlechter geht, ist für den Arbeitslosen FPÖler die Welt in Ordnung",1,1,1,1,1,1
deu_e8505f5a278e3644a773028cd412eea0,I hope the next virus will take all these dumb people away🙄,1,1,1,1,0,0
deu_d94ab07a8482e1c31382eabafdc071fe,"Alles #Linksradikale?
#Merz #CDU #Wortbruch #Brandmauer #Migration #Asyl 
",0,0,0,0,0,0
deu_2d0e61cf208e9efbef9a5fa39171f27f,"Asyl ist meine Kernkompetenz.

Asyl für die Einzelfälle, die Ewiggestrigen, die Unbelehrbaren, die Neider, die Missgünstigen, die Feindseligen, die Lügner, die Täuscher und Bauernfänger.",1,1,1,0,1,0
deu_e654949a5b4466a106f3177f036cc949,Wegen Asyl-Abstimmung mit AfD: 'Michel Friedman tritt aus der CDU aus',0,0,0,0,0,0
deu_40e199bd57a102c6e8191aed718e0812,"War ja kein Flüchtling, deshalb ist ja alles halb so schlimm.",0,0,0,0,0,0
deu_fc4b59f2c98c013f024adbb95a746f55,"Erst hieß er war Flüchtling und arabischer Arzt, jetzt heißts er war AFD-Anhänger und Verschwörungstheoretiker. Für jede Gruppe an Hatern was dabei.",0,0,0,0,0,0
deu_8bf617f1e512efe656cfdd5cfa202682,"Die Gewchichte ist folgendes:
Wieder ein Flüchtling wieder ein Messer.
Geschichte Ende.
Alles andere wäre nicht nötig wenn diese Schweine nicht hier wären.",1,0,1,1,1,0
deu_b47d3f458ebd6d3b49037c429dfb55ea,"#Magdeburg: Laut meinen Informationen/Quellen ist der mutmaßliche Täter: 

- Aus Saudi-Arabien (gebürtig oder Pass unklar)
- kein Flüchtling

Laut Regierung Sachsen-Anhalt: Arzt, seit 2006 in Deutschland",0,0,0,0,0,0
deu_79ff5b06b29414a6ec9d14d651474f85,In Hamburg hat die Woche ein Dude sich nackt ausgezogen nach einem Autounfall und auf den Unfallgegner eingestochen. Hab ich auch nicht in der Tagesschau gesehen. War wohl kein Flüchtling.,1,1,0,0,1,0
deu_fc0cd7beb2103202b8e681e0ecf3f385,#Corona schädigt das Immunsystem nachhaltig. Kriegt das endlich in eure Köpfe. #covid19,0,1,0,0,1,1
deu_42d8606046dbd9a3cafee0ff58785fa0,"Weil sie es sich nicht eingestehen werden können/wollen, siehe Querdenker und Coronaschwurbler etc.",0,0,0,0,0,0
deu_a3cf4693145d5740e129a78ed738330e,"AfD ist die Partei der Reaktanz und Aggressionsabfuhr - emotionaler und „kognitive“ (Querdenker-)Gewinn heute, der eigene Schaden morgen",1,0,0,0,1,0
deu_c88c0e7280d71f2a2acb0361364b7e86,"Ach von dieser Putin-Querdenker-Postille kommt der Herr, das verwundert nun wiederum gar nicht. Antifaschistische Grüße aus Ostberlin.",0,0,0,0,0,0
deu_fa5da52bf7b1f442fdd8154eae6db7e5,"Du agierst wie ein Querdenker. Kommst du mit dem einen Thema nicht weiter, weil wir haltbare Fakten vorweisen, kommt das nächste Thema. Und tschüss 👋",0,0,0,0,0,0
deu_c39bb5a3fa522f04f66f689f6931e5ce,Russland macht Russland-Dinge. Es wird immer dreister.,0,0,0,0,0,0
deu_dc5d5fbfbd2713c836af65745f4aeed6,"Russland hat die Ukraine aus Machthunger und Zerstörungswut angegriffen.

Russland will keinen Frieden.

Russland ist ein Terrorstaat.",1,1,1,1,1,1
deu_8b16a3f45e21528f8798a23a4e9c7fcf,"Äußerer Feind?

russland?",0,0,0,0,0,0
deu_c875253986a44ac06a1603ff60087035,Russland will kein Frieden!,0,0,0,0,0,0
deu_dece2ea5d07bf3f8c77348a5d9133e9d,"Schon sehr bald wird sich Donald J. #Trump bei seinen Hasstiraden gegen Wolodymyr #Selenskyj so hemmungslos wie Dmitri #Medwedew gehen lassen! 🤷🏼‍♂️

⬇️🤡


⬇️🤯
",0,0,0,0,0,0
deu_852daa85b5f6b534139e679a411b8312,"„Some in Europe may be frustrated with Brussels, but let‘s be clear - if not Brussels, then Moscow. It‘s your 

Wolodymyr Selenskyj am bei der Münchner Sicherheitskonferenz",0,0,0,0,0,0
deu_df0a1182d8ce836e3d1c16dfb89b9c78,"Geil Krieg, Kinder lieben Krieg",1,0,0,1,1,0
deu_9a98b09a048315e7b50a47ec94b95d51,Silvester ist Krieg.,0,0,0,0,0,0
deu_647fe030b66ab6f9164999a234569039,"Erststimme: Krieg
Zweitstimme: Frieden",0,0,0,0,1,1
deu_8bf6f9a7daaac1957ce4d6bb41fda030,"Good morning world
News from 🥶
#Gaza #Palestine #Genocide 
#Holocaust2024",0,0,0,0,0,0
deu_9f870f354b5601ed9b04978ba018b2b8,"Hello 
In Gaza babies are freezing to 🥶🤢

#Gaza #Palestine #Genocide #GazaHolocaust",0,1,0,1,0,1
deu_4641e771e100c9fe2c9171d8f5d659ac,"#Gaza
#Palestine
#Palestine
#GazaHolocaust",0,0,1,1,1,1
deu_35066f0e034c8541d22a598d9f66735b,"Endlich Winter in Moskau 🥰
(Die Stadt kann nix für den Idioten im Kreml)

#Moskau #Winter #Russland",0,1,0,0,0,1
deu_0c6534ae19466dbe2c0d9144221f22a2,Waren die Linken nicht schon immer Radio Moskau?,1,0,0,0,1,1
deu_75f834940832b3a338ce267c2e286599,"
Blockempfehlung, verteidigt Hamas-Terror!",0,0,0,0,0,0
deu_74cad3060eebec63bfaf6cd84b21a5da,One more reason to hate Hamas.,0,0,0,0,0,0
deu_22147fd38d29a0c0b8fea882f6f681eb,Aber weiter #hamas und #handala blamen,0,0,0,0,0,0
deu_a2e481e13bfe34f7717aab1e3a4dec7e,Hamas schon oder brauche ma noch was?,0,0,0,0,0,0
deu_3f54146490a1e482e3d38e11c2baed4d,Nein. Für jede Geisel 30-50 Terroristen.,1,0,1,1,0,1
deu_3ed497202ba09349da1c1a66d1c6ad78,"Waffenruhe und Geisel-Freilassung im Gaza-Krieg vereinbart
#BringThemHomeNow🎗🇮🇱 ",0,0,0,0,0,0
deu_05afdc635cc4181122b0917c27fdfe76,"

Nie wieder Geisel Austausch innerhalb des Gaza Streifen. Sowas darf nicht nochmal passieren!",0,0,0,0,0,0
deu_e7b24bda941f8aa936c0116e3c11f0e0,"Nach Leichen-Übergabe: Tausende Israelis bei Kundgebungen 
Zu einer der großen Versammlungen in Tel Aviv hatte das Forum der Geisel-Familien aufgerufen",1,1,0,1,0,0
deu_dbb38224512584cd734f2197211b9164,Raiffeisen ist eine russische Bedrohung товарищ!,0,0,0,0,0,0
deu_ee69425c813d8433d3f35665eb1887c3,"Am Freitagnachmittag hat eine mutmaßlich russische Einflusskampagne auf der Social-Media-Plattform Bluesky gewütet. Ein Desinformationsexperte  vermutet die russische „Doppelgänger“-Kampagne dahinter.

#RussenBot",0,0,0,0,0,0
deu_695e0f374cb2a7541b923dffe9f48cf3,Meanwhile in Berlin: Schließt das russische Haus!  #b0601,1,0,0,0,0,1
deu_0e105d1070d402cb284a223ea6587f42,"Die schrecklichen Konfessionen des russischen Kriegskriminalitäts und die Kommunikation durch ukrainische Sicherheitsdienste.



Die schrecklichen Konfessionen des russischen Kriegskriminalitäts und die Kommunikation durch ukrainische Sicherheitsdienste.",0,0,0,0,0,0
deu_ba8c29d7afd4ed58becc18f01c6cca35,"Pro-ukrainische Hacker: Erneut folgenschwerer Cyberangriff auf Russland
",0,0,0,0,0,0
deu_f87807936c28b89612d132f01f3db6ca,Ein anderer russischer Machthaber hätte Kiew schon längst dem Erdboden gleichgemacht!,1,0,0,1,1,0
deu_bc616efbf88ab49c8760360795275b33,Wer bleibt denn für eine Koalition übrig in dem Fall? Alles Kriegstreiber.,1,1,0,1,1,0
deu_49d04a8f0b01d05e4bc87d97d5cac911,"Die Leute oben wurden ja nicht angeklagt weil sie Faschisten waren, sondern weil sie dazu noch Völkermörder und Kriegstreiber waren.",1,1,1,1,0,0
deu_c69b838c1b97903c376314db301cb627,"Fritze #Merz ist ein groessenwahnsinniger Kriegstreiber mit arroganten grosskapitalistischen, Attitueden, der uns alle in Nukleargefahr bringt um seinen mini-Napoleonkomplex auszuleben. 

Was meint IHR?",1,1,1,1,1,1
deu_d96db779da8337ea6aee1a6d46314033,"Irgendwie ist Putin nicht der Typ für normale Verhältnisse, so als Massenmörder, Kriegstreiber, Plünderer und Vergewaltiger.
Du stehst auf Mord und Vergewaltigung?
Melde dich doch als Kanonenfutter!",1,1,0,1,1,0
deu_a3ae2ebc114c31e230b37c03c5080013,"Kriegstreiber Russland möge sich  entmilitarisieren und entnazifizieren !! Dieser imperialistische  Terrorstaat ist eine Zumutung. Unsere 🇪🇺 muss geschlossen -!!!- Freiheit und Demokratie gegen solche Gewaltherrschaft  verteidigen.
Die demokratische 🇺🇦 gehört natürlich schnellstmöglich in die 🇪🇺❤️👍",1,1,0,1,1,1
deu_85a4402549e97a61c9f3866d839a5a28,Das liegt bestimmt an diesem CO2!,0,0,0,0,0,0
deu_16a9517d9d422e5e5e61c13edd9843ac,"Termin am Freitag - seid dabei:



#fridaysforfuture #klimastreik #wahl",0,0,0,0,0,0
deu_aa10d04d50b2b336d412ca3780bc459f,"Demonachlese:
mit ein paar tausend Antifaschist*innen für #Klimagerechtigkeit und gegen #rechteHetze auf den Straßen von #Bamberg ✊
#noAfD #FridaysForFuture #WirSindViele",0,0,0,0,0,0
deu_fa3e7613b71023219cf62964954df43a,"""Im Wahlkampft spielt Klima keine 
Stimmt auffallend.
Besonders das Klima zwischen den Parteien.",0,0,0,0,0,0
deu_86fb08ff79e0cb17ee8dbdd83c676e55,"Wer den Umweltschutz dem Bauernbund überlässt, bringt ihn um.",0,1,0,1,0,1
deu_ee50e30b529d4bcb44fd7839acf686e4,"Die Schachbretttaube im weißen Haus setzt die Kettensäge an bei Gesundheit, Bildung und Umweltschutz.

🤮🤬",1,1,1,1,1,1
deu_3484e51d823537a701da8f6e1e7b0a25,"#Unwort des #Jahres 2025 steht für mich schon fest: ""Glättung""

#woeginger #schwarzblau #budget #sparpaket #regierungsverhandlungen #fpoevp #umweltschutz #klima #foerderungen",0,0,0,0,0,0
deu_d3f49c15247bf2dee3863a8b5121af63,"🧐#Grüne ??
Sollte nicht Umweltschutz und Klimaschutz bei euch an erster Stelle stehen? 
Vielleicht noch sozial gerecht. 
Ist jetzt Wirtschaftspolitik wichtiger?",1,1,0,0,1,0
deu_276e71c4908430700675581fb5ac783e,"Die #DeutscheUmwelthilfe (#DUH) und die Gewerkschaft der Polizei (#GdP) übergaben über 1,96 Millionen Unterschriften für ein #Böllerverbot an das #Innenministerium […] 

[Original post on ",0,0,0,0,0,0
deu_9d30640623e3bf18c3fe2ee4fbc56ae2,"Und #Pelletheizungen stoßen nochmals mehr von dem üblen  "" #Dieselabgasgift"" nach DUH aus als #Holzöfen - direkt vor dem Kinderzimmer und Schlafzimmer.
",0,0,0,0,0,0
deu_72ef41625c51993c9d6bb5908dddad45,Bund scheinheiliger Wichte,1,0,0,1,0,0
deu_04ad9fd48d02ef23e78e68cf443e7923,Ich habe Angst ich habe unglaublich Angst als transfrau in die CDU wird mit offen rechtsextremen koalliren und ich habe Angst um meine Sicherheit und Zukunft in diesem land,0,0,0,0,0,0
deu_80321c3a94901c393dd86aee48f846a1,"Übrigens Eva ist Ja aus der Rippe von Adam gemacht

Im Prinzip ist Eva eine Transfrau 🤷

Gott hat ein Männliche Rippe zur Frau Transmutiert.

Wer gegen Trans ist gegen Gott.",1,0,1,1,1,1
deu_088f2a7fbf8ffb7e500afab2723457a1,Gender Pay Gap - warum?,0,0,0,0,0,0
deu_b28896acf53722fe99fd7207b2e7328e,"[binary gender]

FICK DIIIICH",1,0,0,1,0,0
deu_18168c3fb9966e652cdf3210a586cf69,"gender sind soziale größen und keine biologischen.

daher sind gender soziale geschlechter und keine biologischen.",0,0,0,0,0,0
deu_95decd2c662f37c5c09c8fa96cfa01c2,"Übrigens scheint der Autor selbst queer zu sein. Das erklärt zumindest, warum die Bücher so queer waren 😂",0,0,0,0,0,0
deu_782ee559752d5513822fefccf6bec5dc,"Die Linke queer schrieb

'Nazis raus - überall!",0,0,0,0,0,0
deu_a5bd025f1a2ed1d464ec01014a53fadc,"Keinen Platz und keine Stimme der AfD 

Demonstration morgen in #Hamburg

",0,0,0,0,0,0
deu_db5b61f4c9b2e6327b1fbffa62a4b7c3,"#PETA erstattet #Strafanzeige

#Polizeihunde bei Einsatz gegen #Demonstration misshandelt 





",0,0,0,0,0,0
deu_3b4957c65184f4d7dcc4664c40e53a07,Unwort des Jahrzehnts: Migration,1,1,1,1,1,1
deu_5a51863238803d89f87a6aaeaaea0ef6,"„Benehmen“ sie sich?

#Faktencheck
#Migration",0,0,0,0,0,0
deu_6cb80d8554529e68d59fb62a86aea77f,"Wer AfD wählt, ist Faschist.

Wer Tesla fährt, ist Faschist.

Wer Mump verteidigt, ist Faschist.",1,1,1,1,0,0
deu_57d58b1a86e1ca70d851901b7691356a,Scheißegal. Lieber sexy als Faschist!,0,0,0,0,0,0
deu_3b4a60160bf5ff0383c604d8c25a9129,Ich freue mich immer wenn Faschist*innen sterben.,0,0,1,1,1,0
deu_07e2deb5c8a1bbbbdb2355cea90aee09,Kommunismus ist eine gefährliche Ideologie!,1,1,0,0,0,0
deu_097a87ccfabd4b5d64bfe93561ab81e1,Reiche-Leute-Ideologie. Der sitzt #Tvduell,0,0,0,0,0,0
deu_329aa14796a554e7475dc88b08104646,Ein Katholik kritisiert „Allmachtsanspruch“ und „Ideologie“ (anderer). Genau mein Humor.,0,0,0,0,0,0
deu_cf240c4eb83b9c8912ed46ef23822ff7,Ein widerlich dreckiger Wahlkampf…,1,1,0,1,0,0
deu_418d8fa61d3970d16c408467305e223c,die woke linke will was? die woke linke will käsespätzle verbieten?,1,1,0,0,0,1
deu_a2d49091bcc075e748549195ef89a413,wg. woke nehm ich an,0,0,0,0,0,0
deu_93fd3ce3f89d6d860b0ad6d307a6b5c5,"Man kann ohne eine neutrale Vergleichsgruppe keine belastbaren Schlüsse ziehen. Und kein soziales Medium ist wirklich neutral.

Thema Israel:

Pusht Tiktok Positionen gegen Israel oder erscheint dies nur so, weil Positionen gegen Israel anderswo nicht prominent erscheinen?",0,0,0,0,0,0
deu_fdec1ba0c0efded4e0b924ebd99d0b75,Dann sind die Angriffe aus Gaza und die Raketen aus Iran also auch Genozid?,1,1,1,1,1,0
deu_3edefa59c20cc66cab218cd732adab4c,Ruhe in Frieden und Stille!,0,0,0,0,0,0
deu_a3696a7ae76699682986c6037a84812b,"Ja, aber die haben Schiss vor den Türken. Also nicht wirklich ein Problem.",1,1,0,0,0,0
deu_6d73f42494757c5fb65a644f231b970b,Du meinst abgesehen von den 28 Milliarden an Unterstützungsleistungen?,0,0,0,0,0,0
deu_121beaa12676ed70eefd620734e70734,"Vermutlich nicht. Aber Ideologie mit Sachverstand dürfte besser sein als reine, ahnungslose Ideologie",1,1,0,1,1,1
deu_ae236cf8bd5a8ef721b1c93d084a552b,"BDA - Hast du was gegen ""Ausländer""??",1,1,0,1,0,0
deu_c8ccc507c26ae120ac14c7cc72ad2fbf,Weil Sieger den Frieden diktieren.,0,0,0,0,0,1
deu_f185db48db07897732bf315bc6922167,Nicht Halal/Koscher Geschlachtet- Judentum und islam bleiben hungrig,1,0,0,0,1,0
deu_4158c96e4d50a69a8fefa58aba6745bf,"Es ist jedem klar, dass die GDL nicht aktiv Menschen eine Waffe an den Kopf hält. Aber, am Ende nutzen sie den von ihnen ausgeübten Druck auf Dritte aus, um die DB zum Einlenken zu bewegen, sie nehmen dem Wortsinn nach eine Geisel. Das ist halt normaler Sprachgebrauch und hat mit Strafbarkeiten nichts zu tun.",0,0,0,0,0,0
deu_5fc059ca97ec934e6a01e8f2970f2842,Ukraine: Peking verantwortlich für USA-Krieg,0,1,0,1,1,0
deu_4434adc5591c6858e15d9d33d1fbe875,"Direkt nach Gaza abschieben, wenn die sich so asozial verhalten",0,0,1,1,1,0
deu_ca7d54cf4605be7e2fc7d0202b959b79,"Und da sitze ma hier und @USER von morjens bis awens. Russland, Russland, Russland.",0,0,0,0,0,0
deu_2864a2ad9860f34857be5cc7a70d526d,"> ""Ich finde ja, der Gaza-Streifen gäbe einen suuuper Parkplatz am Mittelmeer""

Heilige Scheiße.",0,0,0,0,0,0
deu_4fc7bac3d8de09ca9811910f0af65bb0,"> Nein, war ja Geld für die Hamas und ich halte von der Hamas nichts.

Die Hamas war die Regierung im Gazastreifen, sehr viele Hilfsgelder sind am Ende an sie geflossen.

> Und halt dass er die Hamas stärker werden lassen hat.
Was wäre die Alternative gewesen? Die Hamas stürzen oder sie isolieren und damit im Endeffekt Gaza (inklusive die Zivilbevölkerung) aushungern.",1,0,1,0,0,0
deu_80a958d1ba7f7a63a400e671e195bdd1,"Waren wieder russische ""Fischer"" in der Nähe?",1,1,1,0,0,0
deu_0354af570838412a7acda1cda88161bc,Scheiße die meine Partnerin und ich abbekommen weil sie eine Transfrau ist.,0,1,1,0,1,0
deu_f54607788caba48e017b00dafdc20745,Alternativer Titel: Grünende entscheiden sich für Ideologie statt Kompetenz,0,0,0,0,1,1
deu_3be2673fe5c2c7917f4b113b987f0bf6,"Der russische Geheimdienst veröffentlicht ein von Russen mitgehörtes Gespräch.


Ja, ich hatte so ein Gefühl, dass die russische Regierung da irgendwas mit zu tun hat.",0,0,0,0,0,0
deu_7afdaed547af0fd396c9a8f1690c42f4,Kursk gehört doch zur Ukraine 😜,0,0,0,0,0,0
deu_6191f1f1a28ae154a46f1890dc25fc49,"Seit Ostern habe ich meine Liebe zu Freiheit, Patriotismus und gelenkter Demokratie entdeckt (Helldivers 2).",0,0,0,0,0,0
deu_b2aa008349bb6ec34385d2a79896c0fe,Auf Twitter wurde früher auch schnell die Zensur ausgepackt. Auf youtube wirst du zumindest demonetarisiert. Früher wurde da auch gleich der Kanal gesperrt. Auf den großen Plattformen des Internets war und ist in großen Teilen immer noch nur linksgrün woker Tenor erwünscht.,1,1,0,1,1,1
deu_69fc993a66093ec003767a76934f087a,Es ist ganz einfach. Wenn die Radarwellen im Bombenraum Sprungparadies Spaß haben wollen die da auch nicht mehr raus. Dann kommen die auch nicht zum Radar zurück. Duh,0,0,0,0,0,0
deu_224fc8c6e36ed323c3888ac964b135e5,"Ideologie.

Mittlerweile ist alles *Ideologie,* was einem politisch nicht in den Kram passt. Nur noch pejorativ gebraucht. Die eigene Parteiideologie ist dagegen eine *differenzierte Meinungshaltung,* egal wie einfältig sie ist.",0,0,0,0,1,1
deu_c405fa83d29a7480954b51ff08c2e233,"Der Treibstoff Mythos ist der beste 

Wobei der mit der Logistik auch gut ist 

Ukraine betreibt ja nicht die größte(zweitgrößte  nach Russland) europäische Panzerarmee derzeit 

Mit t72,t80 turbine, t80 diesel,bmp1,bmp2 als Fahrzeuge mit höherer Stückzahl aka über 100 außer t80s duh",0,0,0,0,0,0
deu_c22bc78b0dfc0fe881bab8c4c710d060,[This post or comment has been removed in protest of Reddit's API changes],0,0,0,0,0,0
deu_34138a795bc43efa50107b60417cfe87,"Der Krieg begann durch Russland. Und hat sich ausgeweitet, wieder durch Russland: durch die Einbeziehung Nordkoreas. Also alles schon passiert.",0,0,0,0,0,0
deu_55f99e182cf43da2c435805135e45e5a,"The good doctor, also Covid das Thema wurde.",0,0,0,0,0,0
deu_5c520c1f55e219662a1ae9fd6653e190,"Es gibt keine illegale Migration, da jeder hier Asyl beantragen und dafür einreisen kann. Deswegen nennen sie auch seriöse Politiker irreguläre Migration.",0,0,0,0,0,0
deu_93a453e50d8a0a2fb7a39cb735916d9e,"aBeR IsRAEl beGHeT gENozID!

Quell: Dieses Interviw von nem dude der sagt das was Israel macht nicht als Genozid Klassifiziert werden kann, aber das ist sccon 6 Monate und Mitllerweile ist es defintive bestimmt nen Genozid( ungelogen nen Argument was ich mal von nem Free Palestin ""Aktivist"" an denn Kopf geworfen bekommen habe)",0,0,0,0,1,1
deu_d84c49274a330a0312e79c74296d2f4e,"> die linken mods

Dieses Sub ist jetzt WOKE!!!!!!",1,1,0,0,0,0
deu_a2af795180ba582720b62fdaf7fe5999,"Genau, dann haben wir nämlich das Gas aus der Ukraine über die ukrainische Pipeline gekauft. Hmm, warte mal, jetzt ergibt alles Sinn.",0,0,0,0,0,0
deu_62ec5e0ef1597080c95e27f04cdc48b2,@USER RADIKALISIERT durch gender pronouns.,0,1,0,1,1,0
deu_f03389c67d28efb9c6de1ed0563b4436,Asyl ist kein Prozess zur Mitarbeiterrekrutierung,0,1,1,0,0,0
deu_e6712daed73f9b6cc7d184827fa8df62,Ralph Fiennes als Putin wann?,0,0,0,0,0,0
deu_52a1871ffdb982cb867ee698f812ed77,Russische Cruise Missiles haben ne Ausfall-/Fehlerquote von fast 20%. Also streich mal Karlsruhe und Dresden von der Liste und füge stattdessen zwei russische Städte mit hinzu :D,1,1,0,0,1,1
deu_9a02cb82a61e67001872708117d7ff00,Und kampfjets+taurus für die ukraine?,0,0,0,0,0,0
deu_34d0465e41bbdbd64ba2adb19e4073d9,Wie kommst du darauf? Volt ist gerade beim Umweltschutz bzw. beim Kampf gegen den Klimawandel das volle Gegenteil der FDP.,1,0,0,0,0,1
deu_ae2edb764bd50ba0da3af72ee7e2e6ed,"Was für eine Katastrophe. 

Harris war einfach nicht die richtige und der Wahlkampf war nicht gut genug.

Wo sind jetzt die Leute hier die mir verkaufen wollten dass sie einen ""perfekten Wahlkampf"" hatte?",1,1,0,0,1,1
deu_3be2ef7e1cebf188d04c824af8eb08d7,"Ich denke leider auch dass es nicht viel gebracht hat (und das aufgearbeitet werden sollte). Erkrankt trotz 3x Impfung und mit jeder Impfung stärkere Nebenwirkungen, beim letzten Mal mehrere Tage flach gelegen.",0,0,0,0,0,0
deu_f4f0e05de488d95966dea4e6da17b85c,"""Die Linken sind schlimmer als die Rechten: die Rechten wollen Ausländer töten, die Linken zünden Autos an, und einen Ausländer besitze ich @USER - gleiche Logik",1,0,1,0,1,0
deu_d69f6f286c561261ae39d065b4d5697f,Und als ob die doppelte Staatsbürgerschaft nur Deutsch Türken betreffen würde,0,0,0,0,0,0
deu_ce705ec271b1b41b3ba40724f6c5217c,Denke Corona Impfung,0,0,0,0,0,0
deu_fffd25cbb54055c6952335bf9c50b840,Die jüdische Allgemeine hat das Problem des muslimischen Antisemitismus mehrfach klar benannt. Das muss man ihnen zugestehen.,0,0,0,0,0,0
deu_ce8bbfef9f88b7981a64ac2fe1a13e4d,Krieg Krieg Krieg! Das sind die Grünen.,1,1,0,1,1,1
deu_728b8ea8f67e711393ec8d93164c89f8,Weil hier speziell Türken sich gruppiert haben und es ein türkischer Betrieb ist.,0,0,0,0,0,0
deu_bb5443e57d90a27fd61ab7a9ccc3d973,Ich bin Deutscher und du bist Faschist :) danke für den Kommentar.,1,1,0,1,0,0
deu_d3d31bf1fe98d8b6286e4f0ca8cb39dc,Sind Türken ohne türkische Staatsangehörigkeit trotzdem Türken?,0,0,0,0,0,0
deu_251ac7969d6d55a9def00633f9398e43,"Nee, das machen wir hier nur wenn Araber 'verbotene' Parolen rufen.",1,1,0,0,0,0
deu_df23f5f88459f51418165762bae0957d,Keine resoektable westliche Quelle nimmt die ukrainische Quelle für bare Münze ,1,1,0,0,0,1
