id,text,stereotype,vilification,dehumanization,extreme_language,lack_of_empathy,invalidation
deu_4b8fca77704e9d6002244c2f2a542b37,"„ But the level, the number of people dying is number one, not sustainable“  

Well duh, killing enemy soldiers until the enemy  can’t send replacements is kinda the point. ",0,0,0,0,0,0
deu_6d4eb2b4688d94e509e45ba6c08d100e,"Also, nicht nur Faschist, sondern auch Imperialist. Das wird ja immer besser!",0,1,0,1,0,0
deu_08b0bce2fdbe8a0a5d058e79bc5140e2,"Danke!

Die Menschen haben aus der Pandemie leider echt nix gelernt.",0,0,0,0,0,0
deu_849e720c7e9acec7df2ed3f3134cf5e4,Die Putenpuppe soll nach Moskau,0,1,0,0,1,0
deu_6e3dc94d04113bf2dfff0271b232e497,"NDA

von Klatschen oder 'Unterstützung' in Form von 'familärem Klima' kann man sich nichts kaufen. Zudem - familäres Klima herrschte auch bei Fritzl, Klima gibt es immer - ob das tatsächlich so gut ist, wie jeweils behauptet, das ist ein ganz anderes Thema.",0,0,0,0,0,0
deu_caa741ee5bf7e6d12c42b147093013a2,Bullshit hau mit deiner Antisemitischen /Antizionitischen Kackscheiße ab. Das Jüdische Volk lebt da seit Ewigkeiten. Gleichzeitig wären sie schon mehrfach alleine in den letzten paar Jahrzehnten Kriegstechnisch komplett vernichtet wurden hätten sie sich nicht verteidigt.,1,1,0,1,0,1
deu_a4d27b3151cc1888f571714883ca11ef,"Und weil die Polizei kaum kontrolliert wird, geht das seit Jahrzehnten so weiter. Und kein Politiker könnte das öffentlich ansprechen ohne als linksgrün bezeichnet oder mit den US-Demokraten (lol) verglichen zu werden ",0,0,0,0,0,0
deu_46533f18c4dc711d0354b97a21e95f10,"Unsere BND wusste von dem Angriff von Russland, deswegen war der BND Chef am @USER in Kiew.",0,1,0,1,1,1
deu_57a72be0830351992ff16c045f7b7f8b,Doch! Wozu glaubst du schmeißt Israel die Bomben auf Gaza?,0,0,0,0,0,0
deu_1f43a8e22864911bb2760222d2985b56,"Soßenbinder natürlich, duh! 

Was denn sonst!",0,0,0,0,0,0
deu_baf02b0048bbd48810c2125fb51756cb,Ja ich habe auch mega Lust auf weiter ungebremste Migration,0,0,0,0,0,0
deu_e3a7e0bf26b6a939f22acb11535ff442,Wo haben arabische Israelis weniger Rechte als Jüdische oder Christliche oder Atheisten?,0,0,0,0,0,0
deu_409f1269782144d220e747800d400cf0,"Um dein Beispiel zu nehmen. Wenn ein Mafiaboss eine Geisel entführt und diese schützend vor sich hält und dabei durch die Straßen läuft und wahllos Menschen erschießt und dann kommt die Polizei und schießt zurück und trift dabei aber die Geisel und die Geisel stirbt.

Wer ist dann Schuld an der toten Geisel? Sollte der Mafiaboss verurteilt werden oder der Polizeibeamte?",1,1,1,1,1,0
deu_a75bf822ed4229b5d09184f60d9e7c5e,"Vor Corona vielleicht ja. Nach dem Corona und Ukraine, sicherlich nicht.",0,0,0,0,0,0
deu_7706705c2c4789c98ddc347d00d4bd49,Und wichtige Themen wie Migration vernünftig angehen. Deutschland bleibt ein Selbstbedienungsladen.,0,0,0,0,0,0
deu_edcc6251767f7fab270c4f5db20cb27f,">  wenn Krieg jetzt doch wieder geil ist

Wer sagt Krieg ist geil? Niemand will in den Krieg ziehen. Wenn die andere Möglichkeit aber eben ein imperialistischer Staat im Osten ist, der damit droht deine Heimat zu zerstören und deine Familie umzubringen, dann ist Krieg eben eine Notwendigkeit um sich zu schützen.",0,0,0,0,0,0
deu_71a40c17500a4251ff38db7a71e52ff3,"&gt; Das hast du gesagt. 

Nein, das habe ich dich gefragt.

&gt; Keine Ahnung, aber es wäre respektlos, wenn sie Kiew nutzen, während ihr Land von Russland angegriffen wird.

Es wäre Respektlos, ihre eigene Sprache zu sprechen, weil sie von einem Land angegriffen werden, in dem die selbe Sprache gesprochen wird? Alles klar.",0,0,0,0,0,0
deu_c5a7036d70d4b65c4cb22b9bc50cdf48,Das sich dieses Märchen immernoch hält ist ein Propagandameisterstück von linksgrün,1,1,0,0,1,1
deu_ef8f008b07693592cc25e19ab5fbfb0f,"Das blaue Virus ist schon aus Bayern ausgebrochen, und bald wird der ganze Osten ähnlich blau sein.",0,0,0,0,0,0
deu_223ebec87e79f8a5d88c65e677dc8d73,Was für ein Clownsverein. Hoffe die Letzte Generation folgt bald auch,1,1,1,1,1,1
deu_2b9b2462c426f48be2b2d4baab99d575,Oh Gott. Du hast den Zorn von tausenden Türken auf dich gelenkt. /s,0,0,0,0,0,0
deu_67dc946a97ecc3cb9fc8667b0c9ab8ec,"Zuletzt sieht man, auch die Muslime werden rauer untereinander.",1,1,0,0,0,0
deu_eaadf6a45eec2c732c0dd8f5dc44356e,"NDA
Die Corona-Pandemie ist noch nicht vorbei und das Virus ist luftübertragbar.
Dazu ist aktuell ein Papier peer-reviewed und bestätigt worden, das nachweist, dass sich das Sars-Cov2 Virus mit mindestens einigen aktuellen Mutationen wie das AIDS-Virus verhält und die T-Helfer-Zellen angreift und zerstört, ohne die keine Immunantwort ausgelöst werden kann.
@USER

Selbst mit milden Erkältungssymptomen also gut, dass du Rücksicht auf andere nimmst.",0,0,0,0,0,0
deu_50993e02b800428ef14e358e7b020bf8,"Wie werden die Araber denn in Israel diskriminiert? Ich meine die Frage ernst. Landläufig hört man ja eher, dass die Kulturen in Israel friedlich zusammenleben.",0,0,0,0,0,0
deu_e0f9b3af5adbe491a29e3ddaf9e34ee3,Was hat die Hamas mit Putin zu tun?,0,0,0,0,0,0
deu_bb8bdcf94da84378db8b2c9febaa514d,"Warum genau muss man jetzt öffentlich Mitleid zeigen, wenn ein Faschist leicht verletzt wird?",0,0,1,0,1,1
deu_85129893c6fdecb08d18e91bd444995b,"Für alle, die es nicht gecheckt haben.

Transfrau. Also keine Frau, sondern eine Transfrau. Headline wird Frau geschrieben und darunter Transfrau. Warum man die Begriffe vermischt, ist mir nach wie vor schleierhaft.",1,0,1,0,0,1
deu_f30143814467519dda3e4bd1d7e5146b,Ich werde das jetzt nicht suchen und in Frieden leben.,0,0,0,0,0,0
deu_c2be8ace8346ea6eec1cb0e8eb35745d,"Du sagst im Grunde: Gewalt ist keine Lösung, ausser wenn sie doch eine Lösung ist.

Problem: Hannes Attackiert dich Gewaltsam.
Lösung: Du wehrst dich mit Gewalt.

Gewalt bleibt also eine Lösung.

Was du hier beschreibst ist man sollte Gewalt nicht proaktiv nutzen aber selbst da nennst du ja bereits eine Ausnahme. Wenn ich bereits Gefahr in Verzug sehe.

Problem: Hannes zeigt äußerst aggressives Verhalten und hat Peter schon am Kragen.
Lösung: Du packst den Hannes und fixiert ihn.

Gewalt ist also wieder die Lösung gewesen.

Gewalt ist eine Lösung. Ist und bleibt die Tatsache. Sie ist nicht die Lösung auf alles, das impliziert der Satz ja auch nicht!

Probelm: Autopanne
Lösung: Den Kerl vom ADAC vermöbeln.

Gewalt war keine Lösung.

Edit: Davon abgesehen sollte man, die Tatsache das Gewalt ein Lösungsmittel ist von moralischen und ethischen Vorstellungen entkoppeln. Das wir uns einig sind das Gewalttäter, Kriegstreiber, Diktatoren etc. nicht moralisch gut sind. Ich denke das sind wir uns einig.

Dennoch existieren sie und für diese Menschen ist Gewalt halt doch ein universales Lösungsmittel. Zur Gewalt gehören immer zwei.",0,0,0,0,0,0
deu_cea09308c52c270bdbb2987950201861,Der kalte Krieg beginnt,0,0,0,0,0,0
deu_8be52a73cd626fc9d894393a7496c949,"Unsere Gesellschaft wäre keine liberale Demokratie, wenn man Leute nicht mehr kritisieren dürfte, die Putin und Querdenker Propagander verbreiten",0,0,0,0,0,0
deu_e6cabc1c4ba5add0760611dc63c93f0a,"Als Religiöser Mensch sagst du halt einfach irgendwann ja stimmt so statt bereit zu sein dich immer auf ganze Hinterfragen zu können. 
Religiöse Menschen belügen sich und andere auch wenn es die schönsten Ansichten sein sollen. 
Christen und Muslime sind Christen und Muslime aus Erziehungssystem",1,1,0,0,1,1
deu_8c6155dacb9455aad66b63a50c92f243,All-in ukrainische Agraraktien mit Hebel.,0,0,0,0,0,0
deu_47e44c507642525e2d916e5791027e14,"> Aber Israel hat die Palästinenser in Gaza eingesperrt.

Dann verstehe ich nicht, warum du ausschließlich Israel als verantwortlich für die Blockade von Gaza benennst.",0,0,0,0,0,0
deu_3ef5f9a6dec4074a068a1a059446021a,"Alles klar und Danke!   


Der Virus stellt kein Problem da?",0,0,0,0,0,0
deu_4fddada15f6e99ff6eb6b0d1e8a5b83d,Her daddy Putin approves,0,0,0,0,0,0
deu_ee0016806446081e1fe8e8e87d64ce59,"Oh nein, die Grenzbefestigung angreifende Männer die bestimmt nicht zur Hamas gehörten. Was? Hamas hat deren Beteiligung sogar bekanntgegeben? Komisch komisch komisch.",1,0,0,1,1,0
deu_88ee6c81e7f14740bb32a34b45c2b540,"Denkst du, die Impfung ist auch beim nächsten Hochwasser schuld?",0,0,0,0,1,0
deu_71df6a80d64207ec61feedede0dc3f2d,Das Partriachat kommt mir immer ein wenig vor wie die jüdische Weltregierung oder andere Schwurblerschattenorganisationen die auf der Welt die strippen ziehen würden ohne das sie physikalisch sichtbar werden.,1,1,1,1,1,1
deu_a808dd33dcca9004074de53ed722a304,"Ja klar, wenn man sich einfach irgendwelche Erfolge für FFF ausm Poppes zieht, kann man dann natürlich behaupten, dass FFF extrem erfolgreich war

Ich geh morgen mal vorm örtlichen Rewe demonstrieren und schreib mir dann die Angebote von nächster Woche auf mein Erfolgsreview",1,0,0,1,0,0
deu_5b06bac9aa7d20fe6e293d0b130d805c,Woke ist das Nazi der Rechten.,0,1,0,1,0,1
deu_7323f8281ef3bb7e74434709db44f33f,"Es sind viele Juden eingewandert, das steht außer Frage. 

Das es in Israel schon seit Ewigkeiten eine jüdische Gesellschaft gibt, mal größer, mal kleiner (woran das wohl liegt?), steht auch außer Frage.",0,0,0,0,0,0
deu_7e5ee35fefef62950f24124cdb95064d,Rechte und Querdenker sind schon sehr gut darin Foren zu brigadieren.,1,1,0,0,1,0
deu_b4cb7e9ac39b16b3e5782803340128b2,Die Ukraine *massiv* stärker unterstützen?,0,0,0,0,0,0
deu_9ca1386d1ec53f56d2d68485414250b9,"Die Hamas bekommt noch ihren ""Endsieg""",0,0,0,0,0,0
deu_06f6d73f193b9dd079dcde68e886cf46,"Spätestens nach den Ereignissen vom Samstag greift Godwin's Law leider nicht mehr.

Hitler — wollte die Juden ausrotten

Hamas — will die Juden ausrotten

Und da solle man nicht vergleichen?!",0,1,0,1,1,1
deu_8b5bfbd0b3a0ce49c6a19e1ef1f75280,">Wenn man ehrlich ist, was ist die politische Veränderung von FFF?

Hatte dazu gestern schon mal etwas geschrieben:

@USER",0,0,0,0,0,0
deu_dec252cb09c5edf324ecdb8f7d01e081,Die Schwierigkeit ist es dabei auf Ausländer Rücksicht nehmen zu wollen aber nicht zu wissen wer Ausländer ist. Darauf haben sehr viele keinen Bock. Und so zu tun als wären Ausländer farbenblind und der weiße durchsetzt mit Rassismus erzeugt nur die Abwehrhaltung die OP anprangert,1,1,1,0,1,1
deu_0558a93a68d793c6810cbd754228d7ae,"Warum sollte Israel das auch nur ansatzweise in Betracht ziehen? Selbst **wenn** das neue Regime minimalst freundlich gegenüber Israel eingestellt **wäre**, wäre das Risiko für Israel zu hoch - für keinerlei Mehrwert.",0,0,0,0,0,0
deu_7fad4ae4847a78fcbd0d2465d55523b9,Was meinst du mit dem CO2 Gesetz und FFF? Bin kein Eidgenosse.,0,0,0,0,0,0
deu_ee408dd26cfc4b07d9e62404850c2ee6,Hamas hat Millionen an Hilfsgeldern zur Verfügung. Tja.,0,0,0,0,0,0
deu_b7723242e6ab9eb2dd0870411432b5b5,Warum lieben sie russische Schwänze so stark dann?,0,0,1,1,0,0
deu_be95614ba206d1fd5721166f3d99492d,"Solange es gegen Schwarze, Araber und Antifa geht.",1,1,1,1,0,0
deu_60bc5b2e5f5553394762a09115378ce9,Worin besteht der Unterschied zwischen kurdentötenden Islamisten und kurdentötenden Türken?,0,0,0,0,0,0
deu_72683939574b7a79c250a93580f4ee97,Auf dem Insta von Gracia Gracioso sind beide Videos die in einem gezeigt werden (letzter Videopost). Es ist doch ein Schlag der Transfrau ins Gesicht der Linken zu erkennen. Wenn man das Schlag nennen @USER,0,0,0,0,0,0
deu_31bbd0e38947db7527cd108fd0f91154,"Ruhe in Frieden Uns Uwe, du warst ein guter!",0,0,0,0,0,0
deu_dc9c5934bbe535857eed749ec5d24f47,Quelle ist halt die Weltbank. Nicht die russische Regierung.,0,0,0,0,0,0
deu_023dc03329849d36b29199103d341508,Inwiefern ist Satanismus etwas anderes als Ayn-Rand-Ideologie mit edgy Ästhetik?,1,1,0,1,1,0
deu_3648385492a5b6c1144929780c23cc67,">Wir werden 2050 weiter geld nach israel @USER

Welches Geld schicken wir denn derzeit nach Israel?",0,0,0,0,0,0
deu_5414be88424d71716b2f39870002083b,"Außer Juden, die machen es extrem schwer zu konvertieren.",0,0,0,0,0,0
deu_d82e26d89f57d56a2436f423f938a9df,Der letzte weg ist  inkasso moskau  xD,0,0,0,0,0,0
deu_a95bbfba9c1413c433f2b061d89030b1,Papier ist keine Alternative zu Plastik in Sachen Umweltschutz,0,0,0,0,0,0
deu_aa9118fa5cbc2915347c0ff3c47417a5,"Das schönste Detail im Bild - ich erinnere mich noch an die ganz großen Pazifismus-Kiste der Grünen, wie haben sie sich damals ihr Schandmaul zerrissen - und dann selbst an der Macht sind sie der größte Kriegstreiber.

Heuchler.",1,1,0,1,1,1
deu_35f5185680e2e87ebb2381e7e7f13855,Wurdest du schon auf das Eppstein-Barr-Virus untersucht?,0,0,0,0,0,0
deu_e15ee25c54a651f66fff9644955482e9,"@USER Krieg bleibt immer gleich!

Aber 👉👈🥺 brudi dich mag ich!",0,0,0,0,0,0
deu_c6dee3f1b2f868f400985b9352feba13,"Wenn die für jedes Dorf 300 Panzer und Tote im fünfstelligen Bereich brauchen, dann ist Russland bis Kiew entvölkert.",0,0,0,0,0,0
deu_13defbc37882e65ef091fe32cd40efde,">Bekenntnis zu Israel

y tho",0,0,0,0,0,0
deu_3af2fa0094f04015d40aa86bc897be88,"Entspringt aus dem Gedanken ""wir sind das auserwählte Volk Gottes"" (genauere/korrektere Formulierung habe ich nicht parat) leicht ein Gefühl der moralischen Überlegenheit? Sehen sich jüdische Menschen leicht als ""besser"" an als nicht-jüdische?",1,0,1,1,0,0
deu_b9846bcb018cfbbbacbc5a1b15832db4,Fand den Israel-Apologeten.,0,0,0,0,0,0
deu_7d35a514c485973b6a550d5f5b80c82c,"&gt; diese Person lediglich irgendein beschissener Krimineller, der sich einbildet, er könnte sich durch seine Geschlechtsidentität (ob nun real oder nicht) aus der Verantwortung für seine Tat stehlen. @USER ist ein Vergewaltiger, der die Community ausnutzt @USER Nicht der Vergewaltiger,

Schönes misgendern. Oder darf man Menschen, die man nicht mag misgendern? Oder welches Kriterium erfüllt die Vergewaltigerin nicht um als Transfrau zu gelten?",1,1,1,1,1,1
deu_95e641303629586d3dc9a3694d858aa0,Was sagt das Klima dazu?,0,0,0,0,0,0
deu_24c812f359220f47cb652f94a7015887,Sind das dieselben Experten die Vorhergesagt haben das Kiew nach 3 Tagen fällt?,1,0,0,0,0,0
deu_df27aed452afa2c3919808a2d79c1f3d,Erstmal Demo gegen rechts,0,0,0,0,0,0
deu_d384871b682658b3d6cc988602208ad1,"So geht Wahlkampf. 

Für die Freiheit Kinder zu schädigen.
FDP",1,1,0,1,1,0
deu_7a34feb802bb50731d8d3a6f21bc7e42,">Nach Bekanntwerden eines Geheimtreffens von radikalen Rechten ist auch in Bochum eine Demo gegen die AfD angemeldet. Was im Detail geplant ist.

@USER",0,0,0,0,0,0
deu_e335ab61b2ecebd26cd2bd6bdf00b659,Begriffe verlieren manchmal ihre Bedeutung oder bekommen eine andere. Siehe Querdenker.,0,0,0,0,0,0
deu_5b804db7ba9008a83f194e5c085eee6d,Jetzt wollen mir die Fleischesser auch noch die nächste Pandemie aufzwängen.,1,1,0,1,1,1
deu_138e3cad423e88ba88f7dffce63dfa70,Waren aber Serben und damit aller Wahrscheinlichkeit nach keine Muslime.,0,0,0,0,0,0
deu_65e5e6a97f39b943ec6d5eea9278eadb,Also schnell über den Zaun der nächsten Villa klettern und Asyl beantragen?,1,1,0,1,0,0
deu_4be2624856333536ca22e9f2cb12df51,"Steuerzahler, bzw. die Bevölkerung in D und auch EU wünscht sich außerdem mehr Tierwohl und Umweltschutz.",0,0,0,0,0,0
deu_ecdddf22ecba9953c59ece92fc97462e,"Leute die überall die jüdische Verschwörung wittern glauben, dass das gefordert wird.",0,0,0,0,0,0
deu_37e072ce102b09b40f7e82e32dc71912,"Wenn Du die Musik an sich nicht magst, dann ist das ja OK - jeder darf ja nen eigenen Musik-Geschmack haben - aber mit dem Ausdruck ""dritte Welt Musik"" ist das ein klares BDA",1,1,0,0,0,0
deu_e5f0a46acdc313962b945af42296d878,"Soviel ich weiß kommen die einzigen Gebote zu Gender von Söder, der ein Gender Verbot im Gesetz hat - also ein staatliches Sprachverbot.",0,0,0,0,0,0
deu_466f121ad3e21760990a8f4934e58804,Reicht von 12€ beim Türken bis zu 25€ bei der Deutschen in meinem Stadtteil in Recklinghausen,1,0,0,0,0,0
deu_e0e26f0d4dff257525bab0b1db319ab4,"Wenn die DUH vor Gericht recht bekommt, zeigt das ja leider, dass die staatlichen Organe sich geweigert haben selbstständig Tätig zu werden, obwohl sie in der Pflicht sind.",0,0,0,0,0,0
deu_03f3a395fc8d06b71ef4c63806f05fa5,Hisbollah beschießt Israel mit Tausenden Raketen also ja Israel darf sich und sollte sich auch wehren.,0,0,1,1,1,0
deu_0ec4672760578d3567a986fccbddb516,Wenn man die Realität als Linksgrün definiert dann ja. Für Konservative ist ja sogar das Wetter schön zu politisch.,1,1,0,0,0,0
deu_86ded985baeb64e16b636ff47de858c9,">Diejenigen kein Asyl wollen und das Vertreten müssen das aber auch ehrlich sagen.

Die nächste Frage wäre dann aber wie man Asyl definiert und was passiert wenn es nicht gewährt. Und das sind momentan sehr politisch relevante Diskussionen die 2015-2023 aktiv tot geschwiegen wurden.",0,0,0,0,0,0
deu_ecd51524d97378ffa3db7ff44104e657,"Jemand aus Wolodymyr Selenskyjs Redenschreiber-Team

Diese Menschen überraschen mich bei seinen vielen Reden um den Globus immer wieder durch detaillierte Kenntnisse über das jeweilige Land, die Geschichte und was dieser Gesellschaft wichtig ist. Auch würde mich mal deren Work-Flow interessieren.",0,0,0,0,0,0
deu_7260edb86049c29e16e453e49c91b911,"Ohne NATO Waffen wäre Kiew jetzt besetzt. Sanktionen sind gut, aber die paar Monate bis zur vollständigen Eroberung von Ukraine hätten ein paar Freunde Putins auch ohne ihr Auslandsvermögen überstanden.",0,1,0,0,1,0
deu_d1f0a67677a99f12c47eb59a33263b7d,"Umfragen haben sogar ergeben, dass männliche Muslime signifikant liberaler sind ihr deutsches Counterpart.",0,0,0,0,0,0
deu_a877e35219cc751b57735f443629c25f,"Geh zum Araber, der macht dir alles + Massage und Küsschen für 7 € wenn er teuer ist",1,1,1,0,0,0
deu_9642c4647018017229148f1449a3b325,">„Politiker dürfen sich zu Hause nicht mehr wohlfühlen!“ 

Das ist eine eindeutige Drohung und sollte definitiv strafrechtlich geprüft werden. Das demokratische Grundrecht auf Demonstration auszunutzen, um Politiker einzuschüchtern, ist ein grundlegender Angriff auf die Demokratie.",0,0,0,0,0,0
deu_c633093d5d3fbafada6bf2d841dfc5c4,Einzelgänger und gutes Immunsystem regeln.,0,0,0,0,0,0
deu_9a3f989afae058f0495a20644d594c32,Das Immunsystem steht eng in Verbindung mit deinem Darm. Probiere eine Darmaufbaukur mittels Präbiotika wie OmniBiotic. Mir hats sehr geholfen.,0,0,0,0,0,0
deu_c0e0095a0d911c0db021c9abb4e73563,"Chemikalien in die Umwelt kippen ist richtig gut für den Umweltschutz! Das @USER

&amp;#x200B;

&amp;#x200B;

Vielleicht wenn man wochenlang Klebstoffdämpfe schnüffelt.",1,1,1,0,1,0
deu_ddbebc1647ee028d8b91fad031467729,"""Superschafe"" ?  unangenehm. 
Ich bin so gut wie nie krank .. bin ich jetzt ein ""Superschaf"" weil ich ein ""besseres"" Immunsystem habe als andere?",0,0,0,0,0,0
deu_31bf5c72f351f6bd2767d6013138dd9b,"Zumächst braucht es mal Gehirn einschalten, oder meldet euch bitte freiwillig in Kiew",0,1,0,1,0,0
deu_d9b6cec4d9629a71bcb964ae52f11890,"Griechisch: Achilles am Stadtgarten

Ukrainische Teigwaren: Gastro Oma (kann man auch gefroren kaufen und Zuhause zubereiten)",0,0,0,0,0,0
deu_5db1d90c6008068d637f0264d8868c20,"Aber da waren doch auch keine 100 ""Araber"" am Randalieren, oder?",1,0,1,0,0,0
deu_ff99303d19fd9450832182e109201369,"Weil Israel auch das Land ist, welches verhindert, dass Gaza sich anderweitig versorgt. Schau dir mal die Küste des Gaza-Streifens an. 

Wunderst du dich nicht, dass da nirgends ein Frachtschiff anlegen kann?

Israel möchte alles kontrollieren, was nach Gaza rein geht. Völlig verständlich. Wer weiß, wie das Wochenende ohne Blockade ausgesehen hätte. Dann muss es sich aber auch darum kümmern, dass die 2 Mio. Menschen die dort leben nicht verdursten.",0,0,0,0,1,0
deu_ea2e4f5a09de6e74f640e144684f804c,"Ich hoffe, sie gewährt in Zukunft den Wirtschaftsflüchtlingen aus Deutschland Asyl.",0,0,0,0,0,0
deu_f8b1c6d56815c2a08da70c859560607d,Ukraine-Russland Konflikt. Zu gefährlich nach Russland zu fahren,0,0,0,0,0,0
deu_4147272dcfedcd32fb00d795279ab077,Find das gar nicht so off topic und kanns nach der Pandemie Erfahrung echt nachvollziehen 🙃,0,0,0,0,0,0
deu_3f6af0220f2e045963b3124874e29b1d,"Wessen Marionetten sind diese ""nicht aufrichtigen Muslime""?",1,0,0,1,0,0
deu_25a4f8a8e31d4635c9e86fe8d8d0a2ea,Zum Glück schädigt Covid nachhaltig das Immunsystem.,0,0,0,1,1,1
deu_112f6961e08eec84ff7ccf04ba060f5a,"""AFD - Volksverräter"" klingt nun nach eine passenden Slogan für eine Anti-AFD-Demo ",0,1,0,1,0,1
deu_b88d36da313bd46a5ef010ffe09d1da7,"Zu viel Migration in bestimmte Viertel, die dadurch sehr homogen werden.",1,1,0,1,0,0
deu_fa70d6f73d1d615509dc62ab0f0a0870,Söder geht im Wahlkampf also wieder auf Bauernfang.,1,0,0,1,1,0
deu_0f8fd5424cdcd3a5a9d187e143bc2945,"In Gaza gibt es keine israelischen Siedler, die treiben ihr Unwesen an anderer Stelle.",1,1,1,1,1,0
deu_f6a5258dfb0d711834046effc358e04e,Auf einem Chromebook ist ein Virus quasi unmöglich.,0,0,0,0,0,0
deu_b35644e9110022c29f1a3cef158fbe26,"Selbst dann nicht. Denkst du mit Ukrainern und Putin Gegnern wird anders umgegangen? 

Genau so ein Denken ermöglicht den Apparat Putin.",1,0,0,0,0,1
deu_bb78c9998157bf38d5d4d5e209cb315b,"Naja, jüdische Weltraumlaser sind schon weg.",0,0,0,0,0,0
deu_d30caa06c61d41f537aa37271943318d,Und dann fahren die Russen in einem 60 Kilometer langen Militärkonto nach Kiew?,0,0,0,0,0,0
deu_1babb8be766efa0adf1d91856908ef34,"Ja die @USER Kriegstreiber, die haben ja Russland nichts anderes übrig gelassen als sie anzugreifen!",1,1,0,0,1,1
deu_f1463da1e5176efaafd6a03cc94c1bbc,"Die Tunesier müssten aus Rache einen Dokumentarfilm über die Gründung von Netflix drehen, aber die Gründer werden gespielt von einem Klischee-Araber und einer Äthiopierin mit Lippenteller.",0,0,0,0,0,0
deu_2899ed37660fb0b6392e7307e234f025,Bestimmt nur ein Protest-Fahnen-Hisser.,0,0,0,0,0,0
deu_3af21f8f2ac8b4eaab3fc2fbd25f5c94,"Jo wenn du deren Beiträge zur Ukraine siehst, dann passt Querdenker da halt wirklich gut.",0,0,0,0,0,0
deu_61663dfcffc724ee9bcbe63c06495a45,Ja manchen ist die Hamas nicht radikal genug.,0,0,0,0,0,0
deu_e0d4c3d5dfb47fe561e724dbb32878a6,"Linksgrün ist für solche Leute alles, was links von der CDU ist.

Oder andersrum ausgedrückt: Nicht linksgrün ist nur CDU/CSU, AfD und FDP.",1,0,0,1,1,0
deu_ed60059e6ca52fc5be805996ae1b947a,Hallo wir sind die Corona Band :),0,0,0,0,0,0
deu_3aa6960f636b6d6c5be6c48c27fac788,Für Kanonenfutter zahlt Putin sogar.,0,0,0,0,0,0
deu_217797ad652e565ff71aafea5ba3bb6e,"tja, das stimmt. Nur dumm, dass die dumme Masse sich von der Boulevardpresse soweit hat manipulieren lassen, dass jetzt alle Menschen, die sich in irgendeiner Weise für Umweltschutz einsetzen, mit Klimaklebern über einen Kamm geschert werden. Das war ja auch der Plan. Umweltschutz als solchen lächerlich zu machen.",1,1,0,1,1,0
deu_337e9a2ec6deec2e66e97f80af467e63,"Also deiner Meinung nach unterstützen sie Hamas, wollen aber das Hamas entwaffnet wird, und du glaubst die unterstützen den militanten Flügel von Hamas den sie aufgelöst haben wollen? Du verstehst dass du gerade versuchst zwei widersprüchliche positionen zu vereinigen, oder?",0,0,0,0,0,0
deu_9626707683c4766106f62aa39a5a74af,"Klar. Beispiele;

**Demo gegen die AfD**

Auslöser: Die Correctiv Enthüllungen und der Wunsch, diesen Clowns zu zeigen, dass die angeblich ""schweigende Mehrheit"" *nicht* auf ihrer Seite steht.

**Demo gegen @USER

Auslöser: Schnauze voll von Dummschwatz.

**Demo gegen den @USER

Auslöser: Flächenbombardement irakischer Zivilisten",0,1,0,1,1,0
deu_76e8c96b6572dc45d2ef994b453ae464,"Weniger Migration, deutsche Leitkultur, Familie, Religion, keine Gendersprache usw.",1,0,1,1,1,1
deu_2df3e9474144d64254160e732cbff744,Irgendwann in Frieden zu sterben,0,0,0,0,0,0
deu_87fa41fb8b03a15b52feb65af7d7266a,Und keine Ausländer reinlassen!,0,0,0,0,0,0
deu_30732ce223ea008b1089aed202261a18,> Möchtegern progressive protestieren zusammen mit Demokratie und Frauenfeinden zusammen auf einer antisemitischen Demo.,1,1,0,1,1,1
deu_81ff73c39e27cb600829750116def0d8,NDA sag dass du covid hast,0,0,0,0,0,0
deu_2c0d2607f06eee4bb4f416d2a2a4afb7,"naja die Unzufriedenheit ist halt auch subjektiv.

Wenn für einen alles andere außer die jüdische Weltverschwörung zu linksgrün ist dann ist diese Meinung nicht viel wert",1,1,0,1,1,1
deu_a1587c377f90e2b1a367722a88f1e43f,">radikaler Protest ist notwendig

Aber das blockieren von ein paar Straßen ist zu viel?",1,0,0,0,1,1
deu_2673d2c9673eabb6ef9358f8ad41c2ea,"Wer AfD wählt, wählt Putin.",1,1,0,0,1,0
deu_e1b368faa2675c1e48553cf689f60117,"Sind diese linksgrünen Fantasien mit uns im Raum? 

Nix an der Ampel ist linksgrün in einem Ausmaß das relevant wäre",0,1,0,1,0,0
deu_c45ac5a3da2be36870c4c4caddac8498,Es gibt keinen deutschen Islam.,1,1,1,0,1,1
deu_93f7e1f6c39d33599adf7546647d4d21,Glaubst du der politische Islam stellt eine Gefahr für Deutschland dar?,0,0,0,0,0,0
deu_295e132c9e74638fbe766170ab3b54a9,Bund bester Arbeitgeber,0,0,0,0,0,0
deu_111c078f47430e85a4964ad1c7522c60,Aus der Praxis dient das Vermummungsgebot dazu jederzeit einen nicht zu überprüfenden Vorwand zu haben jede beliebige Demonstration an einer für die Einsatzleitung genehmen Stelle gewaltsam auflösen zu können.,0,0,0,0,0,0
deu_5ced791858011064b02d1fb0d3bb4fac,"Was gegen die Inflation tun, mehr bezahlbaren Wohnraum, viel weniger Migration.",0,0,0,0,1,0
deu_25f7d3d3db27a9156b75dbe31f350467,dritter Knopf: Endlich kann man über den Türken schimpfen.,0,0,1,0,1,0
deu_d16bb7bf6fe9205d1cbac9ae15baaf72,Die Spur führt nach Moskau,0,0,0,0,0,0
deu_79c6969a6450a4bef87ac0b509017e36, Sicher das es nur ne Erkältung war ? Schon mal Corona gehabt ? Corona beachädigt zb das Inmunsystem . Vor allem bei wiederholten C Infektionen kumuliert sich das . Damals n Test gemacht ? Hab das selbe seit 8 Wochen nach Corona . Ist halt so .,0,0,0,0,0,0
deu_eedad3a20661e7b42f5438725dcd273f,"Sweet Home
Zombie virus Serie, basierendauf einem sehr guten webcomic",0,0,0,0,0,0
