id,text,stereotype,vilification,dehumanization,extreme_language,lack_of_empathy,invalidation
deu_6b8adea3cb76b862796f7327d4fbc445,"Aber nicht Moskau Inkasso, das sind ja seine Freunde.",0,1,0,0,1,0
deu_84cba9186e6e412bac17530503ec1b5d,die letzte generation verbieten,1,0,1,0,0,0
deu_10177352484d88d0906b39e20f4e2e6a,Kriegsverbrecher tun Kriegsverbrecherdinge. Hoffentlich hat die ukrainische Armee die Bande von Mördern und Folterknechten bald rausgeschmissen.,1,0,1,0,0,0
deu_b09fa2989e4d4ce77e578f75c14bbbb6,"Immigration und Asyl sind ja nicht dasselbe, vielleicht deshalb? Wokie-Kanada wird doch wohl keine Asylbewerber abweisen?",0,1,0,1,0,0
deu_01e2c81e1a1750393b40a40ed9ff3a23,slawen ab in die ukraine?,1,1,0,1,0,0
deu_fa44d8b0a21960f3bd7b2d22e3e9c434,Dass Israel nicht zwischen Hamas und nicht Hamas differenzieren kann oder will ist doch im Endeffekt Thema der aktuellen Party.,0,0,0,0,0,0
deu_56b9cf7c5aac54248164cfedc694e3dc,"Der Vorwurf Reichelts, dass „die Grüne Partei in ihrem Hauptquartier eine eigene Einschüchterungstruppe aus treu ergebenen Polizeibeamten auf""baue ist aber auch an absurdität kaum zu überbieten. 

Die politische Orientierung der meisten deutschen Polizeigewerkschaften ist sehr offensichtlich und sie ist vieles, aber nicht „linksgrün“.",0,0,0,0,0,0
deu_adee8d0002b7c613644bf928783bad46,"Ohne die extremen Hilfe die  Russland aus China, NordKorea, Iran und co bekommen wird Russland nie bei geben. Ohne diese Unterstützung aus den Diktatorischen Länder wäre Russland schon lange weg vom Fenster.",0,0,0,0,1,0
deu_1988ab27589b808509380081a1e07858,"Er ist nicht queer , er ist nur mit einem Mann zusammen. Er und weidel scheinen einiges gemeinsam zu haben.",1,1,0,0,0,0
deu_72ac4e8a8f5f8e390290e09368a1da00,">Natürlich gibt es nur einen richtigen Islam

Natürlich /s",1,0,1,0,1,0
deu_58034a97d62efb2926b502b402675b83,"Es darf bloß niemand erfahren, dass Chrupalla ein Pole ist und Höcke, dessen Familie damals aus Ostpreußen geflohen ist - nicht nur somit ein Flüchtling ist sondern ebenso nicht „Urdeutsch“. ;)",0,0,0,0,0,0
deu_15a3f0c3e01e9114abc5194c864d396a,"Bald kommt Orban noch dazu, dann geht's ab in @USER",0,0,0,0,0,0
deu_c06780636daffb5d77578936b0744740,"> Um diese Forderung umzusetzen müssen ganz viele Leute auf Lastenräder umsteigen, aber scheinbar FFF nicht.

Auch FFF, doch nicht von heute auf morgen und nicht einfach so, sondern mit entsprechendem Ausbau anderer Möglichkeiten- wie dem auch sei, wir sind uns einig uneinig zu sein.",0,0,0,0,0,0
deu_d8a9f72739d89186e0621258058b91be,"Krieg in der Ukraine. Baerbock will Bundeswehrsoldaten in den Krieg schicken. 
FTFY",0,0,0,0,0,0
deu_def1d174cde692189d74b0de7b1fc44b,Quatsch! Hamas sind doch Freunde! Die wollten nur etwas Nachverhandeln!,1,1,1,1,0,0
deu_dc7cf52e703d00310474523b160b202e,OHNE VORHAUT KEIN ASYL!!!,1,0,1,1,1,0
deu_68b4d5389082b98b295f452f8f9a814e,"Ist auch besser für den Umweltschutz. Grün ist, wenn weniger weiterleben.",1,1,1,0,0,0
deu_d6a1e38ff13f6652af7a162c9e7da76e,"Seltsamerweise so gut wie keine leugner im Umkreis, aber traurigerweise relativ viele Leute die Herzprobleme und Entzündungen nach der Impfung bekommen haben. Die etwas andere Abweichung. Ist aber jeder mit klargekommen und hat trotzdem nix gegen die Impfung gesagt .",0,0,0,0,0,0
deu_c86d39be9aa7ad0322f9311e5149e3ca,"'Voices From Gaza' Podcast von The Daily (NY Times). Auf English, sehr hörenswert.

Kennt jemand noch andere Podcasts wo Gaza Bewohner zu Wort kommen?

@USER",0,0,0,0,0,0
deu_da50a0063d4300c0c0a59085505ee32f,Das hab ich in der eigenen sächsische Verwandtschaft - an allem ist die Impfung schuld. Eine leichte Vergesslichkeit bei einem fast 90 jährigen - natürlich die Impfung schuld. Egal welches Gesundheitsthema es ist die Impfung @USER und die verschwiegenen Millionek Toten die noch bei der Impfung explodiert @USER,0,0,0,0,0,0
deu_5c80610f3aaa931e068b997be16b361a,"Nur was Linksgrün will ist Demokratie, der Rest ist Nazi.",1,1,0,1,1,0
deu_b35883720f6497f58f562e2e81ee5aaf,Du hast vor Corona gekauft?,0,0,0,0,0,0
deu_1977a611387162a9c66b6d09d5e1725a,Jan Josef Querdenker oder sowas war da doch,1,1,1,0,0,0
deu_bad84e8d2abaea977d292ea60eb7b345,Glaube das war weniger die Pandemie und mehr die Diskussionen mit Lindner.,0,0,0,0,0,0
deu_8aef24b32610ac93ac1a0e873ea45c00,Du meist als die Araber der UN-Teilungsplan für Palästina nicht akzeptiert haben und dann die Juden zurück ins Meer treiben wollten?,0,1,1,1,0,0
deu_a639d90ebd9b023afcd52bf0561ba2a4,Nei gewichster Türken Kübel XD,0,1,0,1,0,0
deu_dc87f2ceff0b27d21b800f767042660c,"Asyl ist irreguläre Migration und ein wichtiges Menschenrecht, gerade bei der deutschen Vergangenheit.",1,0,0,0,1,0
deu_b8c3cd5abbf9067d5ba7797cd2bb2164,"US Geheimdienste: Das Virus stammt aus einem chinesischen Labor, source: trust me bro",1,0,0,1,1,1
deu_c8ed6d1c024a4f0ea09c9d51f75d3dad,"Kann ich @USER jeder sinnvollen Diskussion sind sofort AfD, Querdenker, Hamas und Russen zur @USER mehr nutzbar",1,0,0,0,1,0
deu_2e3c36218c6ca2f3021e6a544c412e8a,Männer können ja auch schwanger werden und menstruieren 😉 eine wirklich Rechte Ideologie!,0,0,0,0,0,0
deu_9bc5a001348fb0df8affc9ff62fb03f2,Schwere Menschenrechtsverletzungen in Bayern gegen Klima-Aktivisten.,0,0,0,0,0,0
deu_789b2260b5eb5d302ae30f0da0c43af9,Die letzte Generation ist noch eine Nachricht wert? Die werden langsam aber sicher irrelevant.,0,1,0,1,1,1
deu_da3f901990f544923218b9a4001317fe,"Ja, die Hamas ist absolut @USER",0,1,0,1,0,0
deu_98533d5df2af850ace07285b7e83137e,Komisch das Verbote ok sind wenn sie die eigene Ideologie unterstützen.,0,0,0,0,0,0
deu_32273d037a56875fb7982831911d508a,Als der Corona-Lockdown losging.,0,0,0,0,0,0
deu_3a5580bdeb4863ad190653da4e838c6d,russlands angriff auf die ukraine,0,0,0,0,0,0
deu_1925bffd3d2e48f106fee83ae0253ca6,"Das ist eine bösartige Unterstellung!!!!! 

Wir alle wissen, dass die Grünen Schuld daran sind!!!!! Diese Kriegstreiber wollen den dritten Weltkrieg!!!!!!
Deshalb haben sie die Bundeswehr @USER @USER Irgendwas ist hier seltsam?
Hmmmm egal!!!! Die Grünen sind schuld!!!!!

/s falls es nicht genug Ausrufezeichen waren.",1,1,0,1,1,1
deu_c92a720d7e067237be68c2c0a9d062d8,"Gut, da kann ich jetzt nichts sagen. Kann gut sein, dass der „internationale FFF Account“ nichts direkt mit Greta zu tun hat. Ich hab mich auf diesen Artikel bezogen. (Der sagt salopp, dass Greta FFF „mitgegründet“ hat, aber das ist evtl. schwammig formuliert).

Nichtsdestotrotz hat sowohl Greta wohl auf ihrer freitäglichen „Klima“-Demo diese klimafremden (kontroversen) politischen Nachrichten verbreitet, als auch der FFF Kanal auf Instagram. Also ist die Aussage, auf du reagiert hast, meiner Meinung nach ganz richtig.",0,0,0,0,0,0
deu_2d87bb7b9fecad6495d9653afe5f0416,"Ebenso verurteilenswert? Die letzte Generation kämpft für Allgemeingüter, die Bauern für sich selber.",1,1,0,0,1,0
deu_9c3a7b0117e5f131b1cea7daca7452d6,"Und? Ab damit. Moskau greift an, Moskau bekommt Raketen zurück",0,1,0,1,1,0
deu_f1cc0421cab0fba9de3ca485017cd99f,"Schlüsselbund auf dem weg zum 2wöchigen Aussendienst. Unterwegs schon gemerkt. Dachte ist mir an einer bestimmten Raststätte rausgefallen wo ich kurz im Gebüsch war.

Gleich im lokalen Rathaus gemeldet glaub ich, evtl hab ich ihn ja schon bei der Firma wo verloren gehabt, und die Autobahnpozilei angerufen. Die war sogar so nett ist zu besagter Raststätte gefahren und hat geschaut, nix gefunden.

  
War nicht so toll. Neuer Hausschlüssel, Auto vom ADAC aufmachen lassen weil der Zweitschlüssel im Auto lag (duh), @USER",0,0,0,0,0,0
deu_8d47d25aee58c7b536842f3776fbe66e,Schade. Möge Lene in Frieden ruhen,0,0,0,0,0,0
deu_bd767e54e749a5010b2d142ade99faee,"Immer wieder derselbe Quatsch. Russland wird weiterziehen, wenn es nicht gestoppt wird. Russland will nicht verhandeln, Russland will annektieren. Die Nato ist ein Verteidigungsbündnis, keine Gefahr für Russland, sondern wäre vielmehr eine Chance gewesen in eine neue Zukunft mit nie dagewesenem Frieden zu starten Zusammen mit der Nato.",0,0,0,1,1,1
deu_011bdc6d33e05365a91195e0d0a3f30e,Und ein Win für Tiere und Klima!,0,0,0,0,0,0
deu_99c6e1f235212995d90d5df146420aea,Klingt nach einem guten Umfeld für die nächste große Pandemie :).,0,0,0,0,0,0
deu_4064c6307c33ba836bfb6d6a1077f591,"Hamas ist aktuell aber Palästina und Abbas muss selbst auf anti-jüdische Rethorik zurückgreifen um in Palästina gehör zu finden. Das Hamas und somit Palästina die Vernichtung Israels anstrebt steht außerdem auf der Fahne der Förderer von Hamas, in Iran.",0,0,0,0,0,0
deu_157611fb38c9dd5bc91f3f4f74f7c61e,"Hallo, das wohnt in der Schweiz und ist sicher nicht queer",1,1,0,0,0,0
deu_6ea16957f63462ccdabbb70a2c0410de,"Deutschland will Krieg, Propaganda wirkt",1,0,0,1,1,0
deu_b87eb8c68eb6488566ab36a91ae7d3e0,Die ukrainische Säbelfechterin Olga Kharlan hat doe Bronzemedaille gewonnen. Es war die erste Medaille für die Ukraine in Paris.,0,0,0,0,0,0
deu_bcdc101bf51dae7f2903ef64246b5ee4,"Laut Polizei ein Iraker, 3 Türken und 4 Syrer.",0,0,0,0,0,0
deu_b4c28bdfeb37a1707c2191bb665aaab5,Scheiss woke links grün versiffter Kindergarten!,1,1,0,1,0,0
deu_38493a248db5aa13ed03858136ddb554,"Das hat schon was von ""Fitnessclub-Mitgliedschaft für Dicke"", sehr verständlich, das die Mutter da sauer wird. Auf der anderen Seite sind es ja diese Verschwörungsgläubigen, die BILD und AfD und ähnlichen rechtspopulistischen Mist am Laufen halten und ihr ganzes Umfeld stressen, also mindestens ebenso verständlich, dass du etwas ändern willst. 

NDA, aber lass uns wissen, ob deine Mutter hingegangen ist. (VHS ist ja auch nur wieder linksgrün versiffte Staatsfunkpropaganda!1!) Zu wünschen wäre es euch allen, viel Glück.",1,1,1,1,1,0
deu_91f6a2b801587166a02f7878be5425ec,Mehr Verbrauch = Mehr co2 ?,0,0,0,0,0,0
deu_9023dd1caeede5ac6012a2c5405b0d4d,"> Wolodymyr Z.  
  
Moment mal.",0,0,0,0,0,0
deu_a25d6e2de560ee84ec401fcaa6571801,"Das ist keine Freundin, das ist ein Virus. 
Weg damit.",0,0,0,0,0,0
deu_28efa279eea375b043cf0284a444a59b,Nein weil Umweltschutz = Wichtiges Thema für unsere Gesellschaft.,0,0,0,1,1,0
deu_52c9c77e8aa70efead3791b87ad0f603,Für Radinfrastruktur zahlt der Bund dieses Jahr ca. 350 Mio. EUR. Für Seilbahnfantasien 0 EUR. Oder nicht? Welches Seilbahnprojekt fördert der Bund?,0,0,0,0,0,0
deu_fe3f6d1ef52fba2e59b3a4af6b06719c,"Vor 200 Jahren lag der C02-Anteil der Atmosphäre bei 280 ppm. Jetzt liegt er bei 420 ppm (Grafik). Unser CO2-Ausstoß geht bisher nicht zurück. Lediglich das Wachstum ist gebremst (Grafik). In 1000 Jahren wird die Welt, wie wir sie kennen, nicht mehr existieren.",0,0,0,0,0,0
deu_fc9be371af9133e6b6a4cc8d61dd1465,Man kann auch beides machen. Co2 Quellen reduzieren und co2 auffangen. Wir experimentieren tagtäglich mit unserer Umwelt. Experiment ist nicht gleich schlecht,0,0,0,0,0,0
deu_d3593c8e955b4200b9d6c7aa2b6617b1,Gerade die Twitter-Woke-Bubble ist gaaanz vorne mit dabei,0,0,0,0,0,0
deu_9b8d161beab5851893e7d587c8926a47,Ein Gen Z Kanzler würde Krieg sofort mit maximalem Furor beenden weil Krieg Cringe ist.,0,0,0,0,0,0
deu_69cef04658660739ea8f7f15c6c1cf57,Ruhe in Frieden mein Freund 🪦,0,0,0,0,0,0
deu_ec1325d72c92b4e4f6f4d2a7a1ef4b58,"Tatsächlich gilt das bereits für sehr viele Lebensmittel. zB. Schnitzel oder Eiersatz. Einfach nach den Eigenmarken gucken, Rewe, FFF von Penny oder Vemondo von Lidl.",0,0,0,0,0,0
deu_fc189afd27ec6d3a40f63d652ce663cf,"Was bringt ihm eine Impfung, wenn er bereits erkrankt ist?",0,0,0,0,0,0
deu_876944926c227317deec58a6ce8b0d82,"Ich sach ihnen, da geht was um, irgend so ein Virus",1,0,0,0,1,0
deu_da6638f25f232537c33575ef7aae5afc,Wahlkampf für Biden.,0,0,0,0,0,0
deu_ad664869953ce8b056d0517b207def91,Mir liegen Muslime nicht so arg am Herzen das ich in ein Gulag gehen würde,1,1,0,0,1,0
deu_39cc883673dfb1efc0aa43c9a5d9c1ef,RP : Die Russland Partei,0,0,0,0,0,0
deu_3af8fdc8fbe9b70ee22bb72553d54c64,Ahh einen Türken des ziegenfickens zu bezichten. Kein Rassismus hier! Nein nein!,1,0,0,1,1,1
deu_8cbeb37fb8a61017f8e24256987f72be,"Grenzenloses wachstum ist die garantie für umweltschutz wie wir an der ddr gesehen haben, aluhut",1,1,1,1,0,0
deu_8d7ec2b13aad71cb19b4f0adb8df8a40,Waffen die Frieden schaffen.,0,0,0,0,0,0
deu_baedd12665bbcec9e824011bc28929a1,"Das Wort Querdenker war im ursprünglichen Wortsinn und nicht als ""die"" Querdenker gemeint.",0,0,0,0,0,0
deu_0a9462abbbb012950ebaa6d0bf355a09,"Naja wann in dieser Kette das CO2 ausgestoßen wird ist ja egal, generell beruht das E-Fuel Konzept ja darauf CO2 zu Kraftstoff umzuwandeln und wieder auszustoßen aber eben als Kreislauf so wird das CO2 nicht mehr, aber halt auch nicht weniger.",0,0,0,0,0,0
deu_65d9fb5f80daeb2348081da9d5de15d1,Joa nur hat der radikale Islam mehrere Milliarden Budget hinter sich.,1,1,0,0,1,0
deu_5423f2d8b25d0d0b7027b88c45a6f2b0,"Linksgrün- extremes Lager, hast du etwas anderes erwartet?",1,0,0,0,0,0
deu_9341bba3575dc0650a511a3c6081e9fd,"Eine Katze, was denn sonst? Duh",0,0,0,0,0,0
deu_5a552a382557eccfea023a8c0680f70d,Kein Gas aus Russland nach Deutschland = kein Geld aus Deutschland nach Russland. Eigentlich easy.,0,0,0,0,0,0
deu_2bd1299070ad6aff5e19b12a6738a20f,Als nächstes klebt sich noch die Letzte Generation dazu.,1,1,0,0,1,0
deu_469a0d46c7c7cc174ad3c0cbaabc8bc4,"> Herr Kühnert beschränkt es jedoch nur auf Muslime.

Nein, tut er nicht. Er sagt aus den beschriebenen Gruppen vernimmt er häufiger homophobe Kommentare als aus der restlichen Bevölkerung. Damit beschränkt man es nicht auf Muslime. Er sagt nur, da ist es häufiger. ",0,1,0,0,0,0
deu_92b58c6d97f5acb4558c597b4b73a628,"""Waffen haben noch nie Frieden @USER - Ja, so hat man damals Hitler den Frieden nahegebracht :)",0,0,0,0,0,0
deu_08190ca45b21d1854f6d6c9168fbe7c0,Wie sollen die das machen? Die kommen ja nichtmal aus Gaza raus.,0,0,0,0,0,0
deu_a730692b40af4da7ce25334f23d03fd3,"Musste leider mehrmals bei ""pazifische Muslime"" lachen ^^",1,1,0,1,1,1
deu_db1538eadcfcf005486ba3a9ba8069d1,"Die AfD ist eher mega pro-Israel, weil nationalistische rechtsradikale Israelis mit ihrem Araberhass ihre Brüder im Geiste sind und das ein anderer Vorwand ist Muslime zu hassen und super instrumentalisiert werden kann, indem man Muslime unter Generalverdacht stellt antisemitisch zu sein.",0,0,0,0,0,0
deu_94c84f008752bc4cd61347f520d9b944,Technischer Verwaltungsbeamter beim Bund.,0,0,0,0,0,0
deu_d1a1c34994fe61bcd1cae279afed3964,Ha! Wer Faschisten ablehnt ist ein Faschist?! Genau so geht rechte Denke!,1,0,0,0,1,1
deu_801a732d611459d186ad30ce9186f6cb,Für psychosomatische Ursachen von Krankheiten und das Wechselspiel von Immunsystem und Psyche  gibt's sogar einen eigenen Forschungsbereich: Psychoneuroimmunologie,0,0,0,0,0,0
deu_0e7a793cf3394305c0c0a50da4238a90,Frieden durch überlegene Feuerkraft. ,0,0,0,0,0,0
deu_bd7ee684f6c7adf900acd9fcd0bd003c,"Es gibt ein paar Jüdische Untergruppen die Zionismus klar ablehnen, namentlich zum Beispiel die Satmar Hasidic Juden und die Neturei Karta, beide Gruppen sind sehr Orthodox Jüdisch geprägt, sind das jetzt alles Antisemiten?",0,0,0,0,0,0
deu_5eb5bc59729be48c9001b912c6139a4e,">jegliche Gender-Debatten

Es gibt nur 2 Geschlechter - und deswegen wähle ich Nazis?",1,1,0,1,0,0
deu_228e9e8bf30aa295a20335e896a81488,"Klarer Fall: dein Freund ist in Wirklichkeit eine Transfrau und du bist lesbisch. Ach nee, Transfrauen gibt es ja gar nicht.

Ich frage mich manchmal, wie es bei Rechten zuhause aussieht und ob diese Leute überhaupt in der Lage sind, eine glückliche Beziehung zu führen.",1,1,1,1,1,1
deu_d1f331bf2d0051fffe2e230259f88052,"Es sind Luftangriffe gegen Hamas.

Israel bekämpft keine Zivilisten.",0,0,0,0,1,1
deu_b4664ee7565013a5739bc1d1d63ec3e0,Israel gehört zum Nahen Osten.,0,0,0,0,0,0
deu_bf84ebf5cff9fef0315e68f8248a6deb,"Eine Frage, die mal nichts mit dem schrecklichen Krieg zu tun hat: 

Was sind deiner Meinung nach die schönsten Orte in Kyjiw, die man bei einem Besuch unbedingt sehen sollte?


Und welche Variante des Namens ist vor Ort eigentlich geläufiger? Киев/Kiew oder Київ/Kyjiw?
Sowohl schriftlich als auch mündlich?^^",0,0,0,0,0,0
deu_7af436e80aacc62106653b13f3b95341,und das weiß die russische regierung leider auch.,0,0,0,0,0,0
deu_c3a1f2dbc29091f4fae0b7395dd2056a,"Wenn du beim doc um ne Impfung betteln musst, läuft was falsch.",0,0,0,0,0,0
deu_7e274e257bc364e7b48e2ea230dd6b66,Ergibt natürlich Sinn eine Zeit der wirtschaftlichen Stärke mit einer Pandemie und Kriegszeit zu vergleichen.,0,0,0,0,0,0
deu_493d1e22b65a66f7c5fc6a03b006b4cf,"Ein gefährliches Virus, das sich weltweit ausbreitet und vor allem ältere Risikogruppen tötet, wäre mal nicht schlecht. Sarkastisches /s.",0,1,1,1,1,1
deu_4a388b4b8d5e0cf7b420460437a8a321,"Da diese in Fester form gut kontrolliert und verpackt sind, nein. Genauso ist ja auch Arsen aus der Produktion für EE keine ""Emission"" der EE, das wäre Absurd. Es ist ein Abfallprodukt, womit man aber gut umgehen kann.

Nur mal so am Rande: Bei der Kohleverbrennung, welche dank Atomausstieg stärker ist als nötig, werden radioaktive Stoffe einfach so in die Luft geblasen, ohne das es jemanden Interessiert.",1,0,0,0,1,0
deu_35ca63bab9392f5730716426c1743c56,"Ok um die Wortklauberei zu beenden. Israel setzt Methoden der Apartheid an, in dem von Israel Völkerrechtswidrig besetzten Gebiet.",1,1,1,0,0,0
deu_c6041e6e4d1d9ead8315dcac07b8edb6,"Das Flugzeug des Präsidenten könnte entführt und gezielt über dem Gebiet abstürzen gelassen werden. Er könnte dann vom selbsterklärten Herrscher der Region gefangen genommen und als Geisel festgehalten werden, und die Regierung könnte sich gezwungen sehen, einen Sträfling und ehemaligen Elitesoldaten darauf anzusetzen, den Präsidenten zu @USER",0,0,0,0,0,0
deu_984f9f22b0048049a2a1c65e87bd9273,"Oder die Türken integrieren sich.  
Toll mit einem AFDler zu schreiben /s",1,1,0,0,0,0
deu_86d9ea9789ebe2fd4388e1dd8016aaf0,Letzte Option wäre nachts um 3 beim Zahnarzt zu Hause aufzutauchen und die Kinder als Geisel zu nehmen bis der Termin aus seinem scheiß Buch verschwunden ist. Aber @USER irgendwo dazwischen.,0,1,0,1,1,0
deu_608782a0dcfa2198305c38b0d239b4dd,"\> getrennten McDonald's Filialen in Israel

milch und fleisch oder juden und nicht-juden getrennt /s",1,1,0,0,1,0
deu_b997338f5d83f4d2e7aac8f2bec9a9a1,Faschismus ist eine Ideologie für Bullies. Wofür sind Kinder und Teenager bekannt?,1,1,0,1,0,0
deu_e08b9a0304f494fa7d2f573f26f3e943,"Archiv:

*Frankreich: Gynäkologe weigert sich, Transfrau zu untersuchen*  
@USER",0,1,1,0,0,0
deu_9dbf289f5749cd7dd4af5c390b4bfc69,"Nein. Das Virus muss in die Blutlaufbahn gelangen.   
Durch harte Penetration des Anus oder Vulva könne Risse in der Innenhaut entstehen - da kommt das HIV Virus durch.   
Menschen die Zahnfleischbluten haben sollten deswegen auch kein Cock ohne Gummi in den Mund nehmen.",0,0,0,0,0,0
deu_51acea0a54005cefe774398bd7f6e107,Faschist sein macht das Leben doch echt viel einfacher.,1,1,0,0,1,0
deu_bc7b6b98ba1f85330a053bc636ff4619,Besonderer Putin-Tee.,0,0,0,0,0,0
deu_dcc83b6fb151122003e61f8a71e3acd4,Seit über 75 Jahren in Frieden zu leben,0,0,0,0,0,0
deu_ec0b752fc5b3feb773f1360ae5b43981,">Dialog gibt's nicht, weil andere Ansicht = Faschist.

Das geäußerte sind keine ""Ansichten"" sondern AfD-Gefasel und die AfD ist eine faschistische rechtsextreme Partei.",1,1,1,0,1,1
deu_6f84bf487deec649518a67f845732327,"Sowas kann man auch nur sagen, wenn man mit komplett abgekapselt in seiner Bubble lebt und absolut keine Ahnung von der LGB History hat. Bestes Beispiel: Fred Sargeant. Lebenslanger schwuler Aktivist der es ablehnt queer genannt zu werden. 

Ich weiß auch nicht was der Geschichtsrevisionismus soll. Bis vor ein paar Jahren hat keiner von einer politischen Queer Bewegung gesprochen. Da war das noch LGBT.",1,0,0,0,1,1
deu_4ba688ed83c6c96a55ec94611cfa2c78,Meinst du aus der Woke Culture aussteigen?,0,0,0,0,0,0
deu_be983c09c4bcf0c830e0d08fc73e3d33,Die meisten Menschen in Thüringen wollen anscheinend striktere Regeln beim Thema Migration.,0,0,0,0,0,0
deu_c9810f0648076ad620e0ad5a0d3c4cdc,verlinkt russische propaganda. Beweisführung abgeschlossen.,0,1,0,1,0,1
deu_9f21dbcd2a25cc452fb892c181c64581,Linke @USER Wahrscheinlich irgendwas mit gender studiert,1,0,0,0,0,0
deu_d69fd76b46674e367edc7f6b83ab1998,"Wenn Israel doch nur das allein machen würde, dann würde es jetzt nicht so dastehen wie Israel es eben tut.",0,0,0,0,0,0
deu_f33fc76d2fc5ece3b651048207f6727c,"\*Ideologie.

Gibt da einige ideologisch aufgeladene Flaggen die ""eigentlich neutral"" sind.",0,0,0,0,0,0
deu_26fd557fe900a1c087b2936ee0ffca71,"Achso und hat ja nur so 200 Geiseln noch in Gaza, ""Verteidigung abgeschlossen""",0,0,0,0,0,0
deu_0312c51f3688e05a474eef01cc7b5203,Gender bias  + angenommen deutlich höhere durchschnittliche Quote. Oder was denkst du zu Quote M/F?,0,0,0,0,0,0
deu_a00134520de2952411bc2016bf67d322,ALLES WAS ICH NICHT MAG IST WOKE 😡😡😡,1,1,1,1,0,0
deu_cbb5faa378a7389b3ecd675faf5bfe85,"früher war alles anders @USER

manches war besser, manches ist heute besser.",0,0,0,0,0,0
deu_73af8d2f09a135ccb3e56c2be4ca56e7,Die Aufmerksamkeit kommt durch das lahmlegen des Verkehrs offensichtlich. Die letzte Generation hatte ja auch genug Medienaufmerksamkeit. FFF hat halt niemanden abgefuckt,1,0,0,1,0,0
deu_f58d3e23a242a32e3a85e0babfbccbb5,"Ja, und der Islam gehört zu Deutschland!1!!1",0,1,0,0,1,0
deu_921353c86cf867f7d08ed136270669ca,"Ahahaha, Völkerrechtsverletzungen und deine verrückten Verharmlosungen zu benennen ist jetzt „Israel-Bashing“… 

 Betreibt der IGH auch „Israel-Bashing“?",0,0,0,0,0,0
deu_0b133a0e50d4222d6d24ce3ab2899497,"Nee, eben nicht, im Gegenteil. LG verbessert den Ruf von FFF, indem sie die als die Besseren dastehen lassen. Wer vorher FFF schon zu radikal fand, kann die jetzt unterstützen, weil sie weniger radikal sind als LG. Das ist der Kern der Radical-Flanks-Theorie und wissenschaftlich untersucht:

@USER",0,0,0,0,0,0
deu_6a07d86b59269b48ba52ecdc28e17220,Du willst eine russische Frau?,0,0,0,0,0,0
deu_4fd5dc59883c7fe2eba4b13bf2c82f5f,"Ich weiß nicht, ob Sahra Wagenknecht eine russische Agentin ist. Die Frage, ob Sahra Wagenknecht eine russische Agentin ist, drängt sich mir aber jeden Tag auf. Ich google jeden Tag ""Sahra Wagenknecht Spion"" ""Sahra Wagenknecht russische Agentin"" und ""Sahra Wagenknecht KGB Agentin"". Ich hoffe so eines Tages die Antwort zu finden, ob Sahra Wagenknecht vielleicht wirklich eine russische Agentin sein könnte. Ob Sahra Wagenknecht wirklich eine russische Spionin ist, weiß am Ende nur die russische Regierung, sollte sie Sahra Wagenknecht als KGB-Spionin angeheuert haben. Es wäre wirklich schade, wenn sich herausstellen würde, dass Sahra Wagenknecht die Deutsche Bevölkerung und die der Ukraine an Russland verraten hätte.",1,1,0,1,0,0
deu_4a5a65e3a051a482e053d2dcf1d290fb,"""Alle Optionen offen"" reicht aber von Russland unterstützen bis Russland angreifen. Es macht schon Sinn einige davon im Vorfeld auszuschließen.",0,0,0,0,0,0
deu_2aa5cdbe325bc678b97157949f80e01e,Schuldenbremse und schwarze Null entspringen ja auch der gleichen Ideologie.,0,0,0,0,0,0
deu_f6efba4f1f32f46c71626aee063ccf92,"Was sind denn weitere Beispiele für eine therapeutische Impfung?

Dass es noch weitere Arten der Impfung gibt habe ich lustigerweise durchs Kochen gelernt - Joghurt wird auch ""geimpft"", aber nicht, damit sich keine Bakterien dort ansiedeln, sondern im Gegenteil.",0,0,0,0,0,0
deu_beb7013c119107fe0000962e713d19ca,Rechts ist eine legitime Meinung. Jeder der etwas anderes behauptet ist Faschist.,0,1,1,1,1,1
deu_84655410bdbded3276635245466a0c0a,"Ja du bisset. Fakten 1:1 von ARD und der Blöd Zeitung wiederkauen. Aber bei genügend linksgrün siff um einen herum, gibt's dann halt Applaus.",1,1,1,1,0,0
deu_1ba29757adf58acaaa7b9a05d02d75cf,"Oder bewusst machen wenn der geimpfte Nachbar eine Gartenparty plant.

Alter Querdenker-Trick.",1,1,0,0,0,0
deu_06fedee5573a3edc39033cb9d424a51c,"wäre dann der Tag der Deutschen Keimheit gewesen

(ja ich weiß, Virus, nicht Keim, mir egal für den Spruch)",1,0,0,0,1,0
deu_ddeb3f9b70c8107c50ba5a969bb34eda,"Naja, wir haben seit 45 Frieden.",0,0,0,0,0,0
deu_682d7289e25da97b7c4eaf389daf5f44,Das hab ich auch gesagt! Da ist jeder Virus und jede Bakterie drin die es auf der Welt gibt 🙈,0,0,0,0,1,1
deu_f71312e727c21857bbaca63ac09fd0a0,"Ne, mittlerweile kannst den Standard echt vergessen. Linksgrün und ultrahart feministisch, sobald irgendwas nicht-linkes kommt ist es gleich schlecht oder ""problematisch"". Das hat nichts mehr mit liberal oder humanistisch zu tun.",1,1,0,1,1,0
deu_d2bc05e72983fa2065beec7a211c2880,"Der Titel allein ist schon so dumm. ""zu woke"" als würde woke nicht einfach bedeuten, dass man sich sozialer misstände bewusst ist und die versucht zu verbessern. wenn man jemanden als ""zu woke"" bezeichnet, impliziert man damit, dass man gewisse soziale misstände gut findet und sie beibehalten möchte.",1,0,0,1,0,0
deu_3193fedd55b98cfe37c02e0cdf6316d5,"🫣 dass die Impfung nicht ganz so Nebenwirkungsfrei ist, sollte ja mittlerweile bekannt sein",0,0,0,0,0,0
deu_0a77d9508ad6167267d45b3ac0cfb43b,"> oder einfach der Geist der Mitglieder?

Da man ihn beim deutschen FFF genau wegen sowas rausgeworfen hat, wohl kaum.",0,0,0,0,0,0
deu_103c8dea9b8e34b68b9a078f575e7dba,"Haben wir doch: Richtigdenker, Woke, Vertreter der aktuellen @USER",0,0,0,0,0,0
deu_d96de9bb4fa2f3bad693c17df7534272,"Lenin entschied, dass das russische Industriegebiet Donbass an die Ukraine angegliedert wurde, damit die landwirtschaftliche Prägung der Ukraine ausgeglichen werden sollte durch Industriearbeiter. Später vermachte Cruschtschow die Krim der Ukraine. Das ist historisch.",0,0,0,0,0,0
deu_6980572c4e7299576eb4214c0198ee32,"Ich gehe davon aus, dass der Putin-Unterstützer Trump im Falle eines Falles Putin militärisch unterstützen würde.",1,0,0,1,0,0
